{
  "address": "0x16C1Ed9148e1EF1a5369Aab53EcccB9211CBC71D",
  "abi": [
    {
      "constant": true,
      "inputs": [],
      "name": "name",
      "outputs": [
        {
          "name": "",
          "type": "string"
        }
      ],
      "payable": false,
      "stateMutability": "view",
      "type": "function"
    },
    {
      "constant": true,
      "inputs": [],
      "name": "tokenTransferProxy",
      "outputs": [
        {
          "name": "",
          "type": "address"
        }
      ],
      "payable": false,
      "stateMutability": "view",
      "type": "function"
    },
    {
      "constant": true,
      "inputs": [
        {
          "name": "target",
          "type": "address"
        },
        {
          "name": "calldata",
          "type": "bytes"
        },
        {
          "name": "extradata",
          "type": "bytes"
        }
      ],
      "name": "staticCall",
      "outputs": [
        {
          "name": "result",
          "type": "bool"
        }
      ],
      "payable": false,
      "stateMutability": "view",
      "type": "function"
    },
    {
      "constant": false,
      "inputs": [
        {
          "name": "newMinimumMakerProtocolFee",
          "type": "uint256"
        }
      ],
      "name": "changeMinimumMakerProtocolFee",
      "outputs": [],
      "payable": false,
      "stateMutability": "nonpayable",
      "type": "function"
    },
    {
      "constant": false,
      "inputs": [
        {
          "name": "newMinimumTakerProtocolFee",
          "type": "uint256"
        }
      ],
      "name": "changeMinimumTakerProtocolFee",
      "outputs": [],
      "payable": false,
      "stateMutability": "nonpayable",
      "type": "function"
    },
    {
      "constant": true,
      "inputs": [
        {
          "name": "array",
          "type": "bytes"
        },
        {
          "name": "desired",
          "type": "bytes"
        },
        {
          "name": "mask",
          "type": "bytes"
        }
      ],
      "name": "guardedArrayReplace",
      "outputs": [
        {
          "name": "",
          "type": "bytes"
        }
      ],
      "payable": false,
      "stateMutability": "pure",
      "type": "function"
    },
    {
      "constant": true,
      "inputs": [],
      "name": "minimumTakerProtocolFee",
      "outputs": [
        {
          "name": "",
          "type": "uint256"
        }
      ],
      "payable": false,
      "stateMutability": "view",
      "type": "function"
    },
    {
      "constant": true,
      "inputs": [],
      "name": "codename",
      "outputs": [
        {
          "name": "",
          "type": "string"
        }
      ],
      "payable": false,
      "stateMutability": "view",
      "type": "function"
    },
    {
      "constant": true,
      "inputs": [
        {
          "name": "addr",
          "type": "address"
        }
      ],
      "name": "testCopyAddress",
      "outputs": [
        {
          "name": "",
          "type": "bytes"
        }
      ],
      "payable": false,
      "stateMutability": "pure",
      "type": "function"
    },
    {
      "constant": true,
      "inputs": [
        {
          "name": "arrToCopy",
          "type": "bytes"
        }
      ],
      "name": "testCopy",
      "outputs": [
        {
          "name": "",
          "type": "bytes"
        }
      ],
      "payable": false,
      "stateMutability": "pure",
      "type": "function"
    },
    {
      "constant": true,
      "inputs": [
        {
          "name": "addrs",
          "type": "address[7]"
        },
        {
          "name": "uints",
          "type": "uint256[9]"
        },
        {
          "name": "feeMethod",
          "type": "uint8"
        },
        {
          "name": "side",
          "type": "uint8"
        },
        {
          "name": "saleKind",
          "type": "uint8"
        },
        {
          "name": "howToCall",
          "type": "uint8"
        },
        {
          "name": "calldata",
          "type": "bytes"
        },
        {
          "name": "replacementPattern",
          "type": "bytes"
        },
        {
          "name": "staticExtradata",
          "type": "bytes"
        }
      ],
      "name": "calculateCurrentPrice_",
      "outputs": [
        {
          "name": "",
          "type": "uint256"
        }
      ],
      "payable": false,
      "stateMutability": "view",
      "type": "function"
    },
    {
      "constant": false,
      "inputs": [
        {
          "name": "newProtocolFeeRecipient",
          "type": "address"
        }
      ],
      "name": "changeProtocolFeeRecipient",
      "outputs": [],
      "payable": false,
      "stateMutability": "nonpayable",
      "type": "function"
    },
    {
      "constant": true,
      "inputs": [],
      "name": "version",
      "outputs": [
        {
          "name": "",
          "type": "string"
        }
      ],
      "payable": false,
      "stateMutability": "view",
      "type": "function"
    },
    {
      "constant": true,
      "inputs": [
        {
          "name": "buyCalldata",
          "type": "bytes"
        },
        {
          "name": "buyReplacementPattern",
          "type": "bytes"
        },
        {
          "name": "sellCalldata",
          "type": "bytes"
        },
        {
          "name": "sellReplacementPattern",
          "type": "bytes"
        }
      ],
      "name": "orderCalldataCanMatch",
      "outputs": [
        {
          "name": "",
          "type": "bool"
        }
      ],
      "payable": false,
      "stateMutability": "pure",
      "type": "function"
    },
    {
      "constant": true,
      "inputs": [
        {
          "name": "addrs",
          "type": "address[7]"
        },
        {
          "name": "uints",
          "type": "uint256[9]"
        },
        {
          "name": "feeMethod",
          "type": "uint8"
        },
        {
          "name": "side",
          "type": "uint8"
        },
        {
          "name": "saleKind",
          "type": "uint8"
        },
        {
          "name": "howToCall",
          "type": "uint8"
        },
        {
          "name": "calldata",
          "type": "bytes"
        },
        {
          "name": "replacementPattern",
          "type": "bytes"
        },
        {
          "name": "staticExtradata",
          "type": "bytes"
        },
        {
          "name": "v",
          "type": "uint8"
        },
        {
          "name": "r",
          "type": "bytes32"
        },
        {
          "name": "s",
          "type": "bytes32"
        }
      ],
      "name": "validateOrder_",
      "outputs": [
        {
          "name": "",
          "type": "bool"
        }
      ],
      "payable": false,
      "stateMutability": "view",
      "type": "function"
    },
    {
      "constant": true,
      "inputs": [
        {
          "name": "side",
          "type": "uint8"
        },
        {
          "name": "saleKind",
          "type": "uint8"
        },
        {
          "name": "basePrice",
          "type": "uint256"
        },
        {
          "name": "extra",
          "type": "uint256"
        },
        {
          "name": "listingTime",
          "type": "uint256"
        },
        {
          "name": "expirationTime",
          "type": "uint256"
        }
      ],
      "name": "calculateFinalPrice",
      "outputs": [
        {
          "name": "",
          "type": "uint256"
        }
      ],
      "payable": false,
      "stateMutability": "view",
      "type": "function"
    },
    {
      "constant": true,
      "inputs": [],
      "name": "protocolFeeRecipient",
      "outputs": [
        {
          "name": "",
          "type": "address"
        }
      ],
      "payable": false,
      "stateMutability": "view",
      "type": "function"
    },
    {
      "constant": false,
      "inputs": [],
      "name": "renounceOwnership",
      "outputs": [],
      "payable": false,
      "stateMutability": "nonpayable",
      "type": "function"
    },
    {
      "constant": true,
      "inputs": [
        {
          "name": "addrs",
          "type": "address[7]"
        },
        {
          "name": "uints",
          "type": "uint256[9]"
        },
        {
          "name": "feeMethod",
          "type": "uint8"
        },
        {
          "name": "side",
          "type": "uint8"
        },
        {
          "name": "saleKind",
          "type": "uint8"
        },
        {
          "name": "howToCall",
          "type": "uint8"
        },
        {
          "name": "calldata",
          "type": "bytes"
        },
        {
          "name": "replacementPattern",
          "type": "bytes"
        },
        {
          "name": "staticExtradata",
          "type": "bytes"
        }
      ],
      "name": "hashOrder_",
      "outputs": [
        {
          "name": "",
          "type": "bytes32"
        }
      ],
      "payable": false,
      "stateMutability": "pure",
      "type": "function"
    },
    {
      "constant": true,
      "inputs": [
        {
          "name": "addrs",
          "type": "address[14]"
        },
        {
          "name": "uints",
          "type": "uint256[18]"
        },
        {
          "name": "feeMethodsSidesKindsHowToCalls",
          "type": "uint8[8]"
        },
        {
          "name": "calldataBuy",
          "type": "bytes"
        },
        {
          "name": "calldataSell",
          "type": "bytes"
        },
        {
          "name": "replacementPatternBuy",
          "type": "bytes"
        },
        {
          "name": "replacementPatternSell",
          "type": "bytes"
        },
        {
          "name": "staticExtradataBuy",
          "type": "bytes"
        },
        {
          "name": "staticExtradataSell",
          "type": "bytes"
        }
      ],
      "name": "ordersCanMatch_",
      "outputs": [
        {
          "name": "",
          "type": "bool"
        }
      ],
      "payable": false,
      "stateMutability": "view",
      "type": "function"
    },
    {
      "constant": false,
      "inputs": [
        {
          "name": "addrs",
          "type": "address[7]"
        },
        {
          "name": "uints",
          "type": "uint256[9]"
        },
        {
          "name": "feeMethod",
          "type": "uint8"
        },
        {
          "name": "side",
          "type": "uint8"
        },
        {
          "name": "saleKind",
          "type": "uint8"
        },
        {
          "name": "howToCall",
          "type": "uint8"
        },
        {
          "name": "calldata",
          "type": "bytes"
        },
        {
          "name": "replacementPattern",
          "type": "bytes"
        },
        {
          "name": "staticExtradata",
          "type": "bytes"
        },
        {
          "name": "orderbookInclusionDesired",
          "type": "bool"
        }
      ],
      "name": "approveOrder_",
      "outputs": [],
      "payable": false,
      "stateMutability": "nonpayable",
      "type": "function"
    },
    {
      "constant": true,
      "inputs": [],
      "name": "registry",
      "outputs": [
        {
          "name": "",
          "type": "address"
        }
      ],
      "payable": false,
      "stateMutability": "view",
      "type": "function"
    },
    {
      "constant": true,
      "inputs": [],
      "name": "minimumMakerProtocolFee",
      "outputs": [
        {
          "name": "",
          "type": "uint256"
        }
      ],
      "payable": false,
      "stateMutability": "view",
      "type": "function"
    },
    {
      "constant": true,
      "inputs": [
        {
          "name": "addrs",
          "type": "address[7]"
        },
        {
          "name": "uints",
          "type": "uint256[9]"
        },
        {
          "name": "feeMethod",
          "type": "uint8"
        },
        {
          "name": "side",
          "type": "uint8"
        },
        {
          "name": "saleKind",
          "type": "uint8"
        },
        {
          "name": "howToCall",
          "type": "uint8"
        },
        {
          "name": "calldata",
          "type": "bytes"
        },
        {
          "name": "replacementPattern",
          "type": "bytes"
        },
        {
          "name": "staticExtradata",
          "type": "bytes"
        }
      ],
      "name": "hashToSign_",
      "outputs": [
        {
          "name": "",
          "type": "bytes32"
        }
      ],
      "payable": false,
      "stateMutability": "pure",
      "type": "function"
    },
    {
      "constant": true,
      "inputs": [
        {
          "name": "",
          "type": "bytes32"
        }
      ],
      "name": "cancelledOrFinalized",
      "outputs": [
        {
          "name": "",
          "type": "bool"
        }
      ],
      "payable": false,
      "stateMutability": "view",
      "type": "function"
    },
    {
      "constant": true,
      "inputs": [],
      "name": "owner",
      "outputs": [
        {
          "name": "",
          "type": "address"
        }
      ],
      "payable": false,
      "stateMutability": "view",
      "type": "function"
    },
    {
      "constant": true,
      "inputs": [],
      "name": "exchangeToken",
      "outputs": [
        {
          "name": "",
          "type": "address"
        }
      ],
      "payable": false,
      "stateMutability": "view",
      "type": "function"
    },
    {
      "constant": false,
      "inputs": [
        {
          "name": "addrs",
          "type": "address[7]"
        },
        {
          "name": "uints",
          "type": "uint256[9]"
        },
        {
          "name": "feeMethod",
          "type": "uint8"
        },
        {
          "name": "side",
          "type": "uint8"
        },
        {
          "name": "saleKind",
          "type": "uint8"
        },
        {
          "name": "howToCall",
          "type": "uint8"
        },
        {
          "name": "calldata",
          "type": "bytes"
        },
        {
          "name": "replacementPattern",
          "type": "bytes"
        },
        {
          "name": "staticExtradata",
          "type": "bytes"
        },
        {
          "name": "v",
          "type": "uint8"
        },
        {
          "name": "r",
          "type": "bytes32"
        },
        {
          "name": "s",
          "type": "bytes32"
        }
      ],
      "name": "cancelOrder_",
      "outputs": [],
      "payable": false,
      "stateMutability": "nonpayable",
      "type": "function"
    },
    {
      "constant": false,
      "inputs": [
        {
          "name": "addrs",
          "type": "address[14]"
        },
        {
          "name": "uints",
          "type": "uint256[18]"
        },
        {
          "name": "feeMethodsSidesKindsHowToCalls",
          "type": "uint8[8]"
        },
        {
          "name": "calldataBuy",
          "type": "bytes"
        },
        {
          "name": "calldataSell",
          "type": "bytes"
        },
        {
          "name": "replacementPatternBuy",
          "type": "bytes"
        },
        {
          "name": "replacementPatternSell",
          "type": "bytes"
        },
        {
          "name": "staticExtradataBuy",
          "type": "bytes"
        },
        {
          "name": "staticExtradataSell",
          "type": "bytes"
        },
        {
          "name": "vs",
          "type": "uint8[2]"
        },
        {
          "name": "rssMetadata",
          "type": "bytes32[5]"
        }
      ],
      "name": "atomicMatch_",
      "outputs": [],
      "payable": true,
      "stateMutability": "payable",
      "type": "function"
    },
    {
      "constant": true,
      "inputs": [
        {
          "name": "addrs",
          "type": "address[7]"
        },
        {
          "name": "uints",
          "type": "uint256[9]"
        },
        {
          "name": "feeMethod",
          "type": "uint8"
        },
        {
          "name": "side",
          "type": "uint8"
        },
        {
          "name": "saleKind",
          "type": "uint8"
        },
        {
          "name": "howToCall",
          "type": "uint8"
        },
        {
          "name": "calldata",
          "type": "bytes"
        },
        {
          "name": "replacementPattern",
          "type": "bytes"
        },
        {
          "name": "staticExtradata",
          "type": "bytes"
        }
      ],
      "name": "validateOrderParameters_",
      "outputs": [
        {
          "name": "",
          "type": "bool"
        }
      ],
      "payable": false,
      "stateMutability": "view",
      "type": "function"
    },
    {
      "constant": true,
      "inputs": [],
      "name": "INVERSE_BASIS_POINT",
      "outputs": [
        {
          "name": "",
          "type": "uint256"
        }
      ],
      "payable": false,
      "stateMutability": "view",
      "type": "function"
    },
    {
      "constant": true,
      "inputs": [
        {
          "name": "addrs",
          "type": "address[14]"
        },
        {
          "name": "uints",
          "type": "uint256[18]"
        },
        {
          "name": "feeMethodsSidesKindsHowToCalls",
          "type": "uint8[8]"
        },
        {
          "name": "calldataBuy",
          "type": "bytes"
        },
        {
          "name": "calldataSell",
          "type": "bytes"
        },
        {
          "name": "replacementPatternBuy",
          "type": "bytes"
        },
        {
          "name": "replacementPatternSell",
          "type": "bytes"
        },
        {
          "name": "staticExtradataBuy",
          "type": "bytes"
        },
        {
          "name": "staticExtradataSell",
          "type": "bytes"
        }
      ],
      "name": "calculateMatchPrice_",
      "outputs": [
        {
          "name": "",
          "type": "uint256"
        }
      ],
      "payable": false,
      "stateMutability": "view",
      "type": "function"
    },
    {
      "constant": true,
      "inputs": [
        {
          "name": "",
          "type": "bytes32"
        }
      ],
      "name": "approvedOrders",
      "outputs": [
        {
          "name": "",
          "type": "bool"
        }
      ],
      "payable": false,
      "stateMutability": "view",
      "type": "function"
    },
    {
      "constant": false,
      "inputs": [
        {
          "name": "newOwner",
          "type": "address"
        }
      ],
      "name": "transferOwnership",
      "outputs": [],
      "payable": false,
      "stateMutability": "nonpayable",
      "type": "function"
    },
    {
      "inputs": [
        {
          "name": "registryAddress",
          "type": "address"
        },
        {
          "name": "tokenTransferProxyAddress",
          "type": "address"
        },
        {
          "name": "tokenAddress",
          "type": "address"
        },
        {
          "name": "protocolFeeAddress",
          "type": "address"
        }
      ],
      "payable": false,
      "stateMutability": "nonpayable",
      "type": "constructor"
    },
    {
      "anonymous": false,
      "inputs": [
        {
          "indexed": true,
          "name": "hash",
          "type": "bytes32"
        },
        {
          "indexed": false,
          "name": "exchange",
          "type": "address"
        },
        {
          "indexed": true,
          "name": "maker",
          "type": "address"
        },
        {
          "indexed": false,
          "name": "taker",
          "type": "address"
        },
        {
          "indexed": false,
          "name": "makerRelayerFee",
          "type": "uint256"
        },
        {
          "indexed": false,
          "name": "takerRelayerFee",
          "type": "uint256"
        },
        {
          "indexed": false,
          "name": "makerProtocolFee",
          "type": "uint256"
        },
        {
          "indexed": false,
          "name": "takerProtocolFee",
          "type": "uint256"
        },
        {
          "indexed": true,
          "name": "feeRecipient",
          "type": "address"
        },
        {
          "indexed": false,
          "name": "feeMethod",
          "type": "uint8"
        },
        {
          "indexed": false,
          "name": "side",
          "type": "uint8"
        },
        {
          "indexed": false,
          "name": "saleKind",
          "type": "uint8"
        },
        {
          "indexed": false,
          "name": "target",
          "type": "address"
        }
      ],
      "name": "OrderApprovedPartOne",
      "type": "event"
    },
    {
      "anonymous": false,
      "inputs": [
        {
          "indexed": true,
          "name": "hash",
          "type": "bytes32"
        },
        {
          "indexed": false,
          "name": "howToCall",
          "type": "uint8"
        },
        {
          "indexed": false,
          "name": "calldata",
          "type": "bytes"
        },
        {
          "indexed": false,
          "name": "replacementPattern",
          "type": "bytes"
        },
        {
          "indexed": false,
          "name": "staticTarget",
          "type": "address"
        },
        {
          "indexed": false,
          "name": "staticExtradata",
          "type": "bytes"
        },
        {
          "indexed": false,
          "name": "paymentToken",
          "type": "address"
        },
        {
          "indexed": false,
          "name": "basePrice",
          "type": "uint256"
        },
        {
          "indexed": false,
          "name": "extra",
          "type": "uint256"
        },
        {
          "indexed": false,
          "name": "listingTime",
          "type": "uint256"
        },
        {
          "indexed": false,
          "name": "expirationTime",
          "type": "uint256"
        },
        {
          "indexed": false,
          "name": "salt",
          "type": "uint256"
        },
        {
          "indexed": false,
          "name": "orderbookInclusionDesired",
          "type": "bool"
        }
      ],
      "name": "OrderApprovedPartTwo",
      "type": "event"
    },
    {
      "anonymous": false,
      "inputs": [
        {
          "indexed": true,
          "name": "hash",
          "type": "bytes32"
        }
      ],
      "name": "OrderCancelled",
      "type": "event"
    },
    {
      "anonymous": false,
      "inputs": [
        {
          "indexed": false,
          "name": "buyHash",
          "type": "bytes32"
        },
        {
          "indexed": false,
          "name": "sellHash",
          "type": "bytes32"
        },
        {
          "indexed": true,
          "name": "maker",
          "type": "address"
        },
        {
          "indexed": true,
          "name": "taker",
          "type": "address"
        },
        {
          "indexed": false,
          "name": "price",
          "type": "uint256"
        },
        {
          "indexed": true,
          "name": "metadata",
          "type": "bytes32"
        }
      ],
      "name": "OrdersMatched",
      "type": "event"
    },
    {
      "anonymous": false,
      "inputs": [
        {
          "indexed": true,
          "name": "previousOwner",
          "type": "address"
        }
      ],
      "name": "OwnershipRenounced",
      "type": "event"
    },
    {
      "anonymous": false,
      "inputs": [
        {
          "indexed": true,
          "name": "previousOwner",
          "type": "address"
        },
        {
          "indexed": true,
          "name": "newOwner",
          "type": "address"
        }
      ],
      "name": "OwnershipTransferred",
      "type": "event"
    }
  ],
  "transactionHash": "0x2cd8823e7ed3f7d7004f977cf30fb051d52e58102e27194a68688d7d609bbeb3",
  "receipt": {
    "to": null,
    "from": "0x9a12CC617Cb8a7cbB3E9c0678a5305b5d690120d",
    "contractAddress": "0x16C1Ed9148e1EF1a5369Aab53EcccB9211CBC71D",
    "transactionIndex": 0,
    "gasUsed": "4375931",
    "logsBloom": "0x00000000000000000000000000000000000000000000000000000000000000000000000000000000000000000000000000000000000000000000000000000000000000000000000000000000000000000000000000000000000000000000000000000000000000000000000000000000000000000000000000000000000000000000000000000000000000000000000000000000000000000000000000000000000000000000000000000000000000000000000000000000000000000000000000000000000000000000000000000000000000000000000000000000000000000000000000000000000000000000000000000000000000000000000000000000",
    "blockHash": "0x6a6185d01dda03665bfbdfc7d355adf23ddefc6430cbec2215997d19b3c66931",
    "transactionHash": "0x2cd8823e7ed3f7d7004f977cf30fb051d52e58102e27194a68688d7d609bbeb3",
    "logs": [],
    "blockNumber": 5,
    "cumulativeGasUsed": "4375931",
    "status": 1,
    "byzantium": true
  },
  "args": [
    "0xDb3F62d588f80dA9E8d69A8AEFF3488A99793281",
    "0xa30348EF1af3adB152A24531A45D77bFFCa8F2C8",
    "0x6F9eC1C362F33a655c9B15b70DC5e5B291F9D9A3",
    "0x9a12CC617Cb8a7cbB3E9c0678a5305b5d690120d"
  ],
  "solcInputHash": "585df1b812c94820d34be4b4b272733f",
  "metadata": "{\"compiler\":{\"version\":\"0.4.26+commit.4563c3fc\"},\"language\":\"Solidity\",\"output\":{\"abi\":[{\"constant\":true,\"inputs\":[],\"name\":\"name\",\"outputs\":[{\"name\":\"\",\"type\":\"string\"}],\"payable\":false,\"stateMutability\":\"view\",\"type\":\"function\"},{\"constant\":true,\"inputs\":[],\"name\":\"tokenTransferProxy\",\"outputs\":[{\"name\":\"\",\"type\":\"address\"}],\"payable\":false,\"stateMutability\":\"view\",\"type\":\"function\"},{\"constant\":true,\"inputs\":[{\"name\":\"target\",\"type\":\"address\"},{\"name\":\"calldata\",\"type\":\"bytes\"},{\"name\":\"extradata\",\"type\":\"bytes\"}],\"name\":\"staticCall\",\"outputs\":[{\"name\":\"result\",\"type\":\"bool\"}],\"payable\":false,\"stateMutability\":\"view\",\"type\":\"function\"},{\"constant\":false,\"inputs\":[{\"name\":\"newMinimumMakerProtocolFee\",\"type\":\"uint256\"}],\"name\":\"changeMinimumMakerProtocolFee\",\"outputs\":[],\"payable\":false,\"stateMutability\":\"nonpayable\",\"type\":\"function\"},{\"constant\":false,\"inputs\":[{\"name\":\"newMinimumTakerProtocolFee\",\"type\":\"uint256\"}],\"name\":\"changeMinimumTakerProtocolFee\",\"outputs\":[],\"payable\":false,\"stateMutability\":\"nonpayable\",\"type\":\"function\"},{\"constant\":true,\"inputs\":[{\"name\":\"array\",\"type\":\"bytes\"},{\"name\":\"desired\",\"type\":\"bytes\"},{\"name\":\"mask\",\"type\":\"bytes\"}],\"name\":\"guardedArrayReplace\",\"outputs\":[{\"name\":\"\",\"type\":\"bytes\"}],\"payable\":false,\"stateMutability\":\"pure\",\"type\":\"function\"},{\"constant\":true,\"inputs\":[],\"name\":\"minimumTakerProtocolFee\",\"outputs\":[{\"name\":\"\",\"type\":\"uint256\"}],\"payable\":false,\"stateMutability\":\"view\",\"type\":\"function\"},{\"constant\":true,\"inputs\":[],\"name\":\"codename\",\"outputs\":[{\"name\":\"\",\"type\":\"string\"}],\"payable\":false,\"stateMutability\":\"view\",\"type\":\"function\"},{\"constant\":true,\"inputs\":[{\"name\":\"addr\",\"type\":\"address\"}],\"name\":\"testCopyAddress\",\"outputs\":[{\"name\":\"\",\"type\":\"bytes\"}],\"payable\":false,\"stateMutability\":\"pure\",\"type\":\"function\"},{\"constant\":true,\"inputs\":[{\"name\":\"arrToCopy\",\"type\":\"bytes\"}],\"name\":\"testCopy\",\"outputs\":[{\"name\":\"\",\"type\":\"bytes\"}],\"payable\":false,\"stateMutability\":\"pure\",\"type\":\"function\"},{\"constant\":true,\"inputs\":[{\"name\":\"addrs\",\"type\":\"address[7]\"},{\"name\":\"uints\",\"type\":\"uint256[9]\"},{\"name\":\"feeMethod\",\"type\":\"uint8\"},{\"name\":\"side\",\"type\":\"uint8\"},{\"name\":\"saleKind\",\"type\":\"uint8\"},{\"name\":\"howToCall\",\"type\":\"uint8\"},{\"name\":\"calldata\",\"type\":\"bytes\"},{\"name\":\"replacementPattern\",\"type\":\"bytes\"},{\"name\":\"staticExtradata\",\"type\":\"bytes\"}],\"name\":\"calculateCurrentPrice_\",\"outputs\":[{\"name\":\"\",\"type\":\"uint256\"}],\"payable\":false,\"stateMutability\":\"view\",\"type\":\"function\"},{\"constant\":false,\"inputs\":[{\"name\":\"newProtocolFeeRecipient\",\"type\":\"address\"}],\"name\":\"changeProtocolFeeRecipient\",\"outputs\":[],\"payable\":false,\"stateMutability\":\"nonpayable\",\"type\":\"function\"},{\"constant\":true,\"inputs\":[],\"name\":\"version\",\"outputs\":[{\"name\":\"\",\"type\":\"string\"}],\"payable\":false,\"stateMutability\":\"view\",\"type\":\"function\"},{\"constant\":true,\"inputs\":[{\"name\":\"buyCalldata\",\"type\":\"bytes\"},{\"name\":\"buyReplacementPattern\",\"type\":\"bytes\"},{\"name\":\"sellCalldata\",\"type\":\"bytes\"},{\"name\":\"sellReplacementPattern\",\"type\":\"bytes\"}],\"name\":\"orderCalldataCanMatch\",\"outputs\":[{\"name\":\"\",\"type\":\"bool\"}],\"payable\":false,\"stateMutability\":\"pure\",\"type\":\"function\"},{\"constant\":true,\"inputs\":[{\"name\":\"addrs\",\"type\":\"address[7]\"},{\"name\":\"uints\",\"type\":\"uint256[9]\"},{\"name\":\"feeMethod\",\"type\":\"uint8\"},{\"name\":\"side\",\"type\":\"uint8\"},{\"name\":\"saleKind\",\"type\":\"uint8\"},{\"name\":\"howToCall\",\"type\":\"uint8\"},{\"name\":\"calldata\",\"type\":\"bytes\"},{\"name\":\"replacementPattern\",\"type\":\"bytes\"},{\"name\":\"staticExtradata\",\"type\":\"bytes\"},{\"name\":\"v\",\"type\":\"uint8\"},{\"name\":\"r\",\"type\":\"bytes32\"},{\"name\":\"s\",\"type\":\"bytes32\"}],\"name\":\"validateOrder_\",\"outputs\":[{\"name\":\"\",\"type\":\"bool\"}],\"payable\":false,\"stateMutability\":\"view\",\"type\":\"function\"},{\"constant\":true,\"inputs\":[{\"name\":\"side\",\"type\":\"uint8\"},{\"name\":\"saleKind\",\"type\":\"uint8\"},{\"name\":\"basePrice\",\"type\":\"uint256\"},{\"name\":\"extra\",\"type\":\"uint256\"},{\"name\":\"listingTime\",\"type\":\"uint256\"},{\"name\":\"expirationTime\",\"type\":\"uint256\"}],\"name\":\"calculateFinalPrice\",\"outputs\":[{\"name\":\"\",\"type\":\"uint256\"}],\"payable\":false,\"stateMutability\":\"view\",\"type\":\"function\"},{\"constant\":true,\"inputs\":[],\"name\":\"protocolFeeRecipient\",\"outputs\":[{\"name\":\"\",\"type\":\"address\"}],\"payable\":false,\"stateMutability\":\"view\",\"type\":\"function\"},{\"constant\":false,\"inputs\":[],\"name\":\"renounceOwnership\",\"outputs\":[],\"payable\":false,\"stateMutability\":\"nonpayable\",\"type\":\"function\"},{\"constant\":true,\"inputs\":[{\"name\":\"addrs\",\"type\":\"address[7]\"},{\"name\":\"uints\",\"type\":\"uint256[9]\"},{\"name\":\"feeMethod\",\"type\":\"uint8\"},{\"name\":\"side\",\"type\":\"uint8\"},{\"name\":\"saleKind\",\"type\":\"uint8\"},{\"name\":\"howToCall\",\"type\":\"uint8\"},{\"name\":\"calldata\",\"type\":\"bytes\"},{\"name\":\"replacementPattern\",\"type\":\"bytes\"},{\"name\":\"staticExtradata\",\"type\":\"bytes\"}],\"name\":\"hashOrder_\",\"outputs\":[{\"name\":\"\",\"type\":\"bytes32\"}],\"payable\":false,\"stateMutability\":\"pure\",\"type\":\"function\"},{\"constant\":true,\"inputs\":[{\"name\":\"addrs\",\"type\":\"address[14]\"},{\"name\":\"uints\",\"type\":\"uint256[18]\"},{\"name\":\"feeMethodsSidesKindsHowToCalls\",\"type\":\"uint8[8]\"},{\"name\":\"calldataBuy\",\"type\":\"bytes\"},{\"name\":\"calldataSell\",\"type\":\"bytes\"},{\"name\":\"replacementPatternBuy\",\"type\":\"bytes\"},{\"name\":\"replacementPatternSell\",\"type\":\"bytes\"},{\"name\":\"staticExtradataBuy\",\"type\":\"bytes\"},{\"name\":\"staticExtradataSell\",\"type\":\"bytes\"}],\"name\":\"ordersCanMatch_\",\"outputs\":[{\"name\":\"\",\"type\":\"bool\"}],\"payable\":false,\"stateMutability\":\"view\",\"type\":\"function\"},{\"constant\":false,\"inputs\":[{\"name\":\"addrs\",\"type\":\"address[7]\"},{\"name\":\"uints\",\"type\":\"uint256[9]\"},{\"name\":\"feeMethod\",\"type\":\"uint8\"},{\"name\":\"side\",\"type\":\"uint8\"},{\"name\":\"saleKind\",\"type\":\"uint8\"},{\"name\":\"howToCall\",\"type\":\"uint8\"},{\"name\":\"calldata\",\"type\":\"bytes\"},{\"name\":\"replacementPattern\",\"type\":\"bytes\"},{\"name\":\"staticExtradata\",\"type\":\"bytes\"},{\"name\":\"orderbookInclusionDesired\",\"type\":\"bool\"}],\"name\":\"approveOrder_\",\"outputs\":[],\"payable\":false,\"stateMutability\":\"nonpayable\",\"type\":\"function\"},{\"constant\":true,\"inputs\":[],\"name\":\"registry\",\"outputs\":[{\"name\":\"\",\"type\":\"address\"}],\"payable\":false,\"stateMutability\":\"view\",\"type\":\"function\"},{\"constant\":true,\"inputs\":[],\"name\":\"minimumMakerProtocolFee\",\"outputs\":[{\"name\":\"\",\"type\":\"uint256\"}],\"payable\":false,\"stateMutability\":\"view\",\"type\":\"function\"},{\"constant\":true,\"inputs\":[{\"name\":\"addrs\",\"type\":\"address[7]\"},{\"name\":\"uints\",\"type\":\"uint256[9]\"},{\"name\":\"feeMethod\",\"type\":\"uint8\"},{\"name\":\"side\",\"type\":\"uint8\"},{\"name\":\"saleKind\",\"type\":\"uint8\"},{\"name\":\"howToCall\",\"type\":\"uint8\"},{\"name\":\"calldata\",\"type\":\"bytes\"},{\"name\":\"replacementPattern\",\"type\":\"bytes\"},{\"name\":\"staticExtradata\",\"type\":\"bytes\"}],\"name\":\"hashToSign_\",\"outputs\":[{\"name\":\"\",\"type\":\"bytes32\"}],\"payable\":false,\"stateMutability\":\"pure\",\"type\":\"function\"},{\"constant\":true,\"inputs\":[{\"name\":\"\",\"type\":\"bytes32\"}],\"name\":\"cancelledOrFinalized\",\"outputs\":[{\"name\":\"\",\"type\":\"bool\"}],\"payable\":false,\"stateMutability\":\"view\",\"type\":\"function\"},{\"constant\":true,\"inputs\":[],\"name\":\"owner\",\"outputs\":[{\"name\":\"\",\"type\":\"address\"}],\"payable\":false,\"stateMutability\":\"view\",\"type\":\"function\"},{\"constant\":true,\"inputs\":[],\"name\":\"exchangeToken\",\"outputs\":[{\"name\":\"\",\"type\":\"address\"}],\"payable\":false,\"stateMutability\":\"view\",\"type\":\"function\"},{\"constant\":false,\"inputs\":[{\"name\":\"addrs\",\"type\":\"address[7]\"},{\"name\":\"uints\",\"type\":\"uint256[9]\"},{\"name\":\"feeMethod\",\"type\":\"uint8\"},{\"name\":\"side\",\"type\":\"uint8\"},{\"name\":\"saleKind\",\"type\":\"uint8\"},{\"name\":\"howToCall\",\"type\":\"uint8\"},{\"name\":\"calldata\",\"type\":\"bytes\"},{\"name\":\"replacementPattern\",\"type\":\"bytes\"},{\"name\":\"staticExtradata\",\"type\":\"bytes\"},{\"name\":\"v\",\"type\":\"uint8\"},{\"name\":\"r\",\"type\":\"bytes32\"},{\"name\":\"s\",\"type\":\"bytes32\"}],\"name\":\"cancelOrder_\",\"outputs\":[],\"payable\":false,\"stateMutability\":\"nonpayable\",\"type\":\"function\"},{\"constant\":false,\"inputs\":[{\"name\":\"addrs\",\"type\":\"address[14]\"},{\"name\":\"uints\",\"type\":\"uint256[18]\"},{\"name\":\"feeMethodsSidesKindsHowToCalls\",\"type\":\"uint8[8]\"},{\"name\":\"calldataBuy\",\"type\":\"bytes\"},{\"name\":\"calldataSell\",\"type\":\"bytes\"},{\"name\":\"replacementPatternBuy\",\"type\":\"bytes\"},{\"name\":\"replacementPatternSell\",\"type\":\"bytes\"},{\"name\":\"staticExtradataBuy\",\"type\":\"bytes\"},{\"name\":\"staticExtradataSell\",\"type\":\"bytes\"},{\"name\":\"vs\",\"type\":\"uint8[2]\"},{\"name\":\"rssMetadata\",\"type\":\"bytes32[5]\"}],\"name\":\"atomicMatch_\",\"outputs\":[],\"payable\":true,\"stateMutability\":\"payable\",\"type\":\"function\"},{\"constant\":true,\"inputs\":[{\"name\":\"addrs\",\"type\":\"address[7]\"},{\"name\":\"uints\",\"type\":\"uint256[9]\"},{\"name\":\"feeMethod\",\"type\":\"uint8\"},{\"name\":\"side\",\"type\":\"uint8\"},{\"name\":\"saleKind\",\"type\":\"uint8\"},{\"name\":\"howToCall\",\"type\":\"uint8\"},{\"name\":\"calldata\",\"type\":\"bytes\"},{\"name\":\"replacementPattern\",\"type\":\"bytes\"},{\"name\":\"staticExtradata\",\"type\":\"bytes\"}],\"name\":\"validateOrderParameters_\",\"outputs\":[{\"name\":\"\",\"type\":\"bool\"}],\"payable\":false,\"stateMutability\":\"view\",\"type\":\"function\"},{\"constant\":true,\"inputs\":[],\"name\":\"INVERSE_BASIS_POINT\",\"outputs\":[{\"name\":\"\",\"type\":\"uint256\"}],\"payable\":false,\"stateMutability\":\"view\",\"type\":\"function\"},{\"constant\":true,\"inputs\":[{\"name\":\"addrs\",\"type\":\"address[14]\"},{\"name\":\"uints\",\"type\":\"uint256[18]\"},{\"name\":\"feeMethodsSidesKindsHowToCalls\",\"type\":\"uint8[8]\"},{\"name\":\"calldataBuy\",\"type\":\"bytes\"},{\"name\":\"calldataSell\",\"type\":\"bytes\"},{\"name\":\"replacementPatternBuy\",\"type\":\"bytes\"},{\"name\":\"replacementPatternSell\",\"type\":\"bytes\"},{\"name\":\"staticExtradataBuy\",\"type\":\"bytes\"},{\"name\":\"staticExtradataSell\",\"type\":\"bytes\"}],\"name\":\"calculateMatchPrice_\",\"outputs\":[{\"name\":\"\",\"type\":\"uint256\"}],\"payable\":false,\"stateMutability\":\"view\",\"type\":\"function\"},{\"constant\":true,\"inputs\":[{\"name\":\"\",\"type\":\"bytes32\"}],\"name\":\"approvedOrders\",\"outputs\":[{\"name\":\"\",\"type\":\"bool\"}],\"payable\":false,\"stateMutability\":\"view\",\"type\":\"function\"},{\"constant\":false,\"inputs\":[{\"name\":\"newOwner\",\"type\":\"address\"}],\"name\":\"transferOwnership\",\"outputs\":[],\"payable\":false,\"stateMutability\":\"nonpayable\",\"type\":\"function\"},{\"inputs\":[{\"name\":\"registryAddress\",\"type\":\"address\"},{\"name\":\"tokenTransferProxyAddress\",\"type\":\"address\"},{\"name\":\"tokenAddress\",\"type\":\"address\"},{\"name\":\"protocolFeeAddress\",\"type\":\"address\"}],\"payable\":false,\"stateMutability\":\"nonpayable\",\"type\":\"constructor\"},{\"anonymous\":false,\"inputs\":[{\"indexed\":true,\"name\":\"hash\",\"type\":\"bytes32\"},{\"indexed\":false,\"name\":\"exchange\",\"type\":\"address\"},{\"indexed\":true,\"name\":\"maker\",\"type\":\"address\"},{\"indexed\":false,\"name\":\"taker\",\"type\":\"address\"},{\"indexed\":false,\"name\":\"makerRelayerFee\",\"type\":\"uint256\"},{\"indexed\":false,\"name\":\"takerRelayerFee\",\"type\":\"uint256\"},{\"indexed\":false,\"name\":\"makerProtocolFee\",\"type\":\"uint256\"},{\"indexed\":false,\"name\":\"takerProtocolFee\",\"type\":\"uint256\"},{\"indexed\":true,\"name\":\"feeRecipient\",\"type\":\"address\"},{\"indexed\":false,\"name\":\"feeMethod\",\"type\":\"uint8\"},{\"indexed\":false,\"name\":\"side\",\"type\":\"uint8\"},{\"indexed\":false,\"name\":\"saleKind\",\"type\":\"uint8\"},{\"indexed\":false,\"name\":\"target\",\"type\":\"address\"}],\"name\":\"OrderApprovedPartOne\",\"type\":\"event\"},{\"anonymous\":false,\"inputs\":[{\"indexed\":true,\"name\":\"hash\",\"type\":\"bytes32\"},{\"indexed\":false,\"name\":\"howToCall\",\"type\":\"uint8\"},{\"indexed\":false,\"name\":\"calldata\",\"type\":\"bytes\"},{\"indexed\":false,\"name\":\"replacementPattern\",\"type\":\"bytes\"},{\"indexed\":false,\"name\":\"staticTarget\",\"type\":\"address\"},{\"indexed\":false,\"name\":\"staticExtradata\",\"type\":\"bytes\"},{\"indexed\":false,\"name\":\"paymentToken\",\"type\":\"address\"},{\"indexed\":false,\"name\":\"basePrice\",\"type\":\"uint256\"},{\"indexed\":false,\"name\":\"extra\",\"type\":\"uint256\"},{\"indexed\":false,\"name\":\"listingTime\",\"type\":\"uint256\"},{\"indexed\":false,\"name\":\"expirationTime\",\"type\":\"uint256\"},{\"indexed\":false,\"name\":\"salt\",\"type\":\"uint256\"},{\"indexed\":false,\"name\":\"orderbookInclusionDesired\",\"type\":\"bool\"}],\"name\":\"OrderApprovedPartTwo\",\"type\":\"event\"},{\"anonymous\":false,\"inputs\":[{\"indexed\":true,\"name\":\"hash\",\"type\":\"bytes32\"}],\"name\":\"OrderCancelled\",\"type\":\"event\"},{\"anonymous\":false,\"inputs\":[{\"indexed\":false,\"name\":\"buyHash\",\"type\":\"bytes32\"},{\"indexed\":false,\"name\":\"sellHash\",\"type\":\"bytes32\"},{\"indexed\":true,\"name\":\"maker\",\"type\":\"address\"},{\"indexed\":true,\"name\":\"taker\",\"type\":\"address\"},{\"indexed\":false,\"name\":\"price\",\"type\":\"uint256\"},{\"indexed\":true,\"name\":\"metadata\",\"type\":\"bytes32\"}],\"name\":\"OrdersMatched\",\"type\":\"event\"},{\"anonymous\":false,\"inputs\":[{\"indexed\":true,\"name\":\"previousOwner\",\"type\":\"address\"}],\"name\":\"OwnershipRenounced\",\"type\":\"event\"},{\"anonymous\":false,\"inputs\":[{\"indexed\":true,\"name\":\"previousOwner\",\"type\":\"address\"},{\"indexed\":true,\"name\":\"newOwner\",\"type\":\"address\"}],\"name\":\"OwnershipTransferred\",\"type\":\"event\"}],\"devdoc\":{\"methods\":{\"approveOrder_(address[7],uint256[9],uint8,uint8,uint8,uint8,bytes,bytes,bytes,bool)\":{\"details\":\"Call approveOrder - Solidity ABI encoding limitation workaround, hopefully temporary.\"},\"atomicMatch_(address[14],uint256[18],uint8[8],bytes,bytes,bytes,bytes,bytes,bytes,uint8[2],bytes32[5])\":{\"details\":\"Call atomicMatch - Solidity ABI encoding limitation workaround, hopefully temporary.\"},\"calculateCurrentPrice_(address[7],uint256[9],uint8,uint8,uint8,uint8,bytes,bytes,bytes)\":{\"details\":\"Call calculateCurrentPrice - Solidity ABI encoding limitation workaround, hopefully temporary.\"},\"calculateFinalPrice(uint8,uint8,uint256,uint256,uint256,uint256)\":{\"details\":\"Call calculateFinalPrice - library function exposed for testing.\"},\"calculateMatchPrice_(address[14],uint256[18],uint8[8],bytes,bytes,bytes,bytes,bytes,bytes)\":{\"details\":\"Call calculateMatchPrice - Solidity ABI encoding limitation workaround, hopefully temporary.\"},\"cancelOrder_(address[7],uint256[9],uint8,uint8,uint8,uint8,bytes,bytes,bytes,uint8,bytes32,bytes32)\":{\"details\":\"Call cancelOrder - Solidity ABI encoding limitation workaround, hopefully temporary.\"},\"changeMinimumMakerProtocolFee(uint256)\":{\"details\":\"Change the minimum maker fee paid to the protocol (owner only)\",\"params\":{\"newMinimumMakerProtocolFee\":\"New fee to set in basis points\"}},\"changeMinimumTakerProtocolFee(uint256)\":{\"details\":\"Change the minimum taker fee paid to the protocol (owner only)\",\"params\":{\"newMinimumTakerProtocolFee\":\"New fee to set in basis points\"}},\"changeProtocolFeeRecipient(address)\":{\"details\":\"Change the protocol fee recipient (owner only)\",\"params\":{\"newProtocolFeeRecipient\":\"New protocol fee recipient address\"}},\"guardedArrayReplace(bytes,bytes,bytes)\":{\"details\":\"Call guardedArrayReplace - library function exposed for testing.\"},\"hashOrder_(address[7],uint256[9],uint8,uint8,uint8,uint8,bytes,bytes,bytes)\":{\"details\":\"Call hashOrder - Solidity ABI encoding limitation workaround, hopefully temporary.\"},\"hashToSign_(address[7],uint256[9],uint8,uint8,uint8,uint8,bytes,bytes,bytes)\":{\"details\":\"Call hashToSign - Solidity ABI encoding limitation workaround, hopefully temporary.\"},\"orderCalldataCanMatch(bytes,bytes,bytes,bytes)\":{\"details\":\"Return whether or not two orders' calldata specifications can match\",\"params\":{\"buyCalldata\":\"Buy-side order calldata\",\"buyReplacementPattern\":\"Buy-side order calldata replacement mask\",\"sellCalldata\":\"Sell-side order calldata\",\"sellReplacementPattern\":\"Sell-side order calldata replacement mask\"},\"return\":\"Whether the orders' calldata can be matched\"},\"ordersCanMatch_(address[14],uint256[18],uint8[8],bytes,bytes,bytes,bytes,bytes,bytes)\":{\"details\":\"Call ordersCanMatch - Solidity ABI encoding limitation workaround, hopefully temporary.\"},\"renounceOwnership()\":{\"details\":\"Allows the current owner to relinquish control of the contract.\"},\"staticCall(address,bytes,bytes)\":{\"details\":\"Execute a STATICCALL (introduced with Ethereum Metropolis, non-state-modifying external call)\",\"params\":{\"calldata\":\"Calldata (appended to extradata)\",\"extradata\":\"Base data for STATICCALL (probably function selector and argument encoding)\",\"target\":\"Contract to call\"},\"return\":\"The result of the call (success or failure)\"},\"testCopy(bytes)\":{\"params\":{\"arrToCopy\":\"Array to copy\"},\"return\":\"byte array\"},\"testCopyAddress(address)\":{\"params\":{\"addr\":\"Address to write\"},\"return\":\"byte array\"},\"transferOwnership(address)\":{\"details\":\"Allows the current owner to transfer control of the contract to a newOwner.\",\"params\":{\"newOwner\":\"The address to transfer ownership to.\"}},\"validateOrderParameters_(address[7],uint256[9],uint8,uint8,uint8,uint8,bytes,bytes,bytes)\":{\"details\":\"Call validateOrderParameters - Solidity ABI encoding limitation workaround, hopefully temporary.\"},\"validateOrder_(address[7],uint256[9],uint8,uint8,uint8,uint8,bytes,bytes,bytes,uint8,bytes32,bytes32)\":{\"details\":\"Call validateOrder - Solidity ABI encoding limitation workaround, hopefully temporary.\"}}},\"userdoc\":{\"methods\":{\"testCopy(bytes)\":{\"notice\":\"Test copy byte array\"},\"testCopyAddress(address)\":{\"notice\":\"Test write address to bytes\"}}}},\"settings\":{\"compilationTarget\":{\"contracts/WyvernExchange.sol\":\"WyvernExchange\"},\"evmVersion\":\"byzantium\",\"libraries\":{},\"optimizer\":{\"enabled\":true,\"runs\":200},\"remappings\":[]},\"sources\":{\"contracts/WyvernExchange.sol\":{\"content\":\"/**\\n *Submitted for verification at Etherscan.io on 2018-06-12\\n */\\n\\npragma solidity ^0.4.13;\\n\\nlibrary SafeMath {\\n    /**\\n     * @dev Multiplies two numbers, throws on overflow.\\n     */\\n    function mul(uint256 a, uint256 b) internal pure returns (uint256 c) {\\n        if (a == 0) {\\n            return 0;\\n        }\\n        c = a * b;\\n        assert(c / a == b);\\n        return c;\\n    }\\n\\n    /**\\n     * @dev Integer division of two numbers, truncating the quotient.\\n     */\\n    function div(uint256 a, uint256 b) internal pure returns (uint256) {\\n        // assert(b > 0); // Solidity automatically throws when dividing by 0\\n        // uint256 c = a / b;\\n        // assert(a == b * c + a % b); // There is no case in which this doesn't hold\\n        return a / b;\\n    }\\n\\n    /**\\n     * @dev Subtracts two numbers, throws on overflow (i.e. if subtrahend is greater than minuend).\\n     */\\n    function sub(uint256 a, uint256 b) internal pure returns (uint256) {\\n        assert(b <= a);\\n        return a - b;\\n    }\\n\\n    /**\\n     * @dev Adds two numbers, throws on overflow.\\n     */\\n    function add(uint256 a, uint256 b) internal pure returns (uint256 c) {\\n        c = a + b;\\n        assert(c >= a);\\n        return c;\\n    }\\n}\\n\\ncontract Ownable {\\n    address public owner;\\n\\n    event OwnershipRenounced(address indexed previousOwner);\\n    event OwnershipTransferred(\\n        address indexed previousOwner,\\n        address indexed newOwner\\n    );\\n\\n    /**\\n     * @dev The Ownable constructor sets the original `owner` of the contract to the sender\\n     * account.\\n     */\\n    constructor() public {\\n        owner = msg.sender;\\n    }\\n\\n    /**\\n     * @dev Throws if called by any account other than the owner.\\n     */\\n    modifier onlyOwner() {\\n        require(msg.sender == owner);\\n        _;\\n    }\\n\\n    /**\\n     * @dev Allows the current owner to transfer control of the contract to a newOwner.\\n     * @param newOwner The address to transfer ownership to.\\n     */\\n    function transferOwnership(address newOwner) public onlyOwner {\\n        require(newOwner != address(0));\\n        emit OwnershipTransferred(owner, newOwner);\\n        owner = newOwner;\\n    }\\n\\n    /**\\n     * @dev Allows the current owner to relinquish control of the contract.\\n     */\\n    function renounceOwnership() public onlyOwner {\\n        emit OwnershipRenounced(owner);\\n        owner = address(0);\\n    }\\n}\\n\\ncontract ERC20Basic {\\n    function totalSupply() public view returns (uint256);\\n\\n    function balanceOf(address who) public view returns (uint256);\\n\\n    function transfer(address to, uint256 value) public returns (bool);\\n\\n    event Transfer(address indexed from, address indexed to, uint256 value);\\n}\\n\\ncontract ERC20 is ERC20Basic {\\n    function allowance(address owner, address spender)\\n        public\\n        view\\n        returns (uint256);\\n\\n    function transferFrom(\\n        address from,\\n        address to,\\n        uint256 value\\n    ) public returns (bool);\\n\\n    function approve(address spender, uint256 value) public returns (bool);\\n\\n    event Approval(\\n        address indexed owner,\\n        address indexed spender,\\n        uint256 value\\n    );\\n}\\n\\nlibrary ArrayUtils {\\n    /**\\n     * Replace bytes in an array with bytes in another array, guarded by a bitmask\\n     * Efficiency of this function is a bit unpredictable because of the EVM's word-specific model (arrays under 32 bytes will be slower)\\n     *\\n     * @dev Mask must be the size of the byte array. A nonzero byte means the byte array can be changed.\\n     * @param array The original array\\n     * @param desired The target array\\n     * @param mask The mask specifying which bits can be changed\\n     * @return The updated byte array (the parameter will be modified inplace)\\n     */\\n    function guardedArrayReplace(\\n        bytes memory array,\\n        bytes memory desired,\\n        bytes memory mask\\n    ) internal pure {\\n        require(array.length == desired.length);\\n        require(array.length == mask.length);\\n\\n        uint256 words = array.length / 0x20;\\n        uint256 index = words * 0x20;\\n        assert(index / 0x20 == words);\\n        uint256 i;\\n\\n        for (i = 0; i < words; i++) {\\n            /* Conceptually: array[i] = (!mask[i] && array[i]) || (mask[i] && desired[i]), bitwise in word chunks. */\\n            assembly {\\n                let commonIndex := mul(0x20, add(1, i))\\n                let maskValue := mload(add(mask, commonIndex))\\n                mstore(\\n                    add(array, commonIndex),\\n                    or(\\n                        and(not(maskValue), mload(add(array, commonIndex))),\\n                        and(maskValue, mload(add(desired, commonIndex)))\\n                    )\\n                )\\n            }\\n        }\\n\\n        /* Deal with the last section of the byte array. */\\n        if (words > 0) {\\n            /* This overlaps with bytes already set but is still more efficient than iterating through each of the remaining bytes individually. */\\n            i = words;\\n            assembly {\\n                let commonIndex := mul(0x20, add(1, i))\\n                let maskValue := mload(add(mask, commonIndex))\\n                mstore(\\n                    add(array, commonIndex),\\n                    or(\\n                        and(not(maskValue), mload(add(array, commonIndex))),\\n                        and(maskValue, mload(add(desired, commonIndex)))\\n                    )\\n                )\\n            }\\n        } else {\\n            /* If the byte array is shorter than a word, we must unfortunately do the whole thing bytewise.\\n               (bounds checks could still probably be optimized away in assembly, but this is a rare case) */\\n            for (i = index; i < array.length; i++) {\\n                array[i] =\\n                    ((mask[i] ^ 0xff) & array[i]) |\\n                    (mask[i] & desired[i]);\\n            }\\n        }\\n    }\\n\\n    /**\\n     * Test if two arrays are equal\\n     * Source: https://github.com/GNSPS/solidity-bytes-utils/blob/master/contracts/BytesLib.sol\\n     *\\n     * @dev Arrays must be of equal length, otherwise will return false\\n     * @param a First array\\n     * @param b Second array\\n     * @return Whether or not all bytes in the arrays are equal\\n     */\\n    function arrayEq(bytes memory a, bytes memory b)\\n        internal\\n        pure\\n        returns (bool)\\n    {\\n        bool success = true;\\n\\n        assembly {\\n            let length := mload(a)\\n\\n            // if lengths don't match the arrays are not equal\\n            switch eq(length, mload(b))\\n            case 1 {\\n                // cb is a circuit breaker in the for loop since there's\\n                //  no said feature for inline assembly loops\\n                // cb = 1 - don't breaker\\n                // cb = 0 - break\\n                let cb := 1\\n\\n                let mc := add(a, 0x20)\\n                let end := add(mc, length)\\n\\n                for {\\n                    let cc := add(b, 0x20)\\n                    // the next line is the loop condition:\\n                    // while(uint(mc < end) + cb == 2)\\n                } eq(add(lt(mc, end), cb), 2) {\\n                    mc := add(mc, 0x20)\\n                    cc := add(cc, 0x20)\\n                } {\\n                    // if any of these checks fails then arrays are not equal\\n                    if iszero(eq(mload(mc), mload(cc))) {\\n                        // unsuccess:\\n                        success := 0\\n                        cb := 0\\n                    }\\n                }\\n            }\\n            default {\\n                // unsuccess:\\n                success := 0\\n            }\\n        }\\n\\n        return success;\\n    }\\n\\n    /**\\n     * Unsafe write byte array into a memory location\\n     *\\n     * @param index Memory location\\n     * @param source Byte array to write\\n     * @return End memory index\\n     */\\n    function unsafeWriteBytes(uint256 index, bytes source)\\n        internal\\n        pure\\n        returns (uint256)\\n    {\\n        if (source.length > 0) {\\n            assembly {\\n                let length := mload(source)\\n                let end := add(source, add(0x20, length))\\n                let arrIndex := add(source, 0x20)\\n                let tempIndex := index\\n                for {\\n\\n                } eq(lt(arrIndex, end), 1) {\\n                    arrIndex := add(arrIndex, 0x20)\\n                    tempIndex := add(tempIndex, 0x20)\\n                } {\\n                    mstore(tempIndex, mload(arrIndex))\\n                }\\n                index := add(index, length)\\n            }\\n        }\\n        return index;\\n    }\\n\\n    /**\\n     * Unsafe write address into a memory location\\n     *\\n     * @param index Memory location\\n     * @param source Address to write\\n     * @return End memory index\\n     */\\n    function unsafeWriteAddress(uint256 index, address source)\\n        internal\\n        pure\\n        returns (uint256)\\n    {\\n        uint256 conv = uint256(source) << 0x60;\\n        assembly {\\n            mstore(index, conv)\\n            index := add(index, 0x14)\\n        }\\n        return index;\\n    }\\n\\n    /**\\n     * Unsafe write uint into a memory location\\n     *\\n     * @param index Memory location\\n     * @param source uint to write\\n     * @return End memory index\\n     */\\n    function unsafeWriteUint(uint256 index, uint256 source)\\n        internal\\n        pure\\n        returns (uint256)\\n    {\\n        assembly {\\n            mstore(index, source)\\n            index := add(index, 0x20)\\n        }\\n        return index;\\n    }\\n\\n    /**\\n     * Unsafe write uint8 into a memory location\\n     *\\n     * @param index Memory location\\n     * @param source uint8 to write\\n     * @return End memory index\\n     */\\n    function unsafeWriteUint8(uint256 index, uint8 source)\\n        internal\\n        pure\\n        returns (uint256)\\n    {\\n        assembly {\\n            mstore8(index, source)\\n            index := add(index, 0x1)\\n        }\\n        return index;\\n    }\\n}\\n\\ncontract ReentrancyGuarded {\\n    bool reentrancyLock = false;\\n\\n    /* Prevent a contract function from being reentrant-called. */\\n    modifier reentrancyGuard {\\n        if (reentrancyLock) {\\n            revert();\\n        }\\n        reentrancyLock = true;\\n        _;\\n        reentrancyLock = false;\\n    }\\n}\\n\\ncontract TokenRecipient {\\n    event ReceivedEther(address indexed sender, uint256 amount);\\n    event ReceivedTokens(\\n        address indexed from,\\n        uint256 value,\\n        address indexed token,\\n        bytes extraData\\n    );\\n\\n    /**\\n     * @dev Receive tokens and generate a log event\\n     * @param from Address from which to transfer tokens\\n     * @param value Amount of tokens to transfer\\n     * @param token Address of token\\n     * @param extraData Additional data to log\\n     */\\n    function receiveApproval(\\n        address from,\\n        uint256 value,\\n        address token,\\n        bytes extraData\\n    ) public {\\n        ERC20 t = ERC20(token);\\n        require(t.transferFrom(from, this, value));\\n        emit ReceivedTokens(from, value, token, extraData);\\n    }\\n\\n    /**\\n     * @dev Receive Ether and generate a log event\\n     */\\n    function() public payable {\\n        emit ReceivedEther(msg.sender, msg.value);\\n    }\\n}\\n\\ncontract ExchangeCore is ReentrancyGuarded, Ownable {\\n    /* The token used to pay exchange fees. */\\n    ERC20 public exchangeToken;\\n\\n    /* User registry. */\\n    ProxyRegistry public registry;\\n\\n    /* Token transfer proxy. */\\n    TokenTransferProxy public tokenTransferProxy;\\n\\n    /* Cancelled / finalized orders, by hash. */\\n    mapping(bytes32 => bool) public cancelledOrFinalized;\\n\\n    /* Orders verified by on-chain approval (alternative to ECDSA signatures so that smart contracts can place orders directly). */\\n    mapping(bytes32 => bool) public approvedOrders;\\n\\n    /* For split fee orders, minimum required protocol maker fee, in basis points. Paid to owner (who can change it). */\\n    uint256 public minimumMakerProtocolFee = 0;\\n\\n    /* For split fee orders, minimum required protocol taker fee, in basis points. Paid to owner (who can change it). */\\n    uint256 public minimumTakerProtocolFee = 0;\\n\\n    /* Recipient of protocol fees. */\\n    address public protocolFeeRecipient;\\n\\n    /* Fee method: protocol fee or split fee. */\\n    enum FeeMethod {\\n        ProtocolFee,\\n        SplitFee\\n    }\\n\\n    /* Inverse basis point. */\\n    uint256 public constant INVERSE_BASIS_POINT = 10000;\\n\\n    /* An ECDSA signature. */\\n\\n    struct Sig {\\n        /* v parameter */\\n        uint8 v;\\n        /* r parameter */\\n        bytes32 r;\\n        /* s parameter */\\n        bytes32 s;\\n    }\\n\\n    /* An order on the exchange. */\\n    struct Order {\\n        /* Exchange address, intended as a versioning mechanism. */\\n        address exchange;\\n        /* Order maker address. */\\n        address maker;\\n        /* Order taker address, if specified. */\\n        address taker;\\n        /* Maker relayer fee of the order, unused for taker order. */\\n        uint256 makerRelayerFee;\\n        /* Taker relayer fee of the order, or maximum taker fee for a taker order. */\\n        uint256 takerRelayerFee;\\n        /* Maker protocol fee of the order, unused for taker order. */\\n        uint256 makerProtocolFee;\\n        /* Taker protocol fee of the order, or maximum taker fee for a taker order. */\\n        uint256 takerProtocolFee;\\n        /* Order fee recipient or zero address for taker order. */\\n        address feeRecipient;\\n        /* Fee method (protocol token or split fee). */\\n        FeeMethod feeMethod;\\n        /* Side (buy/sell). */\\n        SaleKindInterface.Side side;\\n        /* Kind of sale. */\\n        SaleKindInterface.SaleKind saleKind;\\n        /* Target. */\\n        address target;\\n        /* HowToCall. */\\n        AuthenticatedProxy.HowToCall howToCall;\\n        /* Calldata. */\\n        bytes calldata;\\n        /* Calldata replacement pattern, or an empty byte array for no replacement. */\\n        bytes replacementPattern;\\n        /* Static call target, zero-address for no static call. */\\n        address staticTarget;\\n        /* Static call extra data. */\\n        bytes staticExtradata;\\n        /* Token used to pay for the order, or the zero-address as a sentinel value for Ether. */\\n        address paymentToken;\\n        /* Base price of the order (in paymentTokens). */\\n        uint256 basePrice;\\n        /* Auction extra parameter - minimum bid increment for English auctions, starting/ending price difference. */\\n        uint256 extra;\\n        /* Listing timestamp. */\\n        uint256 listingTime;\\n        /* Expiration timestamp - 0 for no expiry. */\\n        uint256 expirationTime;\\n        /* Order salt, used to prevent duplicate hashes. */\\n        uint256 salt;\\n    }\\n\\n    event OrderApprovedPartOne(\\n        bytes32 indexed hash,\\n        address exchange,\\n        address indexed maker,\\n        address taker,\\n        uint256 makerRelayerFee,\\n        uint256 takerRelayerFee,\\n        uint256 makerProtocolFee,\\n        uint256 takerProtocolFee,\\n        address indexed feeRecipient,\\n        FeeMethod feeMethod,\\n        SaleKindInterface.Side side,\\n        SaleKindInterface.SaleKind saleKind,\\n        address target\\n    );\\n    event OrderApprovedPartTwo(\\n        bytes32 indexed hash,\\n        AuthenticatedProxy.HowToCall howToCall,\\n        bytes calldata,\\n        bytes replacementPattern,\\n        address staticTarget,\\n        bytes staticExtradata,\\n        address paymentToken,\\n        uint256 basePrice,\\n        uint256 extra,\\n        uint256 listingTime,\\n        uint256 expirationTime,\\n        uint256 salt,\\n        bool orderbookInclusionDesired\\n    );\\n    event OrderCancelled(bytes32 indexed hash);\\n    event OrdersMatched(\\n        bytes32 buyHash,\\n        bytes32 sellHash,\\n        address indexed maker,\\n        address indexed taker,\\n        uint256 price,\\n        bytes32 indexed metadata\\n    );\\n\\n    /**\\n     * @dev Change the minimum maker fee paid to the protocol (owner only)\\n     * @param newMinimumMakerProtocolFee New fee to set in basis points\\n     */\\n    function changeMinimumMakerProtocolFee(uint256 newMinimumMakerProtocolFee)\\n        public\\n        onlyOwner\\n    {\\n        minimumMakerProtocolFee = newMinimumMakerProtocolFee;\\n    }\\n\\n    /**\\n     * @dev Change the minimum taker fee paid to the protocol (owner only)\\n     * @param newMinimumTakerProtocolFee New fee to set in basis points\\n     */\\n    function changeMinimumTakerProtocolFee(uint256 newMinimumTakerProtocolFee)\\n        public\\n        onlyOwner\\n    {\\n        minimumTakerProtocolFee = newMinimumTakerProtocolFee;\\n    }\\n\\n    /**\\n     * @dev Change the protocol fee recipient (owner only)\\n     * @param newProtocolFeeRecipient New protocol fee recipient address\\n     */\\n    function changeProtocolFeeRecipient(address newProtocolFeeRecipient)\\n        public\\n        onlyOwner\\n    {\\n        protocolFeeRecipient = newProtocolFeeRecipient;\\n    }\\n\\n    /**\\n     * @dev Transfer tokens\\n     * @param token Token to transfer\\n     * @param from Address to charge fees\\n     * @param to Address to receive fees\\n     * @param amount Amount of protocol tokens to charge\\n     */\\n    function transferTokens(\\n        address token,\\n        address from,\\n        address to,\\n        uint256 amount\\n    ) internal {\\n        if (amount > 0) {\\n            require(tokenTransferProxy.transferFrom(token, from, to, amount));\\n        }\\n    }\\n\\n    /**\\n     * @dev Charge a fee in protocol tokens\\n     * @param from Address to charge fees\\n     * @param to Address to receive fees\\n     * @param amount Amount of protocol tokens to charge\\n     */\\n    function chargeProtocolFee(\\n        address from,\\n        address to,\\n        uint256 amount\\n    ) internal {\\n        transferTokens(exchangeToken, from, to, amount);\\n    }\\n\\n    /**\\n     * @dev Execute a STATICCALL (introduced with Ethereum Metropolis, non-state-modifying external call)\\n     * @param target Contract to call\\n     * @param calldata Calldata (appended to extradata)\\n     * @param extradata Base data for STATICCALL (probably function selector and argument encoding)\\n     * @return The result of the call (success or failure)\\n     */\\n    function staticCall(\\n        address target,\\n        bytes memory calldata,\\n        bytes memory extradata\\n    ) public view returns (bool result) {\\n        bytes memory combined = new bytes(calldata.length + extradata.length);\\n        uint256 index;\\n        assembly {\\n            index := add(combined, 0x20)\\n        }\\n        index = ArrayUtils.unsafeWriteBytes(index, extradata);\\n        ArrayUtils.unsafeWriteBytes(index, calldata);\\n        assembly {\\n            result := staticcall(\\n                gas,\\n                target,\\n                add(combined, 0x20),\\n                mload(combined),\\n                mload(0x40),\\n                0\\n            )\\n        }\\n        return result;\\n    }\\n\\n    /**\\n     * Calculate size of an order struct when tightly packed\\n     *\\n     * @param order Order to calculate size of\\n     * @return Size in bytes\\n     */\\n    function sizeOf(Order memory order) internal pure returns (uint256) {\\n        return ((0x14 * 7) +\\n            (0x20 * 9) +\\n            4 +\\n            order.calldata.length +\\n            order.replacementPattern.length +\\n            order.staticExtradata.length);\\n    }\\n\\n    /**\\n     * @dev Hash an order, returning the canonical order hash, without the message prefix\\n     * @param order Order to hash\\n     * @return Hash of order\\n     */\\n    function hashOrder(Order memory order)\\n        internal\\n        pure\\n        returns (bytes32 hash)\\n    {\\n        /* Unfortunately abi.encodePacked doesn't work here, stack size constraints. */\\n        uint256 size = sizeOf(order);\\n        bytes memory array = new bytes(size);\\n        uint256 index;\\n        assembly {\\n            index := add(array, 0x20)\\n        }\\n        index = ArrayUtils.unsafeWriteAddress(index, order.exchange);\\n        index = ArrayUtils.unsafeWriteAddress(index, order.maker);\\n        index = ArrayUtils.unsafeWriteAddress(index, order.taker);\\n        index = ArrayUtils.unsafeWriteUint(index, order.makerRelayerFee);\\n        index = ArrayUtils.unsafeWriteUint(index, order.takerRelayerFee);\\n        index = ArrayUtils.unsafeWriteUint(index, order.makerProtocolFee);\\n        index = ArrayUtils.unsafeWriteUint(index, order.takerProtocolFee);\\n        index = ArrayUtils.unsafeWriteAddress(index, order.feeRecipient);\\n        index = ArrayUtils.unsafeWriteUint8(index, uint8(order.feeMethod));\\n        index = ArrayUtils.unsafeWriteUint8(index, uint8(order.side));\\n        index = ArrayUtils.unsafeWriteUint8(index, uint8(order.saleKind));\\n        index = ArrayUtils.unsafeWriteAddress(index, order.target);\\n        index = ArrayUtils.unsafeWriteUint8(index, uint8(order.howToCall));\\n        index = ArrayUtils.unsafeWriteBytes(index, order.calldata);\\n        index = ArrayUtils.unsafeWriteBytes(index, order.replacementPattern);\\n        index = ArrayUtils.unsafeWriteAddress(index, order.staticTarget);\\n        index = ArrayUtils.unsafeWriteBytes(index, order.staticExtradata);\\n        index = ArrayUtils.unsafeWriteAddress(index, order.paymentToken);\\n        index = ArrayUtils.unsafeWriteUint(index, order.basePrice);\\n        index = ArrayUtils.unsafeWriteUint(index, order.extra);\\n        index = ArrayUtils.unsafeWriteUint(index, order.listingTime);\\n        index = ArrayUtils.unsafeWriteUint(index, order.expirationTime);\\n        index = ArrayUtils.unsafeWriteUint(index, order.salt);\\n        assembly {\\n            hash := keccak256(add(array, 0x20), size)\\n        }\\n        return hash;\\n    }\\n\\n    /**\\n     * @dev Hash an order, returning the hash that a client must sign, including the standard message prefix\\n     * @param order Order to hash\\n     * @return Hash of message prefix and order hash per Ethereum format\\n     */\\n    function hashToSign(Order memory order) internal pure returns (bytes32) {\\n        return keccak256(\\\"\\\\x19Ethereum Signed Message:\\\\n32\\\", hashOrder(order));\\n    }\\n\\n    /**\\n     * @dev Assert an order is valid and return its hash\\n     * @param order Order to validate\\n     * @param sig ECDSA signature\\n     */\\n    function requireValidOrder(Order memory order, Sig memory sig)\\n        internal\\n        view\\n        returns (bytes32)\\n    {\\n        bytes32 hash = hashToSign(order);\\n        require(validateOrder(hash, order, sig));\\n        return hash;\\n    }\\n\\n    /**\\n     * @dev Validate order parameters (does *not* check signature validity)\\n     * @param order Order to validate\\n     */\\n    function validateOrderParameters(Order memory order)\\n        internal\\n        view\\n        returns (bool)\\n    {\\n        /* Order must be targeted at this protocol version (this Exchange contract). */\\n        if (order.exchange != address(this)) {\\n            return false;\\n        }\\n\\n        /* Order must possess valid sale kind parameter combination. */\\n        if (\\n            !SaleKindInterface.validateParameters(\\n                order.saleKind,\\n                order.expirationTime\\n            )\\n        ) {\\n            return false;\\n        }\\n\\n        /* If using the split fee method, order must have sufficient protocol fees. */\\n        if (\\n            order.feeMethod == FeeMethod.SplitFee &&\\n            (order.makerProtocolFee < minimumMakerProtocolFee ||\\n                order.takerProtocolFee < minimumTakerProtocolFee)\\n        ) {\\n            return false;\\n        }\\n\\n        return true;\\n    }\\n\\n    /**\\n     * @dev Validate a provided previously approved / signed order, hash, and signature.\\n     * @param hash Order hash (already calculated, passed to avoid recalculation)\\n     * @param order Order to validate\\n     * @param sig ECDSA signature\\n     */\\n    function validateOrder(\\n        bytes32 hash,\\n        Order memory order,\\n        Sig memory sig\\n    ) internal view returns (bool) {\\n        /* Not done in an if-conditional to prevent unnecessary ecrecover evaluation, which seems to happen even though it should short-circuit. */\\n\\n        /* Order must have valid parameters. */\\n        if (!validateOrderParameters(order)) {\\n            return false;\\n        }\\n\\n        /* Order must have not been canceled or already filled. */\\n        if (cancelledOrFinalized[hash]) {\\n            return false;\\n        }\\n\\n        /* Order authentication. Order must be either:\\n        /* (a) previously approved */\\n        if (approvedOrders[hash]) {\\n            return true;\\n        }\\n\\n        /* or (b) ECDSA-signed by maker. */\\n        if (ecrecover(hash, sig.v, sig.r, sig.s) == order.maker) {\\n            return true;\\n        }\\n\\n        return false;\\n    }\\n\\n    /**\\n     * @dev Approve an order and optionally mark it for orderbook inclusion. Must be called by the maker of the order\\n     * @param order Order to approve\\n     * @param orderbookInclusionDesired Whether orderbook providers should include the order in their orderbooks\\n     */\\n    function approveOrder(Order memory order, bool orderbookInclusionDesired)\\n        internal\\n    {\\n        /* CHECKS */\\n\\n        /* Assert sender is authorized to approve order. */\\n        require(msg.sender == order.maker);\\n\\n        /* Calculate order hash. */\\n        bytes32 hash = hashToSign(order);\\n\\n        /* Assert order has not already been approved. */\\n        require(!approvedOrders[hash]);\\n\\n        /* EFFECTS */\\n\\n        /* Mark order as approved. */\\n        approvedOrders[hash] = true;\\n\\n        /* Log approval event. Must be split in two due to Solidity stack size limitations. */\\n        {\\n            emit OrderApprovedPartOne(\\n                hash,\\n                order.exchange,\\n                order.maker,\\n                order.taker,\\n                order.makerRelayerFee,\\n                order.takerRelayerFee,\\n                order.makerProtocolFee,\\n                order.takerProtocolFee,\\n                order.feeRecipient,\\n                order.feeMethod,\\n                order.side,\\n                order.saleKind,\\n                order.target\\n            );\\n        }\\n        {\\n            emit OrderApprovedPartTwo(\\n                hash,\\n                order.howToCall,\\n                order.calldata,\\n                order.replacementPattern,\\n                order.staticTarget,\\n                order.staticExtradata,\\n                order.paymentToken,\\n                order.basePrice,\\n                order.extra,\\n                order.listingTime,\\n                order.expirationTime,\\n                order.salt,\\n                orderbookInclusionDesired\\n            );\\n        }\\n    }\\n\\n    /**\\n     * @dev Cancel an order, preventing it from being matched. Must be called by the maker of the order\\n     * @param order Order to cancel\\n     * @param sig ECDSA signature\\n     */\\n    function cancelOrder(Order memory order, Sig memory sig) internal {\\n        /* CHECKS */\\n\\n        /* Calculate order hash. */\\n        bytes32 hash = requireValidOrder(order, sig);\\n\\n        /* Assert sender is authorized to cancel order. */\\n        require(msg.sender == order.maker);\\n\\n        /* EFFECTS */\\n\\n        /* Mark order as cancelled, preventing it from being matched. */\\n        cancelledOrFinalized[hash] = true;\\n\\n        /* Log cancel event. */\\n        emit OrderCancelled(hash);\\n    }\\n\\n    /**\\n     * @dev Calculate the current price of an order (convenience function)\\n     * @param order Order to calculate the price of\\n     * @return The current price of the order\\n     */\\n    function calculateCurrentPrice(Order memory order)\\n        internal\\n        view\\n        returns (uint256)\\n    {\\n        return\\n            SaleKindInterface.calculateFinalPrice(\\n                order.side,\\n                order.saleKind,\\n                order.basePrice,\\n                order.extra,\\n                order.listingTime,\\n                order.expirationTime\\n            );\\n    }\\n\\n    /**\\n     * @dev Calculate the price two orders would match at, if in fact they would match (otherwise fail)\\n     * @param buy Buy-side order\\n     * @param sell Sell-side order\\n     * @return Match price\\n     */\\n    function calculateMatchPrice(Order memory buy, Order memory sell)\\n        internal\\n        view\\n        returns (uint256)\\n    {\\n        /* Calculate sell price. */\\n        uint256 sellPrice = SaleKindInterface.calculateFinalPrice(\\n            sell.side,\\n            sell.saleKind,\\n            sell.basePrice,\\n            sell.extra,\\n            sell.listingTime,\\n            sell.expirationTime\\n        );\\n\\n        /* Calculate buy price. */\\n        uint256 buyPrice = SaleKindInterface.calculateFinalPrice(\\n            buy.side,\\n            buy.saleKind,\\n            buy.basePrice,\\n            buy.extra,\\n            buy.listingTime,\\n            buy.expirationTime\\n        );\\n\\n        /* Require price cross. */\\n        require(buyPrice >= sellPrice);\\n\\n        /* Maker/taker priority. */\\n        return sell.feeRecipient != address(0) ? sellPrice : buyPrice;\\n    }\\n\\n    /**\\n     * @dev Execute all ERC20 token / Ether transfers associated with an order match (fees and buyer => seller transfer)\\n     * @param buy Buy-side order\\n     * @param sell Sell-side order\\n     */\\n    function executeFundsTransfer(Order memory buy, Order memory sell)\\n        internal\\n        returns (uint256)\\n    {\\n        /* Only payable in the special case of unwrapped Ether. */\\n        if (sell.paymentToken != address(0)) {\\n            require(msg.value == 0);\\n        }\\n\\n        /* Calculate match price. */\\n        uint256 price = calculateMatchPrice(buy, sell);\\n\\n        /* If paying using a token (not Ether), transfer tokens. This is done prior to fee payments to that a seller will have tokens before being charged fees. */\\n        if (price > 0 && sell.paymentToken != address(0)) {\\n            transferTokens(sell.paymentToken, buy.maker, sell.maker, price);\\n        }\\n\\n        /* Amount that will be received by seller (for Ether). */\\n        uint256 receiveAmount = price;\\n\\n        /* Amount that must be sent by buyer (for Ether). */\\n        uint256 requiredAmount = price;\\n\\n        /* Determine maker/taker and charge fees accordingly. */\\n        if (sell.feeRecipient != address(0)) {\\n            /* Sell-side order is maker. */\\n\\n            /* Assert taker fee is less than or equal to maximum fee specified by buyer. */\\n            require(sell.takerRelayerFee <= buy.takerRelayerFee);\\n\\n            if (sell.feeMethod == FeeMethod.SplitFee) {\\n                /* Assert taker fee is less than or equal to maximum fee specified by buyer. */\\n                require(sell.takerProtocolFee <= buy.takerProtocolFee);\\n\\n                /* Maker fees are deducted from the token amount that the maker receives. Taker fees are extra tokens that must be paid by the taker. */\\n\\n                if (sell.makerRelayerFee > 0) {\\n                    uint256 makerRelayerFee = SafeMath.div(\\n                        SafeMath.mul(sell.makerRelayerFee, price),\\n                        INVERSE_BASIS_POINT\\n                    );\\n                    if (sell.paymentToken == address(0)) {\\n                        receiveAmount = SafeMath.sub(\\n                            receiveAmount,\\n                            makerRelayerFee\\n                        );\\n                        sell.feeRecipient.transfer(makerRelayerFee);\\n                    } else {\\n                        transferTokens(\\n                            sell.paymentToken,\\n                            sell.maker,\\n                            sell.feeRecipient,\\n                            makerRelayerFee\\n                        );\\n                    }\\n                }\\n\\n                if (sell.takerRelayerFee > 0) {\\n                    uint256 takerRelayerFee = SafeMath.div(\\n                        SafeMath.mul(sell.takerRelayerFee, price),\\n                        INVERSE_BASIS_POINT\\n                    );\\n                    if (sell.paymentToken == address(0)) {\\n                        requiredAmount = SafeMath.add(\\n                            requiredAmount,\\n                            takerRelayerFee\\n                        );\\n                        sell.feeRecipient.transfer(takerRelayerFee);\\n                    } else {\\n                        transferTokens(\\n                            sell.paymentToken,\\n                            buy.maker,\\n                            sell.feeRecipient,\\n                            takerRelayerFee\\n                        );\\n                    }\\n                }\\n\\n                if (sell.makerProtocolFee > 0) {\\n                    uint256 makerProtocolFee = SafeMath.div(\\n                        SafeMath.mul(sell.makerProtocolFee, price),\\n                        INVERSE_BASIS_POINT\\n                    );\\n                    if (sell.paymentToken == address(0)) {\\n                        receiveAmount = SafeMath.sub(\\n                            receiveAmount,\\n                            makerProtocolFee\\n                        );\\n                        protocolFeeRecipient.transfer(makerProtocolFee);\\n                    } else {\\n                        transferTokens(\\n                            sell.paymentToken,\\n                            sell.maker,\\n                            protocolFeeRecipient,\\n                            makerProtocolFee\\n                        );\\n                    }\\n                }\\n\\n                if (sell.takerProtocolFee > 0) {\\n                    uint256 takerProtocolFee = SafeMath.div(\\n                        SafeMath.mul(sell.takerProtocolFee, price),\\n                        INVERSE_BASIS_POINT\\n                    );\\n                    if (sell.paymentToken == address(0)) {\\n                        requiredAmount = SafeMath.add(\\n                            requiredAmount,\\n                            takerProtocolFee\\n                        );\\n                        protocolFeeRecipient.transfer(takerProtocolFee);\\n                    } else {\\n                        transferTokens(\\n                            sell.paymentToken,\\n                            buy.maker,\\n                            protocolFeeRecipient,\\n                            takerProtocolFee\\n                        );\\n                    }\\n                }\\n            } else {\\n                /* Charge maker fee to seller. */\\n                chargeProtocolFee(\\n                    sell.maker,\\n                    sell.feeRecipient,\\n                    sell.makerRelayerFee\\n                );\\n\\n                /* Charge taker fee to buyer. */\\n                chargeProtocolFee(\\n                    buy.maker,\\n                    sell.feeRecipient,\\n                    sell.takerRelayerFee\\n                );\\n            }\\n        } else {\\n            /* Buy-side order is maker. */\\n\\n            /* Assert taker fee is less than or equal to maximum fee specified by seller. */\\n            require(buy.takerRelayerFee <= sell.takerRelayerFee);\\n\\n            if (sell.feeMethod == FeeMethod.SplitFee) {\\n                /* The Exchange does not escrow Ether, so direct Ether can only be used to with sell-side maker / buy-side taker orders. */\\n                require(sell.paymentToken != address(0));\\n\\n                /* Assert taker fee is less than or equal to maximum fee specified by seller. */\\n                require(buy.takerProtocolFee <= sell.takerProtocolFee);\\n\\n                if (buy.makerRelayerFee > 0) {\\n                    makerRelayerFee = SafeMath.div(\\n                        SafeMath.mul(buy.makerRelayerFee, price),\\n                        INVERSE_BASIS_POINT\\n                    );\\n                    transferTokens(\\n                        sell.paymentToken,\\n                        buy.maker,\\n                        buy.feeRecipient,\\n                        makerRelayerFee\\n                    );\\n                }\\n\\n                if (buy.takerRelayerFee > 0) {\\n                    takerRelayerFee = SafeMath.div(\\n                        SafeMath.mul(buy.takerRelayerFee, price),\\n                        INVERSE_BASIS_POINT\\n                    );\\n                    transferTokens(\\n                        sell.paymentToken,\\n                        sell.maker,\\n                        buy.feeRecipient,\\n                        takerRelayerFee\\n                    );\\n                }\\n\\n                if (buy.makerProtocolFee > 0) {\\n                    makerProtocolFee = SafeMath.div(\\n                        SafeMath.mul(buy.makerProtocolFee, price),\\n                        INVERSE_BASIS_POINT\\n                    );\\n                    transferTokens(\\n                        sell.paymentToken,\\n                        buy.maker,\\n                        protocolFeeRecipient,\\n                        makerProtocolFee\\n                    );\\n                }\\n\\n                if (buy.takerProtocolFee > 0) {\\n                    takerProtocolFee = SafeMath.div(\\n                        SafeMath.mul(buy.takerProtocolFee, price),\\n                        INVERSE_BASIS_POINT\\n                    );\\n                    transferTokens(\\n                        sell.paymentToken,\\n                        sell.maker,\\n                        protocolFeeRecipient,\\n                        takerProtocolFee\\n                    );\\n                }\\n            } else {\\n                /* Charge maker fee to buyer. */\\n                chargeProtocolFee(\\n                    buy.maker,\\n                    buy.feeRecipient,\\n                    buy.makerRelayerFee\\n                );\\n\\n                /* Charge taker fee to seller. */\\n                chargeProtocolFee(\\n                    sell.maker,\\n                    buy.feeRecipient,\\n                    buy.takerRelayerFee\\n                );\\n            }\\n        }\\n\\n        if (sell.paymentToken == address(0)) {\\n            /* Special-case Ether, order must be matched by buyer. */\\n            require(msg.value >= requiredAmount);\\n            sell.maker.transfer(receiveAmount);\\n            /* Allow overshoot for variable-price auctions, refund difference. */\\n            uint256 diff = SafeMath.sub(msg.value, requiredAmount);\\n            if (diff > 0) {\\n                buy.maker.transfer(diff);\\n            }\\n        }\\n\\n        /* This contract should never hold Ether, however, we cannot assert this, since it is impossible to prevent anyone from sending Ether e.g. with selfdestruct. */\\n\\n        return price;\\n    }\\n\\n    /**\\n     * @dev Return whether or not two orders can be matched with each other by basic parameters (does not check order signatures / calldata or perform static calls)\\n     * @param buy Buy-side order\\n     * @param sell Sell-side order\\n     * @return Whether or not the two orders can be matched\\n     */\\n    function ordersCanMatch(Order memory buy, Order memory sell)\\n        internal\\n        view\\n        returns (bool)\\n    {\\n        return (/* Must be opposite-side. */\\n        (buy.side == SaleKindInterface.Side.Buy &&\\n            sell.side == SaleKindInterface.Side.Sell) &&\\n            /* Must use same fee method. */\\n            (buy.feeMethod == sell.feeMethod) &&\\n            /* Must use same payment token. */\\n            (buy.paymentToken == sell.paymentToken) &&\\n            /* Must match maker/taker addresses. */\\n            (sell.taker == address(0) || sell.taker == buy.maker) &&\\n            (buy.taker == address(0) || buy.taker == sell.maker) &&\\n            /* One must be maker and the other must be taker (no bool XOR in Solidity). */\\n            ((sell.feeRecipient == address(0) &&\\n                buy.feeRecipient != address(0)) ||\\n                (sell.feeRecipient != address(0) &&\\n                    buy.feeRecipient == address(0))) &&\\n            /* Must match target. */\\n            (buy.target == sell.target) &&\\n            /* Must match howToCall. */\\n            (buy.howToCall == sell.howToCall) &&\\n            /* Buy-side order must be settleable. */\\n            SaleKindInterface.canSettleOrder(\\n                buy.listingTime,\\n                buy.expirationTime\\n            ) &&\\n            /* Sell-side order must be settleable. */\\n            SaleKindInterface.canSettleOrder(\\n                sell.listingTime,\\n                sell.expirationTime\\n            ));\\n    }\\n\\n    /**\\n     * @dev Atomically match two orders, ensuring validity of the match, and execute all associated state transitions. Protected against reentrancy by a contract-global lock.\\n     * @param buy Buy-side order\\n     * @param buySig Buy-side order signature\\n     * @param sell Sell-side order\\n     * @param sellSig Sell-side order signature\\n     */\\n    function atomicMatch(\\n        Order memory buy,\\n        Sig memory buySig,\\n        Order memory sell,\\n        Sig memory sellSig,\\n        bytes32 metadata\\n    ) internal reentrancyGuard {\\n        /* CHECKS */\\n\\n        /* Ensure buy order validity and calculate hash if necessary. */\\n        bytes32 buyHash;\\n        if (buy.maker == msg.sender) {\\n            require(validateOrderParameters(buy));\\n        } else {\\n            buyHash = requireValidOrder(buy, buySig);\\n        }\\n\\n        /* Ensure sell order validity and calculate hash if necessary. */\\n        bytes32 sellHash;\\n        if (sell.maker == msg.sender) {\\n            require(validateOrderParameters(sell));\\n        } else {\\n            sellHash = requireValidOrder(sell, sellSig);\\n        }\\n\\n        /* Must be matchable. */\\n        require(ordersCanMatch(buy, sell));\\n\\n        /* Target must exist (prevent malicious selfdestructs just prior to order settlement). */\\n        uint256 size;\\n        address target = sell.target;\\n        assembly {\\n            size := extcodesize(target)\\n        }\\n        require(size > 0);\\n\\n        /* Must match calldata after replacement, if specified. */\\n\\n        if (buy.replacementPattern.length > 0) {\\n            ArrayUtils.guardedArrayReplace(\\n                buy.calldata,\\n                sell.calldata,\\n                buy.replacementPattern\\n            );\\n        }\\n        if (sell.replacementPattern.length > 0) {\\n            ArrayUtils.guardedArrayReplace(\\n                sell.calldata,\\n                buy.calldata,\\n                sell.replacementPattern\\n            );\\n        }\\n        require(ArrayUtils.arrayEq(buy.calldata, sell.calldata));\\n\\n        /* Retrieve delegateProxy contract. */\\n        OwnableDelegateProxy delegateProxy = registry.proxies(sell.maker);\\n\\n        /* Proxy must exist. */\\n        require(delegateProxy != address(0));\\n\\n        /* Assert implementation. */\\n        require(\\n            delegateProxy.implementation() ==\\n                registry.delegateProxyImplementation()\\n        );\\n\\n        /* Access the passthrough AuthenticatedProxy. */\\n        AuthenticatedProxy proxy = AuthenticatedProxy(delegateProxy);\\n\\n        /* EFFECTS */\\n\\n        /* Mark previously signed or approved orders as finalized. */\\n        if (msg.sender != buy.maker) {\\n            cancelledOrFinalized[buyHash] = true;\\n        }\\n        if (msg.sender != sell.maker) {\\n            cancelledOrFinalized[sellHash] = true;\\n        }\\n\\n        /* INTERACTIONS */\\n\\n        /* Execute funds transfer and pay fees. */\\n        uint256 price = executeFundsTransfer(buy, sell);\\n\\n        /* Execute specified call through proxy. */\\n        require(proxy.proxy(sell.target, sell.howToCall, sell.calldata));\\n\\n        /* Log match event. */\\n        emit OrdersMatched(\\n            buyHash,\\n            sellHash,\\n            sell.feeRecipient != address(0) ? sell.maker : buy.maker,\\n            sell.feeRecipient != address(0) ? buy.maker : sell.maker,\\n            price,\\n            metadata\\n        );\\n    }\\n}\\n\\ncontract Exchange is ExchangeCore {\\n    /**\\n     * @dev Call guardedArrayReplace - library function exposed for testing.\\n     */\\n    function guardedArrayReplace(\\n        bytes array,\\n        bytes desired,\\n        bytes mask\\n    ) public pure returns (bytes) {\\n        ArrayUtils.guardedArrayReplace(array, desired, mask);\\n        return array;\\n    }\\n\\n    /**\\n     * Test copy byte array\\n     *\\n     * @param arrToCopy Array to copy\\n     * @return byte array\\n     */\\n    function testCopy(bytes arrToCopy) public pure returns (bytes) {\\n        bytes memory arr = new bytes(arrToCopy.length);\\n        uint256 index;\\n        assembly {\\n            index := add(arr, 0x20)\\n        }\\n        ArrayUtils.unsafeWriteBytes(index, arrToCopy);\\n        return arr;\\n    }\\n\\n    /**\\n     * Test write address to bytes\\n     *\\n     * @param addr Address to write\\n     * @return byte array\\n     */\\n    function testCopyAddress(address addr) public pure returns (bytes) {\\n        bytes memory arr = new bytes(0x14);\\n        uint256 index;\\n        assembly {\\n            index := add(arr, 0x20)\\n        }\\n        ArrayUtils.unsafeWriteAddress(index, addr);\\n        return arr;\\n    }\\n\\n    /**\\n     * @dev Call calculateFinalPrice - library function exposed for testing.\\n     */\\n    function calculateFinalPrice(\\n        SaleKindInterface.Side side,\\n        SaleKindInterface.SaleKind saleKind,\\n        uint256 basePrice,\\n        uint256 extra,\\n        uint256 listingTime,\\n        uint256 expirationTime\\n    ) public view returns (uint256) {\\n        return\\n            SaleKindInterface.calculateFinalPrice(\\n                side,\\n                saleKind,\\n                basePrice,\\n                extra,\\n                listingTime,\\n                expirationTime\\n            );\\n    }\\n\\n    /**\\n     * @dev Call hashOrder - Solidity ABI encoding limitation workaround, hopefully temporary.\\n     */\\n    function hashOrder_(\\n        address[7] addrs,\\n        uint256[9] uints,\\n        FeeMethod feeMethod,\\n        SaleKindInterface.Side side,\\n        SaleKindInterface.SaleKind saleKind,\\n        AuthenticatedProxy.HowToCall howToCall,\\n        bytes calldata,\\n        bytes replacementPattern,\\n        bytes staticExtradata\\n    ) public pure returns (bytes32) {\\n        return\\n            hashOrder(\\n                Order(\\n                    addrs[0],\\n                    addrs[1],\\n                    addrs[2],\\n                    uints[0],\\n                    uints[1],\\n                    uints[2],\\n                    uints[3],\\n                    addrs[3],\\n                    feeMethod,\\n                    side,\\n                    saleKind,\\n                    addrs[4],\\n                    howToCall,\\n                    calldata,\\n                    replacementPattern,\\n                    addrs[5],\\n                    staticExtradata,\\n                    ERC20(addrs[6]),\\n                    uints[4],\\n                    uints[5],\\n                    uints[6],\\n                    uints[7],\\n                    uints[8]\\n                )\\n            );\\n    }\\n\\n    /**\\n     * @dev Call hashToSign - Solidity ABI encoding limitation workaround, hopefully temporary.\\n     */\\n    function hashToSign_(\\n        address[7] addrs,\\n        uint256[9] uints,\\n        FeeMethod feeMethod,\\n        SaleKindInterface.Side side,\\n        SaleKindInterface.SaleKind saleKind,\\n        AuthenticatedProxy.HowToCall howToCall,\\n        bytes calldata,\\n        bytes replacementPattern,\\n        bytes staticExtradata\\n    ) public pure returns (bytes32) {\\n        return\\n            hashToSign(\\n                Order(\\n                    addrs[0],\\n                    addrs[1],\\n                    addrs[2],\\n                    uints[0],\\n                    uints[1],\\n                    uints[2],\\n                    uints[3],\\n                    addrs[3],\\n                    feeMethod,\\n                    side,\\n                    saleKind,\\n                    addrs[4],\\n                    howToCall,\\n                    calldata,\\n                    replacementPattern,\\n                    addrs[5],\\n                    staticExtradata,\\n                    ERC20(addrs[6]),\\n                    uints[4],\\n                    uints[5],\\n                    uints[6],\\n                    uints[7],\\n                    uints[8]\\n                )\\n            );\\n    }\\n\\n    /**\\n     * @dev Call validateOrderParameters - Solidity ABI encoding limitation workaround, hopefully temporary.\\n     */\\n    function validateOrderParameters_(\\n        address[7] addrs,\\n        uint256[9] uints,\\n        FeeMethod feeMethod,\\n        SaleKindInterface.Side side,\\n        SaleKindInterface.SaleKind saleKind,\\n        AuthenticatedProxy.HowToCall howToCall,\\n        bytes calldata,\\n        bytes replacementPattern,\\n        bytes staticExtradata\\n    ) public view returns (bool) {\\n        Order memory order = Order(\\n            addrs[0],\\n            addrs[1],\\n            addrs[2],\\n            uints[0],\\n            uints[1],\\n            uints[2],\\n            uints[3],\\n            addrs[3],\\n            feeMethod,\\n            side,\\n            saleKind,\\n            addrs[4],\\n            howToCall,\\n            calldata,\\n            replacementPattern,\\n            addrs[5],\\n            staticExtradata,\\n            ERC20(addrs[6]),\\n            uints[4],\\n            uints[5],\\n            uints[6],\\n            uints[7],\\n            uints[8]\\n        );\\n        return validateOrderParameters(order);\\n    }\\n\\n    /**\\n     * @dev Call validateOrder - Solidity ABI encoding limitation workaround, hopefully temporary.\\n     */\\n    function validateOrder_(\\n        address[7] addrs,\\n        uint256[9] uints,\\n        FeeMethod feeMethod,\\n        SaleKindInterface.Side side,\\n        SaleKindInterface.SaleKind saleKind,\\n        AuthenticatedProxy.HowToCall howToCall,\\n        bytes calldata,\\n        bytes replacementPattern,\\n        bytes staticExtradata,\\n        uint8 v,\\n        bytes32 r,\\n        bytes32 s\\n    ) public view returns (bool) {\\n        Order memory order = Order(\\n            addrs[0],\\n            addrs[1],\\n            addrs[2],\\n            uints[0],\\n            uints[1],\\n            uints[2],\\n            uints[3],\\n            addrs[3],\\n            feeMethod,\\n            side,\\n            saleKind,\\n            addrs[4],\\n            howToCall,\\n            calldata,\\n            replacementPattern,\\n            addrs[5],\\n            staticExtradata,\\n            ERC20(addrs[6]),\\n            uints[4],\\n            uints[5],\\n            uints[6],\\n            uints[7],\\n            uints[8]\\n        );\\n        return validateOrder(hashToSign(order), order, Sig(v, r, s));\\n    }\\n\\n    /**\\n     * @dev Call approveOrder - Solidity ABI encoding limitation workaround, hopefully temporary.\\n     */\\n    function approveOrder_(\\n        address[7] addrs,\\n        uint256[9] uints,\\n        FeeMethod feeMethod,\\n        SaleKindInterface.Side side,\\n        SaleKindInterface.SaleKind saleKind,\\n        AuthenticatedProxy.HowToCall howToCall,\\n        bytes calldata,\\n        bytes replacementPattern,\\n        bytes staticExtradata,\\n        bool orderbookInclusionDesired\\n    ) public {\\n        Order memory order = Order(\\n            addrs[0],\\n            addrs[1],\\n            addrs[2],\\n            uints[0],\\n            uints[1],\\n            uints[2],\\n            uints[3],\\n            addrs[3],\\n            feeMethod,\\n            side,\\n            saleKind,\\n            addrs[4],\\n            howToCall,\\n            calldata,\\n            replacementPattern,\\n            addrs[5],\\n            staticExtradata,\\n            ERC20(addrs[6]),\\n            uints[4],\\n            uints[5],\\n            uints[6],\\n            uints[7],\\n            uints[8]\\n        );\\n        return approveOrder(order, orderbookInclusionDesired);\\n    }\\n\\n    /**\\n     * @dev Call cancelOrder - Solidity ABI encoding limitation workaround, hopefully temporary.\\n     */\\n    function cancelOrder_(\\n        address[7] addrs,\\n        uint256[9] uints,\\n        FeeMethod feeMethod,\\n        SaleKindInterface.Side side,\\n        SaleKindInterface.SaleKind saleKind,\\n        AuthenticatedProxy.HowToCall howToCall,\\n        bytes calldata,\\n        bytes replacementPattern,\\n        bytes staticExtradata,\\n        uint8 v,\\n        bytes32 r,\\n        bytes32 s\\n    ) public {\\n        return\\n            cancelOrder(\\n                Order(\\n                    addrs[0],\\n                    addrs[1],\\n                    addrs[2],\\n                    uints[0],\\n                    uints[1],\\n                    uints[2],\\n                    uints[3],\\n                    addrs[3],\\n                    feeMethod,\\n                    side,\\n                    saleKind,\\n                    addrs[4],\\n                    howToCall,\\n                    calldata,\\n                    replacementPattern,\\n                    addrs[5],\\n                    staticExtradata,\\n                    ERC20(addrs[6]),\\n                    uints[4],\\n                    uints[5],\\n                    uints[6],\\n                    uints[7],\\n                    uints[8]\\n                ),\\n                Sig(v, r, s)\\n            );\\n    }\\n\\n    /**\\n     * @dev Call calculateCurrentPrice - Solidity ABI encoding limitation workaround, hopefully temporary.\\n     */\\n    function calculateCurrentPrice_(\\n        address[7] addrs,\\n        uint256[9] uints,\\n        FeeMethod feeMethod,\\n        SaleKindInterface.Side side,\\n        SaleKindInterface.SaleKind saleKind,\\n        AuthenticatedProxy.HowToCall howToCall,\\n        bytes calldata,\\n        bytes replacementPattern,\\n        bytes staticExtradata\\n    ) public view returns (uint256) {\\n        return\\n            calculateCurrentPrice(\\n                Order(\\n                    addrs[0],\\n                    addrs[1],\\n                    addrs[2],\\n                    uints[0],\\n                    uints[1],\\n                    uints[2],\\n                    uints[3],\\n                    addrs[3],\\n                    feeMethod,\\n                    side,\\n                    saleKind,\\n                    addrs[4],\\n                    howToCall,\\n                    calldata,\\n                    replacementPattern,\\n                    addrs[5],\\n                    staticExtradata,\\n                    ERC20(addrs[6]),\\n                    uints[4],\\n                    uints[5],\\n                    uints[6],\\n                    uints[7],\\n                    uints[8]\\n                )\\n            );\\n    }\\n\\n    /**\\n     * @dev Call ordersCanMatch - Solidity ABI encoding limitation workaround, hopefully temporary.\\n     */\\n    function ordersCanMatch_(\\n        address[14] addrs,\\n        uint256[18] uints,\\n        uint8[8] feeMethodsSidesKindsHowToCalls,\\n        bytes calldataBuy,\\n        bytes calldataSell,\\n        bytes replacementPatternBuy,\\n        bytes replacementPatternSell,\\n        bytes staticExtradataBuy,\\n        bytes staticExtradataSell\\n    ) public view returns (bool) {\\n        Order memory buy = Order(\\n            addrs[0],\\n            addrs[1],\\n            addrs[2],\\n            uints[0],\\n            uints[1],\\n            uints[2],\\n            uints[3],\\n            addrs[3],\\n            FeeMethod(feeMethodsSidesKindsHowToCalls[0]),\\n            SaleKindInterface.Side(feeMethodsSidesKindsHowToCalls[1]),\\n            SaleKindInterface.SaleKind(feeMethodsSidesKindsHowToCalls[2]),\\n            addrs[4],\\n            AuthenticatedProxy.HowToCall(feeMethodsSidesKindsHowToCalls[3]),\\n            calldataBuy,\\n            replacementPatternBuy,\\n            addrs[5],\\n            staticExtradataBuy,\\n            ERC20(addrs[6]),\\n            uints[4],\\n            uints[5],\\n            uints[6],\\n            uints[7],\\n            uints[8]\\n        );\\n        Order memory sell = Order(\\n            addrs[7],\\n            addrs[8],\\n            addrs[9],\\n            uints[9],\\n            uints[10],\\n            uints[11],\\n            uints[12],\\n            addrs[10],\\n            FeeMethod(feeMethodsSidesKindsHowToCalls[4]),\\n            SaleKindInterface.Side(feeMethodsSidesKindsHowToCalls[5]),\\n            SaleKindInterface.SaleKind(feeMethodsSidesKindsHowToCalls[6]),\\n            addrs[11],\\n            AuthenticatedProxy.HowToCall(feeMethodsSidesKindsHowToCalls[7]),\\n            calldataSell,\\n            replacementPatternSell,\\n            addrs[12],\\n            staticExtradataSell,\\n            ERC20(addrs[13]),\\n            uints[13],\\n            uints[14],\\n            uints[15],\\n            uints[16],\\n            uints[17]\\n        );\\n        return ordersCanMatch(buy, sell);\\n    }\\n\\n    /**\\n     * @dev Return whether or not two orders' calldata specifications can match\\n     * @param buyCalldata Buy-side order calldata\\n     * @param buyReplacementPattern Buy-side order calldata replacement mask\\n     * @param sellCalldata Sell-side order calldata\\n     * @param sellReplacementPattern Sell-side order calldata replacement mask\\n     * @return Whether the orders' calldata can be matched\\n     */\\n    function orderCalldataCanMatch(\\n        bytes buyCalldata,\\n        bytes buyReplacementPattern,\\n        bytes sellCalldata,\\n        bytes sellReplacementPattern\\n    ) public pure returns (bool) {\\n        if (buyReplacementPattern.length > 0) {\\n            ArrayUtils.guardedArrayReplace(\\n                buyCalldata,\\n                sellCalldata,\\n                buyReplacementPattern\\n            );\\n        }\\n        if (sellReplacementPattern.length > 0) {\\n            ArrayUtils.guardedArrayReplace(\\n                sellCalldata,\\n                buyCalldata,\\n                sellReplacementPattern\\n            );\\n        }\\n        return ArrayUtils.arrayEq(buyCalldata, sellCalldata);\\n    }\\n\\n    /**\\n     * @dev Call calculateMatchPrice - Solidity ABI encoding limitation workaround, hopefully temporary.\\n     */\\n    function calculateMatchPrice_(\\n        address[14] addrs,\\n        uint256[18] uints,\\n        uint8[8] feeMethodsSidesKindsHowToCalls,\\n        bytes calldataBuy,\\n        bytes calldataSell,\\n        bytes replacementPatternBuy,\\n        bytes replacementPatternSell,\\n        bytes staticExtradataBuy,\\n        bytes staticExtradataSell\\n    ) public view returns (uint256) {\\n        Order memory buy = Order(\\n            addrs[0],\\n            addrs[1],\\n            addrs[2],\\n            uints[0],\\n            uints[1],\\n            uints[2],\\n            uints[3],\\n            addrs[3],\\n            FeeMethod(feeMethodsSidesKindsHowToCalls[0]),\\n            SaleKindInterface.Side(feeMethodsSidesKindsHowToCalls[1]),\\n            SaleKindInterface.SaleKind(feeMethodsSidesKindsHowToCalls[2]),\\n            addrs[4],\\n            AuthenticatedProxy.HowToCall(feeMethodsSidesKindsHowToCalls[3]),\\n            calldataBuy,\\n            replacementPatternBuy,\\n            addrs[5],\\n            staticExtradataBuy,\\n            ERC20(addrs[6]),\\n            uints[4],\\n            uints[5],\\n            uints[6],\\n            uints[7],\\n            uints[8]\\n        );\\n        Order memory sell = Order(\\n            addrs[7],\\n            addrs[8],\\n            addrs[9],\\n            uints[9],\\n            uints[10],\\n            uints[11],\\n            uints[12],\\n            addrs[10],\\n            FeeMethod(feeMethodsSidesKindsHowToCalls[4]),\\n            SaleKindInterface.Side(feeMethodsSidesKindsHowToCalls[5]),\\n            SaleKindInterface.SaleKind(feeMethodsSidesKindsHowToCalls[6]),\\n            addrs[11],\\n            AuthenticatedProxy.HowToCall(feeMethodsSidesKindsHowToCalls[7]),\\n            calldataSell,\\n            replacementPatternSell,\\n            addrs[12],\\n            staticExtradataSell,\\n            ERC20(addrs[13]),\\n            uints[13],\\n            uints[14],\\n            uints[15],\\n            uints[16],\\n            uints[17]\\n        );\\n        return calculateMatchPrice(buy, sell);\\n    }\\n\\n    /**\\n     * @dev Call atomicMatch - Solidity ABI encoding limitation workaround, hopefully temporary.\\n     */\\n    function atomicMatch_(\\n        address[14] addrs,\\n        uint256[18] uints,\\n        uint8[8] feeMethodsSidesKindsHowToCalls,\\n        bytes calldataBuy,\\n        bytes calldataSell,\\n        bytes replacementPatternBuy,\\n        bytes replacementPatternSell,\\n        bytes staticExtradataBuy,\\n        bytes staticExtradataSell,\\n        uint8[2] vs,\\n        bytes32[5] rssMetadata\\n    ) public payable {\\n        return\\n            atomicMatch(\\n                Order(\\n                    addrs[0],\\n                    addrs[1],\\n                    addrs[2],\\n                    uints[0],\\n                    uints[1],\\n                    uints[2],\\n                    uints[3],\\n                    addrs[3],\\n                    FeeMethod(feeMethodsSidesKindsHowToCalls[0]),\\n                    SaleKindInterface.Side(feeMethodsSidesKindsHowToCalls[1]),\\n                    SaleKindInterface.SaleKind(\\n                        feeMethodsSidesKindsHowToCalls[2]\\n                    ),\\n                    addrs[4],\\n                    AuthenticatedProxy.HowToCall(\\n                        feeMethodsSidesKindsHowToCalls[3]\\n                    ),\\n                    calldataBuy,\\n                    replacementPatternBuy,\\n                    addrs[5],\\n                    staticExtradataBuy,\\n                    ERC20(addrs[6]),\\n                    uints[4],\\n                    uints[5],\\n                    uints[6],\\n                    uints[7],\\n                    uints[8]\\n                ),\\n                Sig(vs[0], rssMetadata[0], rssMetadata[1]),\\n                Order(\\n                    addrs[7],\\n                    addrs[8],\\n                    addrs[9],\\n                    uints[9],\\n                    uints[10],\\n                    uints[11],\\n                    uints[12],\\n                    addrs[10],\\n                    FeeMethod(feeMethodsSidesKindsHowToCalls[4]),\\n                    SaleKindInterface.Side(feeMethodsSidesKindsHowToCalls[5]),\\n                    SaleKindInterface.SaleKind(\\n                        feeMethodsSidesKindsHowToCalls[6]\\n                    ),\\n                    addrs[11],\\n                    AuthenticatedProxy.HowToCall(\\n                        feeMethodsSidesKindsHowToCalls[7]\\n                    ),\\n                    calldataSell,\\n                    replacementPatternSell,\\n                    addrs[12],\\n                    staticExtradataSell,\\n                    ERC20(addrs[13]),\\n                    uints[13],\\n                    uints[14],\\n                    uints[15],\\n                    uints[16],\\n                    uints[17]\\n                ),\\n                Sig(vs[1], rssMetadata[2], rssMetadata[3]),\\n                rssMetadata[4]\\n            );\\n    }\\n}\\n\\ncontract WyvernExchange is Exchange {\\n    string public constant name = \\\"Project Wyvern Exchange\\\";\\n\\n    string public constant version = \\\"2.2\\\";\\n\\n    string public constant codename = \\\"Lambton Worm\\\";\\n\\n    /**\\n     * @dev Initialize a WyvernExchange instance\\n     * @param registryAddress Address of the registry instance which this Exchange instance will use\\n     * @param tokenAddress Address of the token used for protocol fees\\n     */\\n    constructor(\\n        ProxyRegistry registryAddress,\\n        TokenTransferProxy tokenTransferProxyAddress,\\n        ERC20 tokenAddress,\\n        address protocolFeeAddress\\n    ) public {\\n        registry = registryAddress;\\n        tokenTransferProxy = tokenTransferProxyAddress;\\n        exchangeToken = tokenAddress;\\n        protocolFeeRecipient = protocolFeeAddress;\\n        owner = msg.sender;\\n    }\\n}\\n\\nlibrary SaleKindInterface {\\n    /**\\n     * Side: buy or sell.\\n     */\\n    enum Side {\\n        Buy,\\n        Sell\\n    }\\n\\n    /**\\n     * Currently supported kinds of sale: fixed price, Dutch auction.\\n     * English auctions cannot be supported without stronger escrow guarantees.\\n     * Future interesting options: Vickrey auction, nonlinear Dutch auctions.\\n     */\\n    enum SaleKind {\\n        FixedPrice,\\n        DutchAuction\\n    }\\n\\n    /**\\n     * @dev Check whether the parameters of a sale are valid\\n     * @param saleKind Kind of sale\\n     * @param expirationTime Order expiration time\\n     * @return Whether the parameters were valid\\n     */\\n    function validateParameters(SaleKind saleKind, uint256 expirationTime)\\n        internal\\n        pure\\n        returns (bool)\\n    {\\n        /* Auctions must have a set expiration date. */\\n        return (saleKind == SaleKind.FixedPrice || expirationTime > 0);\\n    }\\n\\n    /**\\n     * @dev Return whether or not an order can be settled\\n     * @dev Precondition: parameters have passed validateParameters\\n     * @param listingTime Order listing time\\n     * @param expirationTime Order expiration time\\n     */\\n    function canSettleOrder(uint256 listingTime, uint256 expirationTime)\\n        internal\\n        view\\n        returns (bool)\\n    {\\n        return\\n            (listingTime < now) &&\\n            (expirationTime == 0 || now < expirationTime);\\n    }\\n\\n    /**\\n     * @dev Calculate the settlement price of an order\\n     * @dev Precondition: parameters have passed validateParameters.\\n     * @param side Order side\\n     * @param saleKind Method of sale\\n     * @param basePrice Order base price\\n     * @param extra Order extra price data\\n     * @param listingTime Order listing time\\n     * @param expirationTime Order expiration time\\n     */\\n    function calculateFinalPrice(\\n        Side side,\\n        SaleKind saleKind,\\n        uint256 basePrice,\\n        uint256 extra,\\n        uint256 listingTime,\\n        uint256 expirationTime\\n    ) internal view returns (uint256 finalPrice) {\\n        if (saleKind == SaleKind.FixedPrice) {\\n            return basePrice;\\n        } else if (saleKind == SaleKind.DutchAuction) {\\n            uint256 diff = SafeMath.div(\\n                SafeMath.mul(extra, SafeMath.sub(now, listingTime)),\\n                SafeMath.sub(expirationTime, listingTime)\\n            );\\n            if (side == Side.Sell) {\\n                /* Sell-side - start price: basePrice. End price: basePrice - extra. */\\n                return SafeMath.sub(basePrice, diff);\\n            } else {\\n                /* Buy-side - start price: basePrice. End price: basePrice + extra. */\\n                return SafeMath.add(basePrice, diff);\\n            }\\n        }\\n    }\\n}\\n\\ncontract ProxyRegistry is Ownable {\\n    /* DelegateProxy implementation contract. Must be initialized. */\\n    address public delegateProxyImplementation;\\n\\n    /* Authenticated proxies by user. */\\n    mapping(address => OwnableDelegateProxy) public proxies;\\n\\n    /* Contracts pending access. */\\n    mapping(address => uint256) public pending;\\n\\n    /* Contracts allowed to call those proxies. */\\n    mapping(address => bool) public contracts;\\n\\n    /* Delay period for adding an authenticated contract.\\n       This mitigates a particular class of potential attack on the Wyvern DAO (which owns this registry) - if at any point the value of assets held by proxy contracts exceeded the value of half the WYV supply (votes in the DAO),\\n       a malicious but rational attacker could buy half the Wyvern and grant themselves access to all the proxy contracts. A delay period renders this attack nonthreatening - given two weeks, if that happened, users would have\\n       plenty of time to notice and transfer their assets.\\n    */\\n    uint256 public DELAY_PERIOD = 2 weeks;\\n\\n    /**\\n     * Start the process to enable access for specified contract. Subject to delay period.\\n     *\\n     * @dev ProxyRegistry owner only\\n     * @param addr Address to which to grant permissions\\n     */\\n    function startGrantAuthentication(address addr) public onlyOwner {\\n        require(!contracts[addr] && pending[addr] == 0);\\n        pending[addr] = now;\\n    }\\n\\n    /**\\n     * End the process to nable access for specified contract after delay period has passed.\\n     *\\n     * @dev ProxyRegistry owner only\\n     * @param addr Address to which to grant permissions\\n     */\\n    function endGrantAuthentication(address addr) public onlyOwner {\\n        require(\\n            !contracts[addr] &&\\n                pending[addr] != 0 &&\\n                ((pending[addr] + DELAY_PERIOD) < now)\\n        );\\n        pending[addr] = 0;\\n        contracts[addr] = true;\\n    }\\n\\n    /**\\n     * Revoke access for specified contract. Can be done instantly.\\n     *\\n     * @dev ProxyRegistry owner only\\n     * @param addr Address of which to revoke permissions\\n     */\\n\\n    function revokeAuthentication(address addr) public onlyOwner {\\n        contracts[addr] = false;\\n    }\\n\\n    /**\\n     * Register a proxy contract with this registry\\n     *\\n     * @dev Must be called by the user which the proxy is for, creates a new AuthenticatedProxy\\n     * @return New AuthenticatedProxy contract\\n     */\\n    function registerProxy() public returns (OwnableDelegateProxy proxy) {\\n        require(proxies[msg.sender] == address(0));\\n        proxy = new OwnableDelegateProxy(\\n            msg.sender,\\n            delegateProxyImplementation,\\n            abi.encodeWithSignature(\\n                \\\"initialize(address,address)\\\",\\n                msg.sender,\\n                address(this)\\n            )\\n        );\\n        proxies[msg.sender] = proxy;\\n        return proxy;\\n    }\\n}\\n\\ncontract TokenTransferProxy {\\n    /* Authentication registry. */\\n    ProxyRegistry public registry;\\n\\n    /**\\n     * Call ERC20 `transferFrom`\\n     *\\n     * @dev Authenticated contract only\\n     * @param token ERC20 token address\\n     * @param from From address\\n     * @param to To address\\n     * @param amount Transfer amount\\n     */\\n    function transferFrom(\\n        address token,\\n        address from,\\n        address to,\\n        uint256 amount\\n    ) public returns (bool) {\\n        require(registry.contracts(msg.sender));\\n        return ERC20(token).transferFrom(from, to, amount);\\n    }\\n}\\n\\ncontract OwnedUpgradeabilityStorage {\\n    // Current implementation\\n    address internal _implementation;\\n\\n    // Owner of the contract\\n    address private _upgradeabilityOwner;\\n\\n    /**\\n     * @dev Tells the address of the owner\\n     * @return the address of the owner\\n     */\\n    function upgradeabilityOwner() public view returns (address) {\\n        return _upgradeabilityOwner;\\n    }\\n\\n    /**\\n     * @dev Sets the address of the owner\\n     */\\n    function setUpgradeabilityOwner(address newUpgradeabilityOwner) internal {\\n        _upgradeabilityOwner = newUpgradeabilityOwner;\\n    }\\n\\n    /**\\n     * @dev Tells the address of the current implementation\\n     * @return address of the current implementation\\n     */\\n    function implementation() public view returns (address) {\\n        return _implementation;\\n    }\\n\\n    /**\\n     * @dev Tells the proxy type (EIP 897)\\n     * @return Proxy type, 2 for forwarding proxy\\n     */\\n    function proxyType() public pure returns (uint256 proxyTypeId) {\\n        return 2;\\n    }\\n}\\n\\ncontract AuthenticatedProxy is TokenRecipient, OwnedUpgradeabilityStorage {\\n    /* Whether initialized. */\\n    bool initialized = false;\\n\\n    /* Address which owns this proxy. */\\n    address public user;\\n\\n    /* Associated registry with contract authentication information. */\\n    ProxyRegistry public registry;\\n\\n    /* Whether access has been revoked. */\\n    bool public revoked;\\n\\n    /* Delegate call could be used to atomically transfer multiple assets owned by the proxy contract with one order. */\\n    enum HowToCall {\\n        Call,\\n        DelegateCall\\n    }\\n\\n    /* Event fired when the proxy access is revoked or unrevoked. */\\n    event Revoked(bool revoked);\\n\\n    /**\\n     * Initialize an AuthenticatedProxy\\n     *\\n     * @param addrUser Address of user on whose behalf this proxy will act\\n     * @param addrRegistry Address of ProxyRegistry contract which will manage this proxy\\n     */\\n    function initialize(address addrUser, ProxyRegistry addrRegistry) public {\\n        require(!initialized);\\n        initialized = true;\\n        user = addrUser;\\n        registry = addrRegistry;\\n    }\\n\\n    /**\\n     * Set the revoked flag (allows a user to revoke ProxyRegistry access)\\n     *\\n     * @dev Can be called by the user only\\n     * @param revoke Whether or not to revoke access\\n     */\\n    function setRevoke(bool revoke) public {\\n        require(msg.sender == user);\\n        revoked = revoke;\\n        emit Revoked(revoke);\\n    }\\n\\n    /**\\n     * Execute a message call from the proxy contract\\n     *\\n     * @dev Can be called by the user, or by a contract authorized by the registry as long as the user has not revoked access\\n     * @param dest Address to which the call will be sent\\n     * @param howToCall Which kind of call to make\\n     * @param calldata Calldata to send\\n     * @return Result of the call (success or failure)\\n     */\\n\\n    // from atomic match require(proxy.proxy(sell.target, sell.howToCall, sell.calldata));\\n    function proxy(\\n        address dest,\\n        HowToCall howToCall,\\n        bytes calldata\\n    ) public returns (bool result) {\\n        require(\\n            msg.sender == user || (!revoked && registry.contracts(msg.sender))\\n        );\\n        if (howToCall == HowToCall.Call) {\\n            result = dest.call(calldata);\\n        } else if (howToCall == HowToCall.DelegateCall) {\\n            result = dest.delegatecall(calldata);\\n        }\\n        return result;\\n    }\\n\\n    /**\\n     * Execute a message call and assert success\\n     *\\n     * @dev Same functionality as `proxy`, just asserts the return value\\n     * @param dest Address to which the call will be sent\\n     * @param howToCall What kind of call to make\\n     * @param calldata Calldata to send\\n     */\\n    function proxyAssert(\\n        address dest,\\n        HowToCall howToCall,\\n        bytes calldata\\n    ) public {\\n        require(proxy(dest, howToCall, calldata));\\n    }\\n}\\n\\ncontract Proxy {\\n    /**\\n     * @dev Tells the address of the implementation where every call will be delegated.\\n     * @return address of the implementation to which it will be delegated\\n     */\\n    function implementation() public view returns (address);\\n\\n    /**\\n     * @dev Tells the type of proxy (EIP 897)\\n     * @return Type of proxy, 2 for upgradeable proxy\\n     */\\n    function proxyType() public pure returns (uint256 proxyTypeId);\\n\\n    /**\\n     * @dev Fallback function allowing to perform a delegatecall to the given implementation.\\n     * This function will return whatever the implementation call returns\\n     */\\n    function() public payable {\\n        address _impl = implementation();\\n        require(_impl != address(0));\\n\\n        assembly {\\n            let ptr := mload(0x40)\\n            calldatacopy(ptr, 0, calldatasize)\\n            let result := delegatecall(gas, _impl, ptr, calldatasize, 0, 0)\\n            let size := returndatasize\\n            returndatacopy(ptr, 0, size)\\n\\n            switch result\\n            case 0 {\\n                revert(ptr, size)\\n            }\\n            default {\\n                return(ptr, size)\\n            }\\n        }\\n    }\\n}\\n\\ncontract OwnedUpgradeabilityProxy is Proxy, OwnedUpgradeabilityStorage {\\n    /**\\n     * @dev Event to show ownership has been transferred\\n     * @param previousOwner representing the address of the previous owner\\n     * @param newOwner representing the address of the new owner\\n     */\\n    event ProxyOwnershipTransferred(address previousOwner, address newOwner);\\n\\n    /**\\n     * @dev This event will be emitted every time the implementation gets upgraded\\n     * @param implementation representing the address of the upgraded implementation\\n     */\\n    event Upgraded(address indexed implementation);\\n\\n    /**\\n     * @dev Upgrades the implementation address\\n     * @param implementation representing the address of the new implementation to be set\\n     */\\n    function _upgradeTo(address implementation) internal {\\n        require(_implementation != implementation);\\n        _implementation = implementation;\\n        emit Upgraded(implementation);\\n    }\\n\\n    /**\\n     * @dev Throws if called by any account other than the owner.\\n     */\\n    modifier onlyProxyOwner() {\\n        require(msg.sender == proxyOwner());\\n        _;\\n    }\\n\\n    /**\\n     * @dev Tells the address of the proxy owner\\n     * @return the address of the proxy owner\\n     */\\n    function proxyOwner() public view returns (address) {\\n        return upgradeabilityOwner();\\n    }\\n\\n    /**\\n     * @dev Allows the current owner to transfer control of the contract to a newOwner.\\n     * @param newOwner The address to transfer ownership to.\\n     */\\n    function transferProxyOwnership(address newOwner) public onlyProxyOwner {\\n        require(newOwner != address(0));\\n        emit ProxyOwnershipTransferred(proxyOwner(), newOwner);\\n        setUpgradeabilityOwner(newOwner);\\n    }\\n\\n    /**\\n     * @dev Allows the upgradeability owner to upgrade the current implementation of the proxy.\\n     * @param implementation representing the address of the new implementation to be set.\\n     */\\n    function upgradeTo(address implementation) public onlyProxyOwner {\\n        _upgradeTo(implementation);\\n    }\\n\\n    /**\\n     * @dev Allows the upgradeability owner to upgrade the current implementation of the proxy\\n     * and delegatecall the new implementation for initialization.\\n     * @param implementation representing the address of the new implementation to be set.\\n     * @param data represents the msg.data to bet sent in the low level call. This parameter may include the function\\n     * signature of the implementation to be called with the needed payload\\n     */\\n    function upgradeToAndCall(address implementation, bytes data)\\n        public\\n        payable\\n        onlyProxyOwner\\n    {\\n        upgradeTo(implementation);\\n        require(address(this).delegatecall(data));\\n    }\\n}\\n\\ncontract OwnableDelegateProxy is OwnedUpgradeabilityProxy {\\n    constructor(\\n        address owner,\\n        address initialImplementation,\\n        bytes calldata\\n    ) public {\\n        setUpgradeabilityOwner(owner);\\n        _upgradeTo(initialImplementation);\\n        require(initialImplementation.delegatecall(calldata));\\n    }\\n}\",\"keccak256\":\"0x33baf3dd36b93533abf99ff280852bb951d68b05550d314e3b36c6a3dd43613f\"}},\"version\":1}",
  "bytecode": "0x60806040526000805460ff19168155600681905560075534801561002257600080fd5b50604051608080614cf283398101604090815281516020830151918301516060909301516000805460028054600160a060020a03958616600160a060020a03199182161790915560038054968616968216969096179095556001805496851696861696909617909555600880549390921692909316919091179055610100330261010060a860020a031992831681179092169091179055614c2a806100c86000396000f3006080604052600436106101925763ffffffff60e060020a60003504166306fdde0381146101975780630eefdbad1461022157806310796a471461025257806314350c241461030b5780631a6b13e214610325578063239e83df1461033d57806328a8ee681461041257806331e63199146104395780633464af6a1461044e5780633e1e292a1461046f5780633f67ee0d146104c8578063514f03301461060d57806354fd4d501461062e578063562b2ebc1461064357806360bef33a1461075657806363d36c0b146108aa57806364df049e146108d7578063715018a6146108ec57806371d02b381461090157806372593b4c14610a465780637966686814610c4d5780637b10399914610d965780637ccefc5214610dab5780637d76698114610dc05780638076f00514610f055780638da5cb5b14610f1d578063a25eb5d914610f32578063a8a41c7014610f47578063ab834bab1461109b578063ca595b9a146112de578063cae6047f14611423578063d537e13114611438578063e57d4adb1461163f578063f2fde38b14611657575b600080fd5b3480156101a357600080fd5b506101ac611678565b6040805160208082528351818301528351919283929083019185019080838360005b838110156101e65781810151838201526020016101ce565b50505050905090810190601f1680156102135780820380516001836020036101000a031916815260200191505b509250505060405180910390f35b34801561022d57600080fd5b506102366116af565b60408051600160a060020a039092168252519081900360200190f35b34801561025e57600080fd5b5060408051602060046024803582810135601f81018590048502860185019096528585526102f7958335600160a060020a031695369560449491939091019190819084018382808284375050604080516020601f89358b018035918201839004830284018301909452808352979a9998810197919650918201945092508291508401838280828437509497506116be9650505050505050565b604080519115158252519081900360200190f35b34801561031757600080fd5b5061032360043561172d565b005b34801561033157600080fd5b5061032360043561174e565b34801561034957600080fd5b506040805160206004803580820135601f81018490048402850184019095528484526101ac94369492936024939284019190819084018382808284375050604080516020601f89358b018035918201839004830284018301909452808352979a99988101979196509182019450925082915084018382808284375050604080516020601f89358b018035918201839004830284018301909452808352979a99988101979196509182019450925082915084018382808284375094975061176f9650505050505050565b34801561041e57600080fd5b50610427611786565b60408051918252519081900360200190f35b34801561044557600080fd5b506101ac61178c565b34801561045a57600080fd5b506101ac600160a060020a03600435166117c3565b34801561047b57600080fd5b506040805160206004803580820135601f81018490048402850184019095528484526101ac9436949293602493928401919081908401838280828437509497506118039650505050505050565b3480156104d457600080fd5b506040805160e081810190925261042791369160049160e49190839060079083908390808284375050604080516101208181019092529497969581810195945092506009915083908390808284375050604080516020601f60808901358a0180359182018390048302840183018552818452979a60ff8a3581169b848c013582169b9687013582169a6060880135909216995091975090955060a090940193820191819084018382808284375050604080516020601f89358b018035918201839004830284018301909452808352979a99988101979196509182019450925082915084018382808284375050604080516020601f89358b018035918201839004830284018301909452808352979a9998810197919650918201945092508291508401838280828437509497506118499650505050505050565b34801561061957600080fd5b50610323600160a060020a0360043516611997565b34801561063a57600080fd5b506101ac6119e2565b34801561064f57600080fd5b506040805160206004803580820135601f81018490048402850184019095528484526102f794369492936024939284019190819084018382808284375050604080516020601f89358b018035918201839004830284018301909452808352979a99988101979196509182019450925082915084018382808284375050604080516020601f89358b018035918201839004830284018301909452808352979a99988101979196509182019450925082915084018382808284375050604080516020601f89358b018035918201839004830284018301909452808352979a999881019791965091820194509250829150840183828082843750949750611a199650505050505050565b34801561076257600080fd5b506040805160e08181019092526102f791369160049160e49190839060079083908390808284375050604080516101208181019092529497969581810195945092506009915083908390808284375050604080516020601f60808901358a0180359182018390048302840183018552818452979a60ff8a3581169b848c013582169b9687013582169a6060880135909216995091975090955060a090940193820191819084018382808284375050604080516020601f89358b018035918201839004830284018301909452808352979a99988101979196509182019450925082915084018382808284375050604080516020601f89358b018035918201839004830284018301909452808352979a9998810197919650918201945092508291508401838280828437509497505050833560ff1694505050602082013591604001359050611a57565b3480156108b657600080fd5b5061042760ff6004358116906024351660443560643560843560a435611c46565b3480156108e357600080fd5b50610236611c61565b3480156108f857600080fd5b50610323611c70565b34801561090d57600080fd5b506040805160e081810190925261042791369160049160e49190839060079083908390808284375050604080516101208181019092529497969581810195945092506009915083908390808284375050604080516020601f60808901358a0180359182018390048302840183018552818452979a60ff8a3581169b848c013582169b9687013582169a6060880135909216995091975090955060a090940193820191819084018382808284375050604080516020601f89358b018035918201839004830284018301909452808352979a99988101979196509182019450925082915084018382808284375050604080516020601f89358b018035918201839004830284018301909452808352979a999881019791965091820194509250829150840183828082843750949750611ce69650505050505050565b348015610a5257600080fd5b50604080516101c08181019092526102f79136916004916101c491908390600e9083908390808284375050604080516102408181019092529497969581810195945092506012915083908390808284375050604080516101008181019092529497969581810195945092506008915083908390808284375050604080516020601f88358a0180359182018390048302840183019094528083529699989781019691955091820193509150819084018382808284375050604080516020601f89358b018035918201839004830284018301909452808352979a99988101979196509182019450925082915084018382808284375050604080516020601f89358b018035918201839004830284018301909452808352979a99988101979196509182019450925082915084018382808284375050604080516020601f89358b018035918201839004830284018301909452808352979a99988101979196509182019450925082915084018382808284375050604080516020601f89358b018035918201839004830284018301909452808352979a99988101979196509182019450925082915084018382808284375050604080516020601f89358b018035918201839004830284018301909452808352979a999881019791965091820194509250829150840183828082843750949750611e269650505050505050565b348015610c5957600080fd5b506040805160e081810190925261032391369160049160e49190839060079083908390808284375050604080516101208181019092529497969581810195945092506009915083908390808284375050604080516020601f60808901358a0180359182018390048302840183018552818452979a60ff8a3581169b848c013582169b9687013582169a6060880135909216995091975090955060a090940193820191819084018382808284375050604080516020601f89358b018035918201839004830284018301909452808352979a99988101979196509182019450925082915084018382808284375050604080516020601f89358b018035918201839004830284018301909452808352979a999881019791965091820194509250829150840183828082843750949750505050913515159250612212915050565b348015610da257600080fd5b50610236612367565b348015610db757600080fd5b50610427612376565b348015610dcc57600080fd5b506040805160e081810190925261042791369160049160e49190839060079083908390808284375050604080516101208181019092529497969581810195945092506009915083908390808284375050604080516020601f60808901358a0180359182018390048302840183018552818452979a60ff8a3581169b848c013582169b9687013582169a6060880135909216995091975090955060a090940193820191819084018382808284375050604080516020601f89358b018035918201839004830284018301909452808352979a99988101979196509182019450925082915084018382808284375050604080516020601f89358b018035918201839004830284018301909452808352979a99988101979196509182019450925082915084018382808284375094975061237c9650505050505050565b348015610f1157600080fd5b506102f76004356124bc565b348015610f2957600080fd5b506102366124d1565b348015610f3e57600080fd5b506102366124e5565b348015610f5357600080fd5b506040805160e081810190925261032391369160049160e49190839060079083908390808284375050604080516101208181019092529497969581810195945092506009915083908390808284375050604080516020601f60808901358a0180359182018390048302840183018552818452979a60ff8a3581169b848c013582169b9687013582169a6060880135909216995091975090955060a090940193820191819084018382808284375050604080516020601f89358b018035918201839004830284018301909452808352979a99988101979196509182019450925082915084018382808284375050604080516020601f89358b018035918201839004830284018301909452808352979a9998810197919650918201945092508291508401838280828437509497505050833560ff16945050506020820135916040013590506124f4565b604080516101c08181019092526103239136916004916101c491908390600e9083908390808284375050604080516102408181019092529497969581810195945092506012915083908390808284375050604080516101008181019092529497969581810195945092506008915083908390808284375050604080516020601f88358a0180359182018390048302840183019094528083529699989781019691955091820193509150819084018382808284375050604080516020601f89358b018035918201839004830284018301909452808352979a99988101979196509182019450925082915084018382808284375050604080516020601f89358b018035918201839004830284018301909452808352979a99988101979196509182019450925082915084018382808284375050604080516020601f89358b018035918201839004830284018301909452808352979a99988101979196509182019450925082915084018382808284375050604080516020601f89358b018035918201839004830284018301909452808352979a99988101979196509182019450925082915084018382808284375050604080516020601f89358b018035918201839004830284018301909452808352979a999881019791965091820194509250829150840183828082843750506040805180820182529598979681810196955093506002925084915083908082843750506040805160a0818101909252949796958181019594509250600591508390839080828437509396506126ca95505050505050565b3480156112ea57600080fd5b506040805160e08181019092526102f791369160049160e49190839060079083908390808284375050604080516101208181019092529497969581810195945092506009915083908390808284375050604080516020601f60808901358a0180359182018390048302840183018552818452979a60ff8a3581169b848c013582169b9687013582169a6060880135909216995091975090955060a090940193820191819084018382808284375050604080516020601f89358b018035918201839004830284018301909452808352979a99988101979196509182019450925082915084018382808284375050604080516020601f89358b018035918201839004830284018301909452808352979a999881019791965091820194509250829150840183828082843750949750612ae09650505050505050565b34801561142f57600080fd5b50610427612c38565b34801561144457600080fd5b50604080516101c08181019092526104279136916004916101c491908390600e9083908390808284375050604080516102408181019092529497969581810195945092506012915083908390808284375050604080516101008181019092529497969581810195945092506008915083908390808284375050604080516020601f88358a0180359182018390048302840183019094528083529699989781019691955091820193509150819084018382808284375050604080516020601f89358b018035918201839004830284018301909452808352979a99988101979196509182019450925082915084018382808284375050604080516020601f89358b018035918201839004830284018301909452808352979a99988101979196509182019450925082915084018382808284375050604080516020601f89358b018035918201839004830284018301909452808352979a99988101979196509182019450925082915084018382808284375050604080516020601f89358b018035918201839004830284018301909452808352979a99988101979196509182019450925082915084018382808284375050604080516020601f89358b018035918201839004830284018301909452808352979a999881019791965091820194509250829150840183828082843750949750612c3e9650505050505050565b34801561164b57600080fd5b506102f760043561301a565b34801561166357600080fd5b50610323600160a060020a036004351661302f565b60408051808201909152601781527f50726f6a6563742057797665726e2045786368616e6765000000000000000000602082015281565b600354600160a060020a031681565b60006060600083518551016040519080825280601f01601f1916602001820160405280156116f6578160200160208202803883390190505b509150506020810161170881856130d3565b905061171481866130d3565b506000604051835160208501895afa9695505050505050565b6000546101009004600160a060020a0316331461174957600080fd5b600655565b6000546101009004600160a060020a0316331461176a57600080fd5b600755565b606061177c848484613119565b50825b9392505050565b60075481565b60408051808201909152600c81527f4c616d62746f6e20576f726d0000000000000000000000000000000000000000602082015281565b6040805160148082528183019092526060918291600091602082016102808038833901905050915050602081016117fa81856132a0565b50909392505050565b606080600083516040519080825280601f01601f191660200182016040528015611837578160200160208202803883390190505b50915050602081016117fa81856130d3565b604080516102e0810182528a51600160a060020a0390811682526020808d01518216818401528c8401518216838501528b51606080850191909152908c01516080840152928b015160a08301528a83015160c0830152918b015190911660e08201526000906119899061010081018a60018111156118c357fe5b81526020018960018111156118d457fe5b81526020018860018111156118e557fe5b815260808d0151600160a060020a0316602082015260400187600181111561190957fe5b8152602081018790526040810186905260a0808e0151600160a060020a0316606083015260808201869052018c600660209081029190910151600160a060020a031682526080808e01519183019190915260a0808e0151604084015260c08e0151606084015260e08e0151918301919091526101008d01519101526132c0565b9a9950505050505050505050565b6000546101009004600160a060020a031633146119b357600080fd5b6008805473ffffffffffffffffffffffffffffffffffffffff1916600160a060020a0392909216919091179055565b60408051808201909152600381527f322e320000000000000000000000000000000000000000000000000000000000602082015281565b60008084511115611a2f57611a2f858486613119565b600082511115611a4457611a44838684613119565b611a4e85846132f6565b95945050505050565b6000611a61614b3a565b604080516102e08101909152808f600060209081029190910151600160a060020a03168252018f600160209081029190910151600160a060020a03168252018f600260209081029190910151600160a060020a03168252018e6000602090810291909101518252018e6001602090810291909101518252018e6002602090810291909101518252018e6003602090810291909101518252018f60036020020151600160a060020a031681526020018d6001811115611b1b57fe5b81526020018c6001811115611b2c57fe5b81526020018b6001811115611b3d57fe5b81526020018f60046020020151600160a060020a031681526020018a6001811115611b6457fe5b8152602081018a9052604081018990526060018f60056020020151600160a060020a031681526020018781526020018f6006600781101515611ba257fe5b60209081029190910151600160a060020a03168252018e6004602090810291909101518252018e6005602090810291909101518252018e6006602090810291909101518252018e6007602090810291909101518252018e6008602002015190529050611c34611c108261335a565b6040805160608101825260ff891681526020810188905290810186905283906133a5565b9e9d5050505050505050505050505050565b6000611c5687878787878761349a565b979650505050505050565b600854600160a060020a031681565b6000546101009004600160a060020a03163314611c8c57600080fd5b60008054604051610100909104600160a060020a0316917ff8df31144d9c2f0f6b59d69b8b98abd5459d07f2742c4df920b25aae33c6482091a26000805474ffffffffffffffffffffffffffffffffffffffff0019169055565b604080516102e0810182528a51600160a060020a0390811682526020808d01518216818401528c8401518216838501528b51606080850191909152908c01516080840152928b015160a08301528a83015160c0830152918b015190911660e08201526000906119899061010081018a6001811115611d6057fe5b8152602001896001811115611d7157fe5b8152602001886001811115611d8257fe5b815260808d0151600160a060020a03166020820152604001876001811115611da657fe5b8152602081018790526040810186905260a0808e0151600160a060020a0316606083015260808201869052018c600660209081029190910151600160a060020a031682526080808e01519183019190915260a0808e0151604084015260c08e0151606084015260e08e0151918301919091526101008d015191015261352d565b6000611e30614b3a565b611e38614b3a565b604080516102e08101909152808d600060209081029190910151600160a060020a03168252018d600160209081029190910151600160a060020a03168252018d600260209081029190910151600160a060020a03168252018c6000602090810291909101518252018c6001602090810291909101518252018c6002602090810291909101518252018c6003602090810291909101518252018d600360209081029190910151600160a060020a03168252018b6000602002015160ff166001811115611eff57fe5b6001811115611f0a57fe5b81526020018b6001602002015160ff166001811115611f2557fe5b6001811115611f3057fe5b81526020018b6002602002015160ff166001811115611f4b57fe5b6001811115611f5657fe5b815260808e0151600160a060020a0316602082015260608c015160409091019060ff166001811115611f8457fe5b6001811115611f8f57fe5b8152602081018b90526040810189905260a0808f0151600160a060020a0316606083015260808201889052018d600660209081029190910151600160a060020a03168252018c6004602090810291909101518252018c6005602090810291909101518252018c6006602090810291909101518252018c6007602090810291909101518252018c600860200201519052604080516102e08101909152909250808d600760209081029190910151600160a060020a03168252018d600860209081029190910151600160a060020a03168252018d600960209081029190910151600160a060020a03168252018c6009602090810291909101518252018c600a602090810291909101518252018c600b602090810291909101518252018c600c602090810291909101518252018d600a60209081029190910151600160a060020a03168252018b6004602002015160ff1660018111156120e857fe5b60018111156120f357fe5b81526020018b6005602002015160ff16600181111561210e57fe5b600181111561211957fe5b81526020018b6006602002015160ff16600181111561213457fe5b600181111561213f57fe5b81526101608e0151600160a060020a0316602082015260e08c015160409091019060ff16600181111561216e57fe5b600181111561217957fe5b8152602081018a9052604081018890526101808e0151600160a060020a031660608201526080810186905260a0018d600d60209081029190910151600160a060020a031682526101a08e0151908201526101c08d015160408201526101e08d015160608201526102008d015160808201526102208d015160a0909101529050612202828261371c565b9c9b505050505050505050505050565b61221a614b3a565b604080516102e0810182528c51600160a060020a0390811682526020808f01518216818401528e8401518216838501528d51606080850191909152908e01516080840152928d015160a08301528c83015160c0830152918d015190911660e082015261010081018a600181111561228d57fe5b815260200189600181111561229e57fe5b81526020018860018111156122af57fe5b815260808d0151600160a060020a031660208201526040018760018111156122d357fe5b8152602081018790526040810186905260a0808e0151600160a060020a0316606083015260808201869052018c600660209081029190910151600160a060020a031682526080808e01519183019190915260a0808e0151604084015260c08e0151606084015260e08e0151918301919091526101008d0151910152905061235a81836138f6565b5050505050505050505050565b600254600160a060020a031681565b60065481565b604080516102e0810182528a51600160a060020a0390811682526020808d01518216818401528c8401518216838501528b51606080850191909152908c01516080840152928b015160a08301528a83015160c0830152918b015190911660e08201526000906119899061010081018a60018111156123f657fe5b815260200189600181111561240757fe5b815260200188600181111561241857fe5b815260808d0151600160a060020a0316602082015260400187600181111561243c57fe5b8152602081018790526040810186905260a0808e0151600160a060020a0316606083015260808201869052018c600660209081029190910151600160a060020a031682526080808e01519183019190915260a0808e0151604084015260c08e0151606084015260e08e0151918301919091526101008d015191015261335a565b60046020526000908152604090205460ff1681565b6000546101009004600160a060020a031681565b600154600160a060020a031681565b604080516102e081019091526126bc90808e600060209081029190910151600160a060020a03168252018e600160209081029190910151600160a060020a03168252018e600260209081029190910151600160a060020a03168252018d6000602090810291909101518252018d6001602090810291909101518252018d6002602090810291909101518252018d6003602090810291909101518252018e60036020020151600160a060020a031681526020018c60018111156125b257fe5b81526020018b60018111156125c357fe5b81526020018a60018111156125d457fe5b815260808f0151600160a060020a031660208201526040018960018111156125f857fe5b815260208101899052604081018890526060018e60056020020151600160a060020a031681526020018681526020018e600660078110151561263657fe5b60209081029190910151600160a060020a03168252018d6004602090810291909101518252018d6005602090810291909101518252018d6006602090810291909101518252018d6007602090810291909101518252018d6008602090810291909101519091526040805160608101825260ff881681529182018690528101849052613cba565b505050505050505050505050565b604080516102e0810182528c51600160a060020a0390811682526020808f01518216818401528e8401518216838501528d51606080850191909152908e01516080840152928d015160a08301528c83015160c0830152918d015190911660e0820152895161235a919061010082019060ff16600181111561274757fe5b600181111561275257fe5b81526020018b6001602002015160ff16600181111561276d57fe5b600181111561277857fe5b81526020018b6002602002015160ff16600181111561279357fe5b600181111561279e57fe5b815260808e0151600160a060020a0316602082015260608c015160409091019060ff1660018111156127cc57fe5b60018111156127d757fe5b8152602081018b90526040810189905260a0808f0151600160a060020a0316606083015260808201889052018d600660209081029190910151600160a060020a03168252018c6004602090810291909101518252018c6005602090810291909101518252018c6006602090810291909101518252018c6007602090810291909101518252018c6008602002015190526040805160608101909152808560006020908102919091015160ff168252018460006020908102919091015182520184600160200201519052604080516102e08101909152808f600760209081029190910151600160a060020a03168252018f600860209081029190910151600160a060020a03168252018f600960209081029190910151600160a060020a03168252018e6009602090810291909101518252018e600a602090810291909101518252018e600b602090810291909101518252018e600c602090810291909101518252018f600a60209081029190910151600160a060020a03168252018d6004602002015160ff16600181111561296657fe5b600181111561297157fe5b81526020018d6005602002015160ff16600181111561298c57fe5b600181111561299757fe5b81526020018d6006602002015160ff1660018111156129b257fe5b60018111156129bd57fe5b81526020018f600b60209081029190910151600160a060020a03168252018d6007602002015160ff1660018111156129f157fe5b60018111156129fc57fe5b8152602081018c9052604081018a90526060018f600c6020020151600160a060020a031681526020018781526020018f600d600e81101515612a3a57fe5b60209081029190910151600160a060020a03168252018e600d602090810291909101518252018e600e602090810291909101518252018e600f602090810291909101518252018e6010602090810291909101518252018e6011602002015190526040805160608101909152808760016020908102919091015160ff1682520186600260209081029190910151825201866003602002015190528560046020020151613d27565b6000612aea614b3a565b604080516102e0810182528c51600160a060020a0390811682526020808f01518216818401528e8401518216838501528d51606080850191909152908e01516080840152928d015160a08301528c83015160c0830152918d015190911660e082015261010081018a6001811115612b5d57fe5b8152602001896001811115612b6e57fe5b8152602001886001811115612b7f57fe5b815260808d0151600160a060020a03166020820152604001876001811115612ba357fe5b8152602081018790526040810186905260a0808e0151600160a060020a0316606083015260808201869052018c600660209081029190910151600160a060020a031682526080808e01519183019190915260a0808e0151604084015260c08e0151606084015260e08e0151918301919091526101008d01519101529050612c2981614270565b9b9a5050505050505050505050565b61271081565b6000612c48614b3a565b612c50614b3a565b604080516102e08101909152808d600060209081029190910151600160a060020a03168252018d600160209081029190910151600160a060020a03168252018d600260209081029190910151600160a060020a03168252018c6000602090810291909101518252018c6001602090810291909101518252018c6002602090810291909101518252018c6003602090810291909101518252018d600360209081029190910151600160a060020a03168252018b6000602002015160ff166001811115612d1757fe5b6001811115612d2257fe5b81526020018b6001602002015160ff166001811115612d3d57fe5b6001811115612d4857fe5b81526020018b6002602002015160ff166001811115612d6357fe5b6001811115612d6e57fe5b815260808e0151600160a060020a0316602082015260608c015160409091019060ff166001811115612d9c57fe5b6001811115612da757fe5b8152602081018b90526040810189905260a0808f0151600160a060020a0316606083015260808201889052018d600660209081029190910151600160a060020a03168252018c6004602090810291909101518252018c6005602090810291909101518252018c6006602090810291909101518252018c6007602090810291909101518252018c600860200201519052604080516102e08101909152909250808d600760209081029190910151600160a060020a03168252018d600860209081029190910151600160a060020a03168252018d600960209081029190910151600160a060020a03168252018c6009602090810291909101518252018c600a602090810291909101518252018c600b602090810291909101518252018c600c602090810291909101518252018d600a60209081029190910151600160a060020a03168252018b6004602002015160ff166001811115612f0057fe5b6001811115612f0b57fe5b81526020018b6005602002015160ff166001811115612f2657fe5b6001811115612f3157fe5b81526020018b6006602002015160ff166001811115612f4c57fe5b6001811115612f5757fe5b81526101608e0151600160a060020a0316602082015260e08c015160409091019060ff166001811115612f8657fe5b6001811115612f9157fe5b8152602081018a9052604081018890526101808e0151600160a060020a031660608201526080810186905260a0018d600d60209081029190910151600160a060020a031682526101a08e0151908201526101c08d015160408201526101e08d015160608201526102008d015160808201526102208d015160a090910152905061220282826142f7565b60056020526000908152604090205460ff1681565b6000546101009004600160a060020a0316331461304b57600080fd5b600160a060020a038116151561306057600080fd5b60008054604051600160a060020a038085169361010090930416917f8be0079c531659141344cd1fd0a4f28419497f9722a3daafe3b4186f6b6457e091a360008054600160a060020a039092166101000274ffffffffffffffffffffffffffffffffffffffff0019909216919091179055565b6000808251111561311057815180602001830160208401855b600183831014156131075781518152602091820191016130ec565b50505092909201915b50815b92915050565b60008060008451865114151561312e57600080fd5b835186511461313c57600080fd5b855160209004925060208084029250839083041461315657fe5b5060005b82811015613186576001016020810284810151868201519188018051928216911990921617905261315a565b60008311156131b65782905080600101602002808501518187015181168289015182191617828901525050613298565b50805b85518110156132985784818151811015156131d057fe5b90602001015160f860020a900460f860020a0284828151811015156131f157fe5b90602001015160f860020a900460f860020a0216868281518110151561321357fe5b90602001015160f860020a900460f860020a02858381518110151561323457fe5b90602001015160f860020a900460f860020a0260ff60f860020a02181617868281518110151561326057fe5b9060200101907effffffffffffffffffffffffffffffffffffffffffffffffffffffffffffff1916908160001a9053506001016131b9565b505050505050565b600160a060020a03166c0100000000000000000000000002815260140190565b60006132ee826101200151836101400151846102400151856102600151866102800151876102a0015161349a565b90505b919050565b8151815160009160019181148083146133125760009250613350565b600160208701838101602088015b60028483851001141561334b57805183511461333f5760009650600093505b60209283019201613320565b505050505b5090949350505050565b60006133658261352d565b604080517f19457468657265756d205369676e6564204d6573736167653a0a3332000000008152601c8101929092525190819003603c0190209050919050565b60006133b083614270565b15156133be5750600061177f565b60008481526004602052604090205460ff16156133dd5750600061177f565b60008481526005602052604090205460ff16156133fc5750600161177f565b602080840151835184830151604080870151815160008082528188018085528c905260ff909516818401526060810193909352608083015251600160a060020a039093169360019360a0808401949293601f19830193908390039091019190865af115801561346f573d6000803e3d6000fd5b50505060206040510351600160a060020a031614156134905750600161177f565b5060009392505050565b600080808760018111156134aa57fe5b14156134b857859150613522565b60018760018111156134c657fe5b1415613522576134f16134e2866134dd4288614387565b614399565b6134ec8587614387565b6143c2565b9050600188600181111561350157fe5b1415613518576135118682614387565b9150613522565b61351186826143d7565b509695505050505050565b6000806060600061353d856143e4565b9250826040519080825280601f01601f19166020018201604052801561356d578160200160208202803883390190505b5091506020820190506135848186600001516132a0565b90506135948186602001516132a0565b90506135a48186604001516132a0565b90506135b4818660600151614404565b90506135c4818660800151614404565b90506135d4818660a00151614404565b90506135e4818660c00151614404565b90506135f4818660e001516132a0565b905061361081866101000151600181111561360b57fe5b61440c565b905061362781866101200151600181111561360b57fe5b905061363e81866101400151600181111561360b57fe5b905061364f818661016001516132a0565b905061366681866101800151600181111561360b57fe5b905061367781866101a001516130d3565b905061368881866101c001516130d3565b905061369981866101e001516132a0565b90506136aa818661020001516130d3565b90506136bb818661022001516132a0565b90506136cc81866102400151614404565b90506136dd81866102600151614404565b90506136ee81866102800151614404565b90506136ff81866102a00151614404565b905061371081866102c00151614404565b50506020012092915050565b600080836101200151600181111561373057fe5b14801561374d57506001826101200151600181111561374b57fe5b145b80156137785750816101000151600181111561376557fe5b836101000151600181111561377657fe5b145b801561379f5750816102200151600160a060020a0316836102200151600160a060020a0316145b80156137d957506040820151600160a060020a031615806137d957508260200151600160a060020a03168260400151600160a060020a0316145b801561381357506040830151600160a060020a0316158061381357508160200151600160a060020a03168360400151600160a060020a0316145b801561386e575060e0820151600160a060020a0316158015613841575060e0830151600160a060020a031615155b8061386e575060e0820151600160a060020a03161580159061386e575060e0830151600160a060020a0316155b80156138955750816101600151600160a060020a0316836101600151600160a060020a0316145b80156138c0575081610180015160018111156138ad57fe5b83610180015160018111156138be57fe5b145b80156138db57506138db836102800151846102a00151614419565b801561177f575061177f826102800151836102a00151614419565b6020820151600090600160a060020a0316331461391257600080fd5b61391b8361335a565b60008181526005602052604090205490915060ff161561393a57600080fd5b600160056000836000191660001916815260200190815260200160002060006101000a81548160ff0219169083151502179055508260e00151600160a060020a03168360200151600160a060020a031682600019167f90c7f9f5b58c15f0f635bfb99f55d3d78fdbef3559e7d8abf5c81052a527662286600001518760400151886060015189608001518a60a001518b60c001518c61010001518d61012001518e61014001518f6101600151604051808b600160a060020a0316600160a060020a031681526020018a600160a060020a0316600160a060020a03168152602001898152602001888152602001878152602001868152602001856001811115613a3e57fe5b60ff168152602001846001811115613a5257fe5b60ff168152602001836001811115613a6657fe5b60ff168152600160a060020a039092166020830152506040805191829003019950975050505050505050a480600019167fe55393c778364e440d958b39ac1debd99dcfae3775a8a04d1e79124adf6a2d08846101800151856101a00151866101c00151876101e001518861020001518961022001518a61024001518b61026001518c61028001518d6102a001518e6102c001518e604051808d6001811115613b0a57fe5b60ff16815260200180602001806020018c600160a060020a0316600160a060020a03168152602001806020018b600160a060020a0316600160a060020a031681526020018a81526020018981526020018881526020018781526020018681526020018515151515815260200184810384528f818151815260200191508051906020019080838360005b83811015613bab578181015183820152602001613b93565b50505050905090810190601f168015613bd85780820380516001836020036101000a031916815260200191505b5084810383528e818151815260200191508051906020019080838360005b83811015613c0e578181015183820152602001613bf6565b50505050905090810190601f168015613c3b5780820380516001836020036101000a031916815260200191505b5084810382528c5181528c516020918201918e019080838360005b83811015613c6e578181015183820152602001613c56565b50505050905090810190601f168015613c9b5780820380516001836020036101000a031916815260200191505b509f5050505050505050505050505050505060405180910390a2505050565b6000613cc68383614435565b6020840151909150600160a060020a03163314613ce257600080fd5b600081815260046020526040808220805460ff191660011790555182917f5152abf959f6564662358c2e52b702259b78bac5ee7842a0f01937e670efcc7d91a2505050565b6000805481908190819081908190819060ff1615613d4457600080fd5b6000805460ff1916600117905560208c0151600160a060020a0316331415613d7f57613d6f8c614270565b1515613d7a57600080fd5b613d8c565b613d898c8c614435565b96505b60208a0151600160a060020a0316331415613dba57613daa8a614270565b1515613db557600080fd5b613dc7565b613dc48a8a614435565b95505b613dd18c8b61371c565b1515613ddc57600080fd5b6101608a0151803b9550935060008511613df557600080fd5b60008c6101c00151511115613e1e57613e1e8c6101a001518b6101a001518e6101c00151613119565b60008a6101c00151511115613e4757613e478a6101a001518d6101a001518c6101c00151613119565b613e5b8c6101a001518b6101a001516132f6565b1515613e6657600080fd5b6002546020808c0151604080517fc4552791000000000000000000000000000000000000000000000000000000008152600160a060020a0392831660048201529051919093169263c45527919260248083019391928290030181600087803b158015613ed157600080fd5b505af1158015613ee5573d6000803e3d6000fd5b505050506040513d6020811015613efb57600080fd5b50519250600160a060020a0383161515613f1457600080fd5b600260009054906101000a9004600160a060020a0316600160a060020a03166397204d8e6040518163ffffffff1660e060020a028152600401602060405180830381600087803b158015613f6757600080fd5b505af1158015613f7b573d6000803e3d6000fd5b505050506040513d6020811015613f9157600080fd5b5051604080517f5c60da1b0000000000000000000000000000000000000000000000000000000081529051600160a060020a0392831692861691635c60da1b9160048083019260209291908290030181600087803b158015613ff257600080fd5b505af1158015614006573d6000803e3d6000fd5b505050506040513d602081101561401c57600080fd5b5051600160a060020a03161461403157600080fd5b60208c0151839250600160a060020a03163314614062576000878152600460205260409020805460ff191660011790555b60208a0151600160a060020a03163314614090576000868152600460205260409020805460ff191660011790555b61409a8c8b614459565b905081600160a060020a0316631b0f7ba98b61016001518c61018001518d6101a001516040518463ffffffff1660e060020a0281526004018084600160a060020a0316600160a060020a031681526020018360018111156140f757fe5b60ff16815260200180602001828103825283818151815260200191508051906020019080838360005b83811015614138578181015183820152602001614120565b50505050905090810190601f1680156141655780820380516001836020036101000a031916815260200191505b50945050505050602060405180830381600087803b15801561418657600080fd5b505af115801561419a573d6000803e3d6000fd5b505050506040513d60208110156141b057600080fd5b505115156141bd57600080fd5b60e08a01518890600160a060020a031615156141dd578a602001516141e3565b8c602001515b60e08c0151600160a060020a0391821691161515614205578d6020015161420b565b8b602001515b604080518b8152602081018b90528082018690529051600160a060020a0392909216917fc4109843e0b7d514e4c093114b863f8e7d8d9a458c372cd51bfe526b588006c99181900360600190a450506000805460ff1916905550505050505050505050565b8051600090600160a060020a0316301461428c575060006132f1565b6142a0826101400151836102a00151614a39565b15156142ae575060006132f1565b600182610100015160018111156142c157fe5b1480156142e257506006548260a0015110806142e257506007548260c00151105b156142ef575060006132f1565b506001919050565b6000806000614328846101200151856101400151866102400151876102600151886102800151896102a0015161349a565b91506143568561012001518661014001518761024001518861026001518961028001518a6102a0015161349a565b90508181101561436557600080fd5b60e0840151600160a060020a0316151561437f5780611a4e565b509392505050565b60008282111561439357fe5b50900390565b60008215156143aa57506000613113565b508181028183828115156143ba57fe5b041461311357fe5b600081838115156143cf57fe5b049392505050565b8181018281101561311357fe5b610200810151516101c0820151516101a08301515101016101b001919050565b815260200190565b6000818353505060010190565b6000428310801561177f575081158061177f5750504210919050565b6000806144418461335a565b905061444e8185856133a5565b151561177f57600080fd5b600080600080600080600080600080600160a060020a03168a6102200151600160a060020a031614151561449257341561449257600080fd5b61449c8b8b6142f7565b97506000881180156144bb57506102208a0151600160a060020a031615155b156144d9576144d98a61022001518c602001518c602001518b614a58565b60e08a0151889750879650600160a060020a0316156147f5576080808c0151908b0151111561450757600080fd5b60018a6101000151600181111561451a57fe5b14156147c25760c0808c0151908b0151111561453557600080fd5b60008a6060015111156145d95761455b6145538b606001518a614399565b6127106143c2565b6102208b0151909550600160a060020a031615156145c05761457d8786614387565b60e08b0151604051919850600160a060020a03169086156108fc029087906000818181858888f193505050501580156145ba573d6000803e3d6000fd5b506145d9565b6145d98a61022001518b602001518c60e0015188614a58565b60008a608001511115614675576145f76145538b608001518a614399565b6102208b0151909450600160a060020a0316151561465c5761461986856143d7565b60e08b0151604051919750600160a060020a03169085156108fc029086906000818181858888f19350505050158015614656573d6000803e3d6000fd5b50614675565b6146758a61022001518c602001518c60e0015187614a58565b60008a60a001511115614719576146936145538b60a001518a614399565b6102208b0151909350600160a060020a031615156146f6576146b58784614387565b600854604051919850600160a060020a03169084156108fc029085906000818181858888f193505050501580156146f0573d6000803e3d6000fd5b50614719565b6102208a015160208b0151600854614719929190600160a060020a031686614a58565b60008a60c0015111156147bd576147376145538b60c001518a614399565b6102208b0151909250600160a060020a0316151561479a5761475986836143d7565b600854604051919750600160a060020a03169083156108fc029084906000818181858888f19350505050158015614794573d6000803e3d6000fd5b506147bd565b6102208a015160208c01516008546147bd929190600160a060020a031685614a58565b6147f0565b6147d98a602001518b60e001518c60600151614b1d565b6147f08b602001518b60e001518c60800151614b1d565b614976565b6080808b0151908c0151111561480a57600080fd5b60018a6101000151600181111561481d57fe5b1415614948576102208a0151600160a060020a0316151561483d57600080fd5b60c0808b0151908c0151111561485257600080fd5b60008b60600151111561488b576148706145538c606001518a614399565b945061488b8a61022001518c602001518d60e0015188614a58565b60008b6080015111156148c4576148a96145538c608001518a614399565b93506148c48a61022001518b602001518d60e0015187614a58565b60008b60a001511115614906576148e26145538c60a001518a614399565b6102208b015160208d015160085492955061490692600160a060020a031686614a58565b60008b60c0015111156147f0576149246145538c60c001518a614399565b6102208b015160208c01516008549294506147f092600160a060020a031685614a58565b61495f8b602001518c60e001518d60600151614b1d565b6149768a602001518c60e001518d60800151614b1d565b6102208a0151600160a060020a03161515614a2a573486111561499857600080fd5b8960200151600160a060020a03166108fc889081150290604051600060405180830381858888f193505050501580156149d5573d6000803e3d6000fd5b506149e03487614387565b90506000811115614a2a578a60200151600160a060020a03166108fc829081150290604051600060405180830381858888f19350505050158015614a28573d6000803e3d6000fd5b505b50959998505050505050505050565b600080836001811115614a4857fe5b148061177f575050600010919050565b6000811115614b1757600354604080517f15dacbea000000000000000000000000000000000000000000000000000000008152600160a060020a0387811660048301528681166024830152858116604483015260648201859052915191909216916315dacbea9160848083019260209291908290030181600087803b158015614ae057600080fd5b505af1158015614af4573d6000803e3d6000fd5b505050506040513d6020811015614b0a57600080fd5b50511515614b1757600080fd5b50505050565b600154614b3590600160a060020a0316848484614a58565b505050565b604080516102e081018252600080825260208201819052918101829052606081018290526080810182905260a0810182905260c0810182905260e081018290529061010082019081526020016000815260200160008152600060208201819052604090910190815260200160608152602001606081526020016000600160a060020a03168152602001606081526020016000600160a060020a03168152602001600081526020016000815260200160008152602001600081526020016000815250905600a165627a7a723058208f42066445f61fbcc76f8d3c008f50ae0e410fc86a1f4f86ded08e5c84dff6c40029",
  "deployedBytecode": "0x6080604052600436106101925763ffffffff60e060020a60003504166306fdde0381146101975780630eefdbad1461022157806310796a471461025257806314350c241461030b5780631a6b13e214610325578063239e83df1461033d57806328a8ee681461041257806331e63199146104395780633464af6a1461044e5780633e1e292a1461046f5780633f67ee0d146104c8578063514f03301461060d57806354fd4d501461062e578063562b2ebc1461064357806360bef33a1461075657806363d36c0b146108aa57806364df049e146108d7578063715018a6146108ec57806371d02b381461090157806372593b4c14610a465780637966686814610c4d5780637b10399914610d965780637ccefc5214610dab5780637d76698114610dc05780638076f00514610f055780638da5cb5b14610f1d578063a25eb5d914610f32578063a8a41c7014610f47578063ab834bab1461109b578063ca595b9a146112de578063cae6047f14611423578063d537e13114611438578063e57d4adb1461163f578063f2fde38b14611657575b600080fd5b3480156101a357600080fd5b506101ac611678565b6040805160208082528351818301528351919283929083019185019080838360005b838110156101e65781810151838201526020016101ce565b50505050905090810190601f1680156102135780820380516001836020036101000a031916815260200191505b509250505060405180910390f35b34801561022d57600080fd5b506102366116af565b60408051600160a060020a039092168252519081900360200190f35b34801561025e57600080fd5b5060408051602060046024803582810135601f81018590048502860185019096528585526102f7958335600160a060020a031695369560449491939091019190819084018382808284375050604080516020601f89358b018035918201839004830284018301909452808352979a9998810197919650918201945092508291508401838280828437509497506116be9650505050505050565b604080519115158252519081900360200190f35b34801561031757600080fd5b5061032360043561172d565b005b34801561033157600080fd5b5061032360043561174e565b34801561034957600080fd5b506040805160206004803580820135601f81018490048402850184019095528484526101ac94369492936024939284019190819084018382808284375050604080516020601f89358b018035918201839004830284018301909452808352979a99988101979196509182019450925082915084018382808284375050604080516020601f89358b018035918201839004830284018301909452808352979a99988101979196509182019450925082915084018382808284375094975061176f9650505050505050565b34801561041e57600080fd5b50610427611786565b60408051918252519081900360200190f35b34801561044557600080fd5b506101ac61178c565b34801561045a57600080fd5b506101ac600160a060020a03600435166117c3565b34801561047b57600080fd5b506040805160206004803580820135601f81018490048402850184019095528484526101ac9436949293602493928401919081908401838280828437509497506118039650505050505050565b3480156104d457600080fd5b506040805160e081810190925261042791369160049160e49190839060079083908390808284375050604080516101208181019092529497969581810195945092506009915083908390808284375050604080516020601f60808901358a0180359182018390048302840183018552818452979a60ff8a3581169b848c013582169b9687013582169a6060880135909216995091975090955060a090940193820191819084018382808284375050604080516020601f89358b018035918201839004830284018301909452808352979a99988101979196509182019450925082915084018382808284375050604080516020601f89358b018035918201839004830284018301909452808352979a9998810197919650918201945092508291508401838280828437509497506118499650505050505050565b34801561061957600080fd5b50610323600160a060020a0360043516611997565b34801561063a57600080fd5b506101ac6119e2565b34801561064f57600080fd5b506040805160206004803580820135601f81018490048402850184019095528484526102f794369492936024939284019190819084018382808284375050604080516020601f89358b018035918201839004830284018301909452808352979a99988101979196509182019450925082915084018382808284375050604080516020601f89358b018035918201839004830284018301909452808352979a99988101979196509182019450925082915084018382808284375050604080516020601f89358b018035918201839004830284018301909452808352979a999881019791965091820194509250829150840183828082843750949750611a199650505050505050565b34801561076257600080fd5b506040805160e08181019092526102f791369160049160e49190839060079083908390808284375050604080516101208181019092529497969581810195945092506009915083908390808284375050604080516020601f60808901358a0180359182018390048302840183018552818452979a60ff8a3581169b848c013582169b9687013582169a6060880135909216995091975090955060a090940193820191819084018382808284375050604080516020601f89358b018035918201839004830284018301909452808352979a99988101979196509182019450925082915084018382808284375050604080516020601f89358b018035918201839004830284018301909452808352979a9998810197919650918201945092508291508401838280828437509497505050833560ff1694505050602082013591604001359050611a57565b3480156108b657600080fd5b5061042760ff6004358116906024351660443560643560843560a435611c46565b3480156108e357600080fd5b50610236611c61565b3480156108f857600080fd5b50610323611c70565b34801561090d57600080fd5b506040805160e081810190925261042791369160049160e49190839060079083908390808284375050604080516101208181019092529497969581810195945092506009915083908390808284375050604080516020601f60808901358a0180359182018390048302840183018552818452979a60ff8a3581169b848c013582169b9687013582169a6060880135909216995091975090955060a090940193820191819084018382808284375050604080516020601f89358b018035918201839004830284018301909452808352979a99988101979196509182019450925082915084018382808284375050604080516020601f89358b018035918201839004830284018301909452808352979a999881019791965091820194509250829150840183828082843750949750611ce69650505050505050565b348015610a5257600080fd5b50604080516101c08181019092526102f79136916004916101c491908390600e9083908390808284375050604080516102408181019092529497969581810195945092506012915083908390808284375050604080516101008181019092529497969581810195945092506008915083908390808284375050604080516020601f88358a0180359182018390048302840183019094528083529699989781019691955091820193509150819084018382808284375050604080516020601f89358b018035918201839004830284018301909452808352979a99988101979196509182019450925082915084018382808284375050604080516020601f89358b018035918201839004830284018301909452808352979a99988101979196509182019450925082915084018382808284375050604080516020601f89358b018035918201839004830284018301909452808352979a99988101979196509182019450925082915084018382808284375050604080516020601f89358b018035918201839004830284018301909452808352979a99988101979196509182019450925082915084018382808284375050604080516020601f89358b018035918201839004830284018301909452808352979a999881019791965091820194509250829150840183828082843750949750611e269650505050505050565b348015610c5957600080fd5b506040805160e081810190925261032391369160049160e49190839060079083908390808284375050604080516101208181019092529497969581810195945092506009915083908390808284375050604080516020601f60808901358a0180359182018390048302840183018552818452979a60ff8a3581169b848c013582169b9687013582169a6060880135909216995091975090955060a090940193820191819084018382808284375050604080516020601f89358b018035918201839004830284018301909452808352979a99988101979196509182019450925082915084018382808284375050604080516020601f89358b018035918201839004830284018301909452808352979a999881019791965091820194509250829150840183828082843750949750505050913515159250612212915050565b348015610da257600080fd5b50610236612367565b348015610db757600080fd5b50610427612376565b348015610dcc57600080fd5b506040805160e081810190925261042791369160049160e49190839060079083908390808284375050604080516101208181019092529497969581810195945092506009915083908390808284375050604080516020601f60808901358a0180359182018390048302840183018552818452979a60ff8a3581169b848c013582169b9687013582169a6060880135909216995091975090955060a090940193820191819084018382808284375050604080516020601f89358b018035918201839004830284018301909452808352979a99988101979196509182019450925082915084018382808284375050604080516020601f89358b018035918201839004830284018301909452808352979a99988101979196509182019450925082915084018382808284375094975061237c9650505050505050565b348015610f1157600080fd5b506102f76004356124bc565b348015610f2957600080fd5b506102366124d1565b348015610f3e57600080fd5b506102366124e5565b348015610f5357600080fd5b506040805160e081810190925261032391369160049160e49190839060079083908390808284375050604080516101208181019092529497969581810195945092506009915083908390808284375050604080516020601f60808901358a0180359182018390048302840183018552818452979a60ff8a3581169b848c013582169b9687013582169a6060880135909216995091975090955060a090940193820191819084018382808284375050604080516020601f89358b018035918201839004830284018301909452808352979a99988101979196509182019450925082915084018382808284375050604080516020601f89358b018035918201839004830284018301909452808352979a9998810197919650918201945092508291508401838280828437509497505050833560ff16945050506020820135916040013590506124f4565b604080516101c08181019092526103239136916004916101c491908390600e9083908390808284375050604080516102408181019092529497969581810195945092506012915083908390808284375050604080516101008181019092529497969581810195945092506008915083908390808284375050604080516020601f88358a0180359182018390048302840183019094528083529699989781019691955091820193509150819084018382808284375050604080516020601f89358b018035918201839004830284018301909452808352979a99988101979196509182019450925082915084018382808284375050604080516020601f89358b018035918201839004830284018301909452808352979a99988101979196509182019450925082915084018382808284375050604080516020601f89358b018035918201839004830284018301909452808352979a99988101979196509182019450925082915084018382808284375050604080516020601f89358b018035918201839004830284018301909452808352979a99988101979196509182019450925082915084018382808284375050604080516020601f89358b018035918201839004830284018301909452808352979a999881019791965091820194509250829150840183828082843750506040805180820182529598979681810196955093506002925084915083908082843750506040805160a0818101909252949796958181019594509250600591508390839080828437509396506126ca95505050505050565b3480156112ea57600080fd5b506040805160e08181019092526102f791369160049160e49190839060079083908390808284375050604080516101208181019092529497969581810195945092506009915083908390808284375050604080516020601f60808901358a0180359182018390048302840183018552818452979a60ff8a3581169b848c013582169b9687013582169a6060880135909216995091975090955060a090940193820191819084018382808284375050604080516020601f89358b018035918201839004830284018301909452808352979a99988101979196509182019450925082915084018382808284375050604080516020601f89358b018035918201839004830284018301909452808352979a999881019791965091820194509250829150840183828082843750949750612ae09650505050505050565b34801561142f57600080fd5b50610427612c38565b34801561144457600080fd5b50604080516101c08181019092526104279136916004916101c491908390600e9083908390808284375050604080516102408181019092529497969581810195945092506012915083908390808284375050604080516101008181019092529497969581810195945092506008915083908390808284375050604080516020601f88358a0180359182018390048302840183019094528083529699989781019691955091820193509150819084018382808284375050604080516020601f89358b018035918201839004830284018301909452808352979a99988101979196509182019450925082915084018382808284375050604080516020601f89358b018035918201839004830284018301909452808352979a99988101979196509182019450925082915084018382808284375050604080516020601f89358b018035918201839004830284018301909452808352979a99988101979196509182019450925082915084018382808284375050604080516020601f89358b018035918201839004830284018301909452808352979a99988101979196509182019450925082915084018382808284375050604080516020601f89358b018035918201839004830284018301909452808352979a999881019791965091820194509250829150840183828082843750949750612c3e9650505050505050565b34801561164b57600080fd5b506102f760043561301a565b34801561166357600080fd5b50610323600160a060020a036004351661302f565b60408051808201909152601781527f50726f6a6563742057797665726e2045786368616e6765000000000000000000602082015281565b600354600160a060020a031681565b60006060600083518551016040519080825280601f01601f1916602001820160405280156116f6578160200160208202803883390190505b509150506020810161170881856130d3565b905061171481866130d3565b506000604051835160208501895afa9695505050505050565b6000546101009004600160a060020a0316331461174957600080fd5b600655565b6000546101009004600160a060020a0316331461176a57600080fd5b600755565b606061177c848484613119565b50825b9392505050565b60075481565b60408051808201909152600c81527f4c616d62746f6e20576f726d0000000000000000000000000000000000000000602082015281565b6040805160148082528183019092526060918291600091602082016102808038833901905050915050602081016117fa81856132a0565b50909392505050565b606080600083516040519080825280601f01601f191660200182016040528015611837578160200160208202803883390190505b50915050602081016117fa81856130d3565b604080516102e0810182528a51600160a060020a0390811682526020808d01518216818401528c8401518216838501528b51606080850191909152908c01516080840152928b015160a08301528a83015160c0830152918b015190911660e08201526000906119899061010081018a60018111156118c357fe5b81526020018960018111156118d457fe5b81526020018860018111156118e557fe5b815260808d0151600160a060020a0316602082015260400187600181111561190957fe5b8152602081018790526040810186905260a0808e0151600160a060020a0316606083015260808201869052018c600660209081029190910151600160a060020a031682526080808e01519183019190915260a0808e0151604084015260c08e0151606084015260e08e0151918301919091526101008d01519101526132c0565b9a9950505050505050505050565b6000546101009004600160a060020a031633146119b357600080fd5b6008805473ffffffffffffffffffffffffffffffffffffffff1916600160a060020a0392909216919091179055565b60408051808201909152600381527f322e320000000000000000000000000000000000000000000000000000000000602082015281565b60008084511115611a2f57611a2f858486613119565b600082511115611a4457611a44838684613119565b611a4e85846132f6565b95945050505050565b6000611a61614b3a565b604080516102e08101909152808f600060209081029190910151600160a060020a03168252018f600160209081029190910151600160a060020a03168252018f600260209081029190910151600160a060020a03168252018e6000602090810291909101518252018e6001602090810291909101518252018e6002602090810291909101518252018e6003602090810291909101518252018f60036020020151600160a060020a031681526020018d6001811115611b1b57fe5b81526020018c6001811115611b2c57fe5b81526020018b6001811115611b3d57fe5b81526020018f60046020020151600160a060020a031681526020018a6001811115611b6457fe5b8152602081018a9052604081018990526060018f60056020020151600160a060020a031681526020018781526020018f6006600781101515611ba257fe5b60209081029190910151600160a060020a03168252018e6004602090810291909101518252018e6005602090810291909101518252018e6006602090810291909101518252018e6007602090810291909101518252018e6008602002015190529050611c34611c108261335a565b6040805160608101825260ff891681526020810188905290810186905283906133a5565b9e9d5050505050505050505050505050565b6000611c5687878787878761349a565b979650505050505050565b600854600160a060020a031681565b6000546101009004600160a060020a03163314611c8c57600080fd5b60008054604051610100909104600160a060020a0316917ff8df31144d9c2f0f6b59d69b8b98abd5459d07f2742c4df920b25aae33c6482091a26000805474ffffffffffffffffffffffffffffffffffffffff0019169055565b604080516102e0810182528a51600160a060020a0390811682526020808d01518216818401528c8401518216838501528b51606080850191909152908c01516080840152928b015160a08301528a83015160c0830152918b015190911660e08201526000906119899061010081018a6001811115611d6057fe5b8152602001896001811115611d7157fe5b8152602001886001811115611d8257fe5b815260808d0151600160a060020a03166020820152604001876001811115611da657fe5b8152602081018790526040810186905260a0808e0151600160a060020a0316606083015260808201869052018c600660209081029190910151600160a060020a031682526080808e01519183019190915260a0808e0151604084015260c08e0151606084015260e08e0151918301919091526101008d015191015261352d565b6000611e30614b3a565b611e38614b3a565b604080516102e08101909152808d600060209081029190910151600160a060020a03168252018d600160209081029190910151600160a060020a03168252018d600260209081029190910151600160a060020a03168252018c6000602090810291909101518252018c6001602090810291909101518252018c6002602090810291909101518252018c6003602090810291909101518252018d600360209081029190910151600160a060020a03168252018b6000602002015160ff166001811115611eff57fe5b6001811115611f0a57fe5b81526020018b6001602002015160ff166001811115611f2557fe5b6001811115611f3057fe5b81526020018b6002602002015160ff166001811115611f4b57fe5b6001811115611f5657fe5b815260808e0151600160a060020a0316602082015260608c015160409091019060ff166001811115611f8457fe5b6001811115611f8f57fe5b8152602081018b90526040810189905260a0808f0151600160a060020a0316606083015260808201889052018d600660209081029190910151600160a060020a03168252018c6004602090810291909101518252018c6005602090810291909101518252018c6006602090810291909101518252018c6007602090810291909101518252018c600860200201519052604080516102e08101909152909250808d600760209081029190910151600160a060020a03168252018d600860209081029190910151600160a060020a03168252018d600960209081029190910151600160a060020a03168252018c6009602090810291909101518252018c600a602090810291909101518252018c600b602090810291909101518252018c600c602090810291909101518252018d600a60209081029190910151600160a060020a03168252018b6004602002015160ff1660018111156120e857fe5b60018111156120f357fe5b81526020018b6005602002015160ff16600181111561210e57fe5b600181111561211957fe5b81526020018b6006602002015160ff16600181111561213457fe5b600181111561213f57fe5b81526101608e0151600160a060020a0316602082015260e08c015160409091019060ff16600181111561216e57fe5b600181111561217957fe5b8152602081018a9052604081018890526101808e0151600160a060020a031660608201526080810186905260a0018d600d60209081029190910151600160a060020a031682526101a08e0151908201526101c08d015160408201526101e08d015160608201526102008d015160808201526102208d015160a0909101529050612202828261371c565b9c9b505050505050505050505050565b61221a614b3a565b604080516102e0810182528c51600160a060020a0390811682526020808f01518216818401528e8401518216838501528d51606080850191909152908e01516080840152928d015160a08301528c83015160c0830152918d015190911660e082015261010081018a600181111561228d57fe5b815260200189600181111561229e57fe5b81526020018860018111156122af57fe5b815260808d0151600160a060020a031660208201526040018760018111156122d357fe5b8152602081018790526040810186905260a0808e0151600160a060020a0316606083015260808201869052018c600660209081029190910151600160a060020a031682526080808e01519183019190915260a0808e0151604084015260c08e0151606084015260e08e0151918301919091526101008d0151910152905061235a81836138f6565b5050505050505050505050565b600254600160a060020a031681565b60065481565b604080516102e0810182528a51600160a060020a0390811682526020808d01518216818401528c8401518216838501528b51606080850191909152908c01516080840152928b015160a08301528a83015160c0830152918b015190911660e08201526000906119899061010081018a60018111156123f657fe5b815260200189600181111561240757fe5b815260200188600181111561241857fe5b815260808d0151600160a060020a0316602082015260400187600181111561243c57fe5b8152602081018790526040810186905260a0808e0151600160a060020a0316606083015260808201869052018c600660209081029190910151600160a060020a031682526080808e01519183019190915260a0808e0151604084015260c08e0151606084015260e08e0151918301919091526101008d015191015261335a565b60046020526000908152604090205460ff1681565b6000546101009004600160a060020a031681565b600154600160a060020a031681565b604080516102e081019091526126bc90808e600060209081029190910151600160a060020a03168252018e600160209081029190910151600160a060020a03168252018e600260209081029190910151600160a060020a03168252018d6000602090810291909101518252018d6001602090810291909101518252018d6002602090810291909101518252018d6003602090810291909101518252018e60036020020151600160a060020a031681526020018c60018111156125b257fe5b81526020018b60018111156125c357fe5b81526020018a60018111156125d457fe5b815260808f0151600160a060020a031660208201526040018960018111156125f857fe5b815260208101899052604081018890526060018e60056020020151600160a060020a031681526020018681526020018e600660078110151561263657fe5b60209081029190910151600160a060020a03168252018d6004602090810291909101518252018d6005602090810291909101518252018d6006602090810291909101518252018d6007602090810291909101518252018d6008602090810291909101519091526040805160608101825260ff881681529182018690528101849052613cba565b505050505050505050505050565b604080516102e0810182528c51600160a060020a0390811682526020808f01518216818401528e8401518216838501528d51606080850191909152908e01516080840152928d015160a08301528c83015160c0830152918d015190911660e0820152895161235a919061010082019060ff16600181111561274757fe5b600181111561275257fe5b81526020018b6001602002015160ff16600181111561276d57fe5b600181111561277857fe5b81526020018b6002602002015160ff16600181111561279357fe5b600181111561279e57fe5b815260808e0151600160a060020a0316602082015260608c015160409091019060ff1660018111156127cc57fe5b60018111156127d757fe5b8152602081018b90526040810189905260a0808f0151600160a060020a0316606083015260808201889052018d600660209081029190910151600160a060020a03168252018c6004602090810291909101518252018c6005602090810291909101518252018c6006602090810291909101518252018c6007602090810291909101518252018c6008602002015190526040805160608101909152808560006020908102919091015160ff168252018460006020908102919091015182520184600160200201519052604080516102e08101909152808f600760209081029190910151600160a060020a03168252018f600860209081029190910151600160a060020a03168252018f600960209081029190910151600160a060020a03168252018e6009602090810291909101518252018e600a602090810291909101518252018e600b602090810291909101518252018e600c602090810291909101518252018f600a60209081029190910151600160a060020a03168252018d6004602002015160ff16600181111561296657fe5b600181111561297157fe5b81526020018d6005602002015160ff16600181111561298c57fe5b600181111561299757fe5b81526020018d6006602002015160ff1660018111156129b257fe5b60018111156129bd57fe5b81526020018f600b60209081029190910151600160a060020a03168252018d6007602002015160ff1660018111156129f157fe5b60018111156129fc57fe5b8152602081018c9052604081018a90526060018f600c6020020151600160a060020a031681526020018781526020018f600d600e81101515612a3a57fe5b60209081029190910151600160a060020a03168252018e600d602090810291909101518252018e600e602090810291909101518252018e600f602090810291909101518252018e6010602090810291909101518252018e6011602002015190526040805160608101909152808760016020908102919091015160ff1682520186600260209081029190910151825201866003602002015190528560046020020151613d27565b6000612aea614b3a565b604080516102e0810182528c51600160a060020a0390811682526020808f01518216818401528e8401518216838501528d51606080850191909152908e01516080840152928d015160a08301528c83015160c0830152918d015190911660e082015261010081018a6001811115612b5d57fe5b8152602001896001811115612b6e57fe5b8152602001886001811115612b7f57fe5b815260808d0151600160a060020a03166020820152604001876001811115612ba357fe5b8152602081018790526040810186905260a0808e0151600160a060020a0316606083015260808201869052018c600660209081029190910151600160a060020a031682526080808e01519183019190915260a0808e0151604084015260c08e0151606084015260e08e0151918301919091526101008d01519101529050612c2981614270565b9b9a5050505050505050505050565b61271081565b6000612c48614b3a565b612c50614b3a565b604080516102e08101909152808d600060209081029190910151600160a060020a03168252018d600160209081029190910151600160a060020a03168252018d600260209081029190910151600160a060020a03168252018c6000602090810291909101518252018c6001602090810291909101518252018c6002602090810291909101518252018c6003602090810291909101518252018d600360209081029190910151600160a060020a03168252018b6000602002015160ff166001811115612d1757fe5b6001811115612d2257fe5b81526020018b6001602002015160ff166001811115612d3d57fe5b6001811115612d4857fe5b81526020018b6002602002015160ff166001811115612d6357fe5b6001811115612d6e57fe5b815260808e0151600160a060020a0316602082015260608c015160409091019060ff166001811115612d9c57fe5b6001811115612da757fe5b8152602081018b90526040810189905260a0808f0151600160a060020a0316606083015260808201889052018d600660209081029190910151600160a060020a03168252018c6004602090810291909101518252018c6005602090810291909101518252018c6006602090810291909101518252018c6007602090810291909101518252018c600860200201519052604080516102e08101909152909250808d600760209081029190910151600160a060020a03168252018d600860209081029190910151600160a060020a03168252018d600960209081029190910151600160a060020a03168252018c6009602090810291909101518252018c600a602090810291909101518252018c600b602090810291909101518252018c600c602090810291909101518252018d600a60209081029190910151600160a060020a03168252018b6004602002015160ff166001811115612f0057fe5b6001811115612f0b57fe5b81526020018b6005602002015160ff166001811115612f2657fe5b6001811115612f3157fe5b81526020018b6006602002015160ff166001811115612f4c57fe5b6001811115612f5757fe5b81526101608e0151600160a060020a0316602082015260e08c015160409091019060ff166001811115612f8657fe5b6001811115612f9157fe5b8152602081018a9052604081018890526101808e0151600160a060020a031660608201526080810186905260a0018d600d60209081029190910151600160a060020a031682526101a08e0151908201526101c08d015160408201526101e08d015160608201526102008d015160808201526102208d015160a090910152905061220282826142f7565b60056020526000908152604090205460ff1681565b6000546101009004600160a060020a0316331461304b57600080fd5b600160a060020a038116151561306057600080fd5b60008054604051600160a060020a038085169361010090930416917f8be0079c531659141344cd1fd0a4f28419497f9722a3daafe3b4186f6b6457e091a360008054600160a060020a039092166101000274ffffffffffffffffffffffffffffffffffffffff0019909216919091179055565b6000808251111561311057815180602001830160208401855b600183831014156131075781518152602091820191016130ec565b50505092909201915b50815b92915050565b60008060008451865114151561312e57600080fd5b835186511461313c57600080fd5b855160209004925060208084029250839083041461315657fe5b5060005b82811015613186576001016020810284810151868201519188018051928216911990921617905261315a565b60008311156131b65782905080600101602002808501518187015181168289015182191617828901525050613298565b50805b85518110156132985784818151811015156131d057fe5b90602001015160f860020a900460f860020a0284828151811015156131f157fe5b90602001015160f860020a900460f860020a0216868281518110151561321357fe5b90602001015160f860020a900460f860020a02858381518110151561323457fe5b90602001015160f860020a900460f860020a0260ff60f860020a02181617868281518110151561326057fe5b9060200101907effffffffffffffffffffffffffffffffffffffffffffffffffffffffffffff1916908160001a9053506001016131b9565b505050505050565b600160a060020a03166c0100000000000000000000000002815260140190565b60006132ee826101200151836101400151846102400151856102600151866102800151876102a0015161349a565b90505b919050565b8151815160009160019181148083146133125760009250613350565b600160208701838101602088015b60028483851001141561334b57805183511461333f5760009650600093505b60209283019201613320565b505050505b5090949350505050565b60006133658261352d565b604080517f19457468657265756d205369676e6564204d6573736167653a0a3332000000008152601c8101929092525190819003603c0190209050919050565b60006133b083614270565b15156133be5750600061177f565b60008481526004602052604090205460ff16156133dd5750600061177f565b60008481526005602052604090205460ff16156133fc5750600161177f565b602080840151835184830151604080870151815160008082528188018085528c905260ff909516818401526060810193909352608083015251600160a060020a039093169360019360a0808401949293601f19830193908390039091019190865af115801561346f573d6000803e3d6000fd5b50505060206040510351600160a060020a031614156134905750600161177f565b5060009392505050565b600080808760018111156134aa57fe5b14156134b857859150613522565b60018760018111156134c657fe5b1415613522576134f16134e2866134dd4288614387565b614399565b6134ec8587614387565b6143c2565b9050600188600181111561350157fe5b1415613518576135118682614387565b9150613522565b61351186826143d7565b509695505050505050565b6000806060600061353d856143e4565b9250826040519080825280601f01601f19166020018201604052801561356d578160200160208202803883390190505b5091506020820190506135848186600001516132a0565b90506135948186602001516132a0565b90506135a48186604001516132a0565b90506135b4818660600151614404565b90506135c4818660800151614404565b90506135d4818660a00151614404565b90506135e4818660c00151614404565b90506135f4818660e001516132a0565b905061361081866101000151600181111561360b57fe5b61440c565b905061362781866101200151600181111561360b57fe5b905061363e81866101400151600181111561360b57fe5b905061364f818661016001516132a0565b905061366681866101800151600181111561360b57fe5b905061367781866101a001516130d3565b905061368881866101c001516130d3565b905061369981866101e001516132a0565b90506136aa818661020001516130d3565b90506136bb818661022001516132a0565b90506136cc81866102400151614404565b90506136dd81866102600151614404565b90506136ee81866102800151614404565b90506136ff81866102a00151614404565b905061371081866102c00151614404565b50506020012092915050565b600080836101200151600181111561373057fe5b14801561374d57506001826101200151600181111561374b57fe5b145b80156137785750816101000151600181111561376557fe5b836101000151600181111561377657fe5b145b801561379f5750816102200151600160a060020a0316836102200151600160a060020a0316145b80156137d957506040820151600160a060020a031615806137d957508260200151600160a060020a03168260400151600160a060020a0316145b801561381357506040830151600160a060020a0316158061381357508160200151600160a060020a03168360400151600160a060020a0316145b801561386e575060e0820151600160a060020a0316158015613841575060e0830151600160a060020a031615155b8061386e575060e0820151600160a060020a03161580159061386e575060e0830151600160a060020a0316155b80156138955750816101600151600160a060020a0316836101600151600160a060020a0316145b80156138c0575081610180015160018111156138ad57fe5b83610180015160018111156138be57fe5b145b80156138db57506138db836102800151846102a00151614419565b801561177f575061177f826102800151836102a00151614419565b6020820151600090600160a060020a0316331461391257600080fd5b61391b8361335a565b60008181526005602052604090205490915060ff161561393a57600080fd5b600160056000836000191660001916815260200190815260200160002060006101000a81548160ff0219169083151502179055508260e00151600160a060020a03168360200151600160a060020a031682600019167f90c7f9f5b58c15f0f635bfb99f55d3d78fdbef3559e7d8abf5c81052a527662286600001518760400151886060015189608001518a60a001518b60c001518c61010001518d61012001518e61014001518f6101600151604051808b600160a060020a0316600160a060020a031681526020018a600160a060020a0316600160a060020a03168152602001898152602001888152602001878152602001868152602001856001811115613a3e57fe5b60ff168152602001846001811115613a5257fe5b60ff168152602001836001811115613a6657fe5b60ff168152600160a060020a039092166020830152506040805191829003019950975050505050505050a480600019167fe55393c778364e440d958b39ac1debd99dcfae3775a8a04d1e79124adf6a2d08846101800151856101a00151866101c00151876101e001518861020001518961022001518a61024001518b61026001518c61028001518d6102a001518e6102c001518e604051808d6001811115613b0a57fe5b60ff16815260200180602001806020018c600160a060020a0316600160a060020a03168152602001806020018b600160a060020a0316600160a060020a031681526020018a81526020018981526020018881526020018781526020018681526020018515151515815260200184810384528f818151815260200191508051906020019080838360005b83811015613bab578181015183820152602001613b93565b50505050905090810190601f168015613bd85780820380516001836020036101000a031916815260200191505b5084810383528e818151815260200191508051906020019080838360005b83811015613c0e578181015183820152602001613bf6565b50505050905090810190601f168015613c3b5780820380516001836020036101000a031916815260200191505b5084810382528c5181528c516020918201918e019080838360005b83811015613c6e578181015183820152602001613c56565b50505050905090810190601f168015613c9b5780820380516001836020036101000a031916815260200191505b509f5050505050505050505050505050505060405180910390a2505050565b6000613cc68383614435565b6020840151909150600160a060020a03163314613ce257600080fd5b600081815260046020526040808220805460ff191660011790555182917f5152abf959f6564662358c2e52b702259b78bac5ee7842a0f01937e670efcc7d91a2505050565b6000805481908190819081908190819060ff1615613d4457600080fd5b6000805460ff1916600117905560208c0151600160a060020a0316331415613d7f57613d6f8c614270565b1515613d7a57600080fd5b613d8c565b613d898c8c614435565b96505b60208a0151600160a060020a0316331415613dba57613daa8a614270565b1515613db557600080fd5b613dc7565b613dc48a8a614435565b95505b613dd18c8b61371c565b1515613ddc57600080fd5b6101608a0151803b9550935060008511613df557600080fd5b60008c6101c00151511115613e1e57613e1e8c6101a001518b6101a001518e6101c00151613119565b60008a6101c00151511115613e4757613e478a6101a001518d6101a001518c6101c00151613119565b613e5b8c6101a001518b6101a001516132f6565b1515613e6657600080fd5b6002546020808c0151604080517fc4552791000000000000000000000000000000000000000000000000000000008152600160a060020a0392831660048201529051919093169263c45527919260248083019391928290030181600087803b158015613ed157600080fd5b505af1158015613ee5573d6000803e3d6000fd5b505050506040513d6020811015613efb57600080fd5b50519250600160a060020a0383161515613f1457600080fd5b600260009054906101000a9004600160a060020a0316600160a060020a03166397204d8e6040518163ffffffff1660e060020a028152600401602060405180830381600087803b158015613f6757600080fd5b505af1158015613f7b573d6000803e3d6000fd5b505050506040513d6020811015613f9157600080fd5b5051604080517f5c60da1b0000000000000000000000000000000000000000000000000000000081529051600160a060020a0392831692861691635c60da1b9160048083019260209291908290030181600087803b158015613ff257600080fd5b505af1158015614006573d6000803e3d6000fd5b505050506040513d602081101561401c57600080fd5b5051600160a060020a03161461403157600080fd5b60208c0151839250600160a060020a03163314614062576000878152600460205260409020805460ff191660011790555b60208a0151600160a060020a03163314614090576000868152600460205260409020805460ff191660011790555b61409a8c8b614459565b905081600160a060020a0316631b0f7ba98b61016001518c61018001518d6101a001516040518463ffffffff1660e060020a0281526004018084600160a060020a0316600160a060020a031681526020018360018111156140f757fe5b60ff16815260200180602001828103825283818151815260200191508051906020019080838360005b83811015614138578181015183820152602001614120565b50505050905090810190601f1680156141655780820380516001836020036101000a031916815260200191505b50945050505050602060405180830381600087803b15801561418657600080fd5b505af115801561419a573d6000803e3d6000fd5b505050506040513d60208110156141b057600080fd5b505115156141bd57600080fd5b60e08a01518890600160a060020a031615156141dd578a602001516141e3565b8c602001515b60e08c0151600160a060020a0391821691161515614205578d6020015161420b565b8b602001515b604080518b8152602081018b90528082018690529051600160a060020a0392909216917fc4109843e0b7d514e4c093114b863f8e7d8d9a458c372cd51bfe526b588006c99181900360600190a450506000805460ff1916905550505050505050505050565b8051600090600160a060020a0316301461428c575060006132f1565b6142a0826101400151836102a00151614a39565b15156142ae575060006132f1565b600182610100015160018111156142c157fe5b1480156142e257506006548260a0015110806142e257506007548260c00151105b156142ef575060006132f1565b506001919050565b6000806000614328846101200151856101400151866102400151876102600151886102800151896102a0015161349a565b91506143568561012001518661014001518761024001518861026001518961028001518a6102a0015161349a565b90508181101561436557600080fd5b60e0840151600160a060020a0316151561437f5780611a4e565b509392505050565b60008282111561439357fe5b50900390565b60008215156143aa57506000613113565b508181028183828115156143ba57fe5b041461311357fe5b600081838115156143cf57fe5b049392505050565b8181018281101561311357fe5b610200810151516101c0820151516101a08301515101016101b001919050565b815260200190565b6000818353505060010190565b6000428310801561177f575081158061177f5750504210919050565b6000806144418461335a565b905061444e8185856133a5565b151561177f57600080fd5b600080600080600080600080600080600160a060020a03168a6102200151600160a060020a031614151561449257341561449257600080fd5b61449c8b8b6142f7565b97506000881180156144bb57506102208a0151600160a060020a031615155b156144d9576144d98a61022001518c602001518c602001518b614a58565b60e08a0151889750879650600160a060020a0316156147f5576080808c0151908b0151111561450757600080fd5b60018a6101000151600181111561451a57fe5b14156147c25760c0808c0151908b0151111561453557600080fd5b60008a6060015111156145d95761455b6145538b606001518a614399565b6127106143c2565b6102208b0151909550600160a060020a031615156145c05761457d8786614387565b60e08b0151604051919850600160a060020a03169086156108fc029087906000818181858888f193505050501580156145ba573d6000803e3d6000fd5b506145d9565b6145d98a61022001518b602001518c60e0015188614a58565b60008a608001511115614675576145f76145538b608001518a614399565b6102208b0151909450600160a060020a0316151561465c5761461986856143d7565b60e08b0151604051919750600160a060020a03169085156108fc029086906000818181858888f19350505050158015614656573d6000803e3d6000fd5b50614675565b6146758a61022001518c602001518c60e0015187614a58565b60008a60a001511115614719576146936145538b60a001518a614399565b6102208b0151909350600160a060020a031615156146f6576146b58784614387565b600854604051919850600160a060020a03169084156108fc029085906000818181858888f193505050501580156146f0573d6000803e3d6000fd5b50614719565b6102208a015160208b0151600854614719929190600160a060020a031686614a58565b60008a60c0015111156147bd576147376145538b60c001518a614399565b6102208b0151909250600160a060020a0316151561479a5761475986836143d7565b600854604051919750600160a060020a03169083156108fc029084906000818181858888f19350505050158015614794573d6000803e3d6000fd5b506147bd565b6102208a015160208c01516008546147bd929190600160a060020a031685614a58565b6147f0565b6147d98a602001518b60e001518c60600151614b1d565b6147f08b602001518b60e001518c60800151614b1d565b614976565b6080808b0151908c0151111561480a57600080fd5b60018a6101000151600181111561481d57fe5b1415614948576102208a0151600160a060020a0316151561483d57600080fd5b60c0808b0151908c0151111561485257600080fd5b60008b60600151111561488b576148706145538c606001518a614399565b945061488b8a61022001518c602001518d60e0015188614a58565b60008b6080015111156148c4576148a96145538c608001518a614399565b93506148c48a61022001518b602001518d60e0015187614a58565b60008b60a001511115614906576148e26145538c60a001518a614399565b6102208b015160208d015160085492955061490692600160a060020a031686614a58565b60008b60c0015111156147f0576149246145538c60c001518a614399565b6102208b015160208c01516008549294506147f092600160a060020a031685614a58565b61495f8b602001518c60e001518d60600151614b1d565b6149768a602001518c60e001518d60800151614b1d565b6102208a0151600160a060020a03161515614a2a573486111561499857600080fd5b8960200151600160a060020a03166108fc889081150290604051600060405180830381858888f193505050501580156149d5573d6000803e3d6000fd5b506149e03487614387565b90506000811115614a2a578a60200151600160a060020a03166108fc829081150290604051600060405180830381858888f19350505050158015614a28573d6000803e3d6000fd5b505b50959998505050505050505050565b600080836001811115614a4857fe5b148061177f575050600010919050565b6000811115614b1757600354604080517f15dacbea000000000000000000000000000000000000000000000000000000008152600160a060020a0387811660048301528681166024830152858116604483015260648201859052915191909216916315dacbea9160848083019260209291908290030181600087803b158015614ae057600080fd5b505af1158015614af4573d6000803e3d6000fd5b505050506040513d6020811015614b0a57600080fd5b50511515614b1757600080fd5b50505050565b600154614b3590600160a060020a0316848484614a58565b505050565b604080516102e081018252600080825260208201819052918101829052606081018290526080810182905260a0810182905260c0810182905260e081018290529061010082019081526020016000815260200160008152600060208201819052604090910190815260200160608152602001606081526020016000600160a060020a03168152602001606081526020016000600160a060020a03168152602001600081526020016000815260200160008152602001600081526020016000815250905600a165627a7a723058208f42066445f61fbcc76f8d3c008f50ae0e410fc86a1f4f86ded08e5c84dff6c40029",
  "devdoc": {
    "methods": {
      "approveOrder_(address[7],uint256[9],uint8,uint8,uint8,uint8,bytes,bytes,bytes,bool)": {
        "details": "Call approveOrder - Solidity ABI encoding limitation workaround, hopefully temporary."
      },
      "atomicMatch_(address[14],uint256[18],uint8[8],bytes,bytes,bytes,bytes,bytes,bytes,uint8[2],bytes32[5])": {
        "details": "Call atomicMatch - Solidity ABI encoding limitation workaround, hopefully temporary."
      },
      "calculateCurrentPrice_(address[7],uint256[9],uint8,uint8,uint8,uint8,bytes,bytes,bytes)": {
        "details": "Call calculateCurrentPrice - Solidity ABI encoding limitation workaround, hopefully temporary."
      },
      "calculateFinalPrice(uint8,uint8,uint256,uint256,uint256,uint256)": {
        "details": "Call calculateFinalPrice - library function exposed for testing."
      },
      "calculateMatchPrice_(address[14],uint256[18],uint8[8],bytes,bytes,bytes,bytes,bytes,bytes)": {
        "details": "Call calculateMatchPrice - Solidity ABI encoding limitation workaround, hopefully temporary."
      },
      "cancelOrder_(address[7],uint256[9],uint8,uint8,uint8,uint8,bytes,bytes,bytes,uint8,bytes32,bytes32)": {
        "details": "Call cancelOrder - Solidity ABI encoding limitation workaround, hopefully temporary."
      },
      "changeMinimumMakerProtocolFee(uint256)": {
        "details": "Change the minimum maker fee paid to the protocol (owner only)",
        "params": {
          "newMinimumMakerProtocolFee": "New fee to set in basis points"
        }
      },
      "changeMinimumTakerProtocolFee(uint256)": {
        "details": "Change the minimum taker fee paid to the protocol (owner only)",
        "params": {
          "newMinimumTakerProtocolFee": "New fee to set in basis points"
        }
      },
      "changeProtocolFeeRecipient(address)": {
        "details": "Change the protocol fee recipient (owner only)",
        "params": {
          "newProtocolFeeRecipient": "New protocol fee recipient address"
        }
      },
      "guardedArrayReplace(bytes,bytes,bytes)": {
        "details": "Call guardedArrayReplace - library function exposed for testing."
      },
      "hashOrder_(address[7],uint256[9],uint8,uint8,uint8,uint8,bytes,bytes,bytes)": {
        "details": "Call hashOrder - Solidity ABI encoding limitation workaround, hopefully temporary."
      },
      "hashToSign_(address[7],uint256[9],uint8,uint8,uint8,uint8,bytes,bytes,bytes)": {
        "details": "Call hashToSign - Solidity ABI encoding limitation workaround, hopefully temporary."
      },
      "orderCalldataCanMatch(bytes,bytes,bytes,bytes)": {
        "details": "Return whether or not two orders' calldata specifications can match",
        "params": {
          "buyCalldata": "Buy-side order calldata",
          "buyReplacementPattern": "Buy-side order calldata replacement mask",
          "sellCalldata": "Sell-side order calldata",
          "sellReplacementPattern": "Sell-side order calldata replacement mask"
        },
        "return": "Whether the orders' calldata can be matched"
      },
      "ordersCanMatch_(address[14],uint256[18],uint8[8],bytes,bytes,bytes,bytes,bytes,bytes)": {
        "details": "Call ordersCanMatch - Solidity ABI encoding limitation workaround, hopefully temporary."
      },
      "renounceOwnership()": {
        "details": "Allows the current owner to relinquish control of the contract."
      },
      "staticCall(address,bytes,bytes)": {
        "details": "Execute a STATICCALL (introduced with Ethereum Metropolis, non-state-modifying external call)",
        "params": {
          "calldata": "Calldata (appended to extradata)",
          "extradata": "Base data for STATICCALL (probably function selector and argument encoding)",
          "target": "Contract to call"
        },
        "return": "The result of the call (success or failure)"
      },
      "testCopy(bytes)": {
        "params": {
          "arrToCopy": "Array to copy"
        },
        "return": "byte array"
      },
      "testCopyAddress(address)": {
        "params": {
          "addr": "Address to write"
        },
        "return": "byte array"
      },
      "transferOwnership(address)": {
        "details": "Allows the current owner to transfer control of the contract to a newOwner.",
        "params": {
          "newOwner": "The address to transfer ownership to."
        }
      },
      "validateOrderParameters_(address[7],uint256[9],uint8,uint8,uint8,uint8,bytes,bytes,bytes)": {
        "details": "Call validateOrderParameters - Solidity ABI encoding limitation workaround, hopefully temporary."
      },
      "validateOrder_(address[7],uint256[9],uint8,uint8,uint8,uint8,bytes,bytes,bytes,uint8,bytes32,bytes32)": {
        "details": "Call validateOrder - Solidity ABI encoding limitation workaround, hopefully temporary."
      }
    }
  },
  "userdoc": {
    "methods": {
      "testCopy(bytes)": {
        "notice": "Test copy byte array"
      },
      "testCopyAddress(address)": {
        "notice": "Test write address to bytes"
      }
    }
  }
}